あいあいかんせつさつえい	I・I間接撮影	win	名詞
あいえるざしょうこうぐん	アイエルザ症候群	win	名詞
あいかるでぃしょうこうぐん	アイカルディ症候群	win	名詞
あいこざーるくりーむ	アイコザールクリーム	win	名詞
あいごてきそうさ	愛護的操作	mac	名詞
あいさいぼうびょう	I細胞病	win	名詞
あいざっくしょうこうぐん	アイザック症候群	win	名詞
あいざっくすしょうこうぐん	アイザックス症候群	win	名詞
あいじょうけつじょせいしんびょうしつ	愛情欠如精神病質	win	名詞
あいぜんめんげるしょうこうぐん	アイゼンメンゲル症候群	win	名詞
あいそたいぷ	アイソタイプ	mac	名詞
あいでいとろーる	アイデイトロール	win	名詞
あいぴーかんせつねんざ	IP関節捻挫	win	名詞
あいれうす	亜イレウス	win	名詞
あいろみーる	アイロミール	win	名詞
あいんてーるどらいしろっぷ	アインテールドライシロップ	win	名詞
あいんとーふぇん	アイントーフェン	mac	名詞
あいんとーふぇんさんかく	アイントーフェン三角	mac	名詞
あいんとーふぇんのほうそく	アイントーフェンの法則	mac	名詞
あいんふむ	アインフム	win	名詞
あうえるしょうたい	アウエル小体	mac	名詞
あうえるばっは	アウエルバッハ	mac	名詞
あうえるばっはのきんかんしんけいそう	アウエルバッハの筋間神経叢	mac	名詞
あうしゅぴっつげんしょう	Auspitz現象	win	名詞
あうじぇすきーびょう	アウジェスキー病	win	名詞
あうすぴっつげんしょう	Auspitz現象	win	名詞
あうすぴっつげんしょう	アウスピッツ現象	mac	名詞
あえんか	亜鉛華	win	名詞
あえんかでんぷん	亜鉛華デンプン	win	名詞
あえんかなんこう	亜鉛華軟膏	win	名詞
あえんけつぼうしょう	亜鉛欠乏症	win	名詞
あえんたいしゃしょうがい	亜鉛代謝障害	win	名詞
あえんちゅうどく	亜鉛中毒	win	名詞
あおいろ	青色	win	名詞
あおいろごむまりようぼはんしょうこうぐん	青色ゴムまり様母斑症候群	win	名詞
あかいろぼろせんい	赤色ぼろ線維	both	名詞
あかしじあ	アカシジア	mac	名詞
あかつきびょう	アカツキ病	win	名詞
あからがお	あから顔	win	名詞
あからしあ	アカラシア	mac	名詞
あからじあ	アカラジア	win	名詞
あかるぼーす	アカルボース	both	名詞
あかんとあめーば	アカントアメーバ	mac	名詞
あかんとあめーばかくまくえん	アカントアメーバ角膜炎	win	名詞
あかんとあめーばしょう	アカントアメーバ症	win	名詞
あかんとりーぜせいしょうがい	アカントリーゼ性障害	win	名詞
あがろーす	アガロース	mac	名詞
あきえき	秋疫	win	名詞
あきえきえーこうたいか	秋疫A抗体価	win	名詞
あきえきしーこうたいか	秋疫C抗体価	win	名詞
あきえきびーこうたいか	秋疫B抗体価	win	名詞
あきやみ	秋疫	win	名詞
あきゅうせい	亜急性	both	名詞
あきゅうせいあるこーるせいかんふぜん	亜急性アルコール性肝不全	win	名詞
あきゅうせいあれるぎーせいちゅうじえん	亜急性アレルギー性中耳炎	win	名詞
あきゅうせいえしせい	亜急性壊死性	win	名詞
あきゅうせいえしせいせきずいえん	亜急性壊死性脊髄炎	win	名詞
あきゅうせいえしせいせきずいしょう	亜急性壊死性脊髄症	win	名詞
あきゅうせいえしせいみえろぱしー	亜急性壊死性ミエロパシー	win	名詞
あきゅうせいえしせいみえろぱちー	亜急性壊死性ミエロパチー	win	名詞
あきゅうせいえしせいりんぱせつえん	亜急性壊死性リンパ節炎	mac	名詞
あきゅうせいかいめんじょうのうしょう	亜急性海綿状脳症	both	名詞
あきゅうせいかのうせいちゅうすいえん	亜急性化膿性虫垂炎	win	名詞
あきゅうせいかんえん	亜急性肝炎	win	名詞
あきゅうせいかんせつえん	亜急性関節炎	win	名詞
あきゅうせいかんせんしょうせいせいしんびょう	亜急性感染症性精神病	win	名詞
あきゅうせいかんせんせいしんないまくえん	亜急性感染性心内膜炎	win	名詞
あきゅうせいき	亜急性期	mac	名詞
あきゅうせいきかんしえん	亜急性気管支炎	win	名詞
あきゅうせいきしつせいしんしょうこうぐん	亜急性器質精神症候群	win	名詞
あきゅうせいきしつせいはんのう	亜急性器質性反応	win	名詞
あきゅうせいきょけつせいだいちょうえん	亜急性虚血性大腸炎	win	名詞
あきゅうせいけっせいちゅうじえん	亜急性血性中耳炎	win	名詞
あきゅうせいけっせんしょう	亜急性血栓症	mac	名詞
あきゅうせいけつまくえん	亜急性結膜炎	win	名詞
あきゅうせいこうかせいぜんのうえん	亜急性硬化性全脳炎	both	名詞
あきゅうせいこうさいえん	亜急性虹彩炎	win	名詞
あきゅうせいこうさいもうようたいえん	亜急性虹彩毛様体炎	win	名詞
あきゅうせいこうじょうせんえん	亜急性甲状腺炎	both	名詞
あきゅうせいこうはんせいろうそう	亜急性紅斑性狼瘡	win	名詞
あきゅうせいこつずいえん	亜急性骨髄炎	win	名詞
あきゅうせいさいきんせいしんないまくえん	亜急性細菌性心内膜炎	win	名詞
あきゅうせいさいきんせいしんまくえん	亜急性細菌性心膜炎	win	名詞
あきゅうせいさくらんじょうたい	亜急性錯乱状態	win	名詞
あきゅうせいしゅっけつせいはくしつのうえん	亜急性出血性白質脳炎	win	名詞
あきゅうせいしょうえき	亜急性漿液	win	名詞
あきゅうせいしょうえきむちんせいちゅうじえん	亜急性漿液ムチン性中耳炎	win	名詞
あきゅうせいしょうのうへんせいしょう	亜急性小脳変性症	win	名詞
あきゅうせいしんないまくえん	亜急性心内膜炎	win	名詞
あきゅうせいじんえん	亜急性腎炎	win	名詞
あきゅうせいすいえん	亜急性膵炎	win	名詞
あきゅうせいせきずいせいれんごうへんせいしょう	亜急性脊髄連合変性症	win	名詞
あきゅうせいせきずいれんごうへんせいしょう	亜急性脊髄連合変性症	mac	名詞
あきゅうせいぜんぶ	亜急性前部	win	名詞
あきゅうせいぜんぶぶどうまくえん	亜急性前部ぶどう膜炎	win	名詞
あきゅうせいちっそくし	亜急性窒息死	mac	名詞
あきゅうせいちゅうすいえん	亜急性虫垂炎	win	名詞
あきゅうせいのうしょうこうぐん	亜急性脳症候群	win	名詞
あきゅうせいひふ	亜急性皮膚	win	名詞
あきゅうせいひふえりてまとーです	亜急性皮膚エリテマトーデス	win	名詞
あきゅうせいむこいどちゅうじえん	亜急性ムコイド中耳炎	win	名詞
あきゅうせいもうようたいえん	亜急性毛様体炎	win	名詞
あきゅうせいようしん	亜急性痒疹	win	名詞
あきゅうせいりんぱかんえん	亜急性リンパ管炎	win	名詞
あきゅうせいるい	亜急性涙	win	名詞
あきゅうせいるいのうえん	亜急性涙嚢炎	win	名詞
あきゅうせいるいびそ	亜急性類鼻疽	win	名詞
あきゅうせいれっこう	亜急性裂肛	win	名詞
あきゅうせいれんごうせいせきずいへんせいしょう	亜急性連合性脊髄変性症	both	名詞
あきゅうせいれんごうせいへんせいしょう	亜急性連合性変性症	win	名詞
あきょう	アキョウ	win	名詞
あきれすけん	アキレス腱	both	名詞
あきれすけんえん	アキレス腱炎	win	名詞
あきれすけんかつえきほうえん	アキレス腱滑液包炎	win	名詞
あきれすけんかつまくのうえん	アキレス腱滑膜嚢炎	win	名詞
あきれすけんきんけんいこうぶだんれつ	アキレス腱筋腱移行部断裂	win	名詞
あきれすけんけんしょうえん	アキレス腱腱鞘炎	win	名詞
あきれすけんざしょう	アキレス腱挫傷	win	名詞
あきれすけんざそう	アキレス腱挫創	win	名詞
あきれすけんしゅういえん	アキレス腱周囲炎	win	名詞
あきれすけんせっそう	アキレス腱切創	win	名詞
あきれすけんせつだん	アキレス腱切断	win	名詞
あきれすけんそんしょう	アキレス腱損傷	win	名詞
あきれすけんだんれつ	アキレス腱断裂	both	名詞
あきれすけんだんれつしゅじゅつ	アキレス腱断裂手術	win	名詞
あきれすけんつう	アキレス腱痛	win	名詞
あきれすけんねんえきほうえん	アキレス腱粘液包炎	win	名詞
あきれすけんはんしゃ	アキレス腱反射	mac	名詞
あきれすけんひかだんれつ	アキレス腱皮下断裂	win	名詞
あきれすけんふちゃくぶつう	アキレス腱付着部痛	win	名詞
あきれすけんぶせっかいかしょう	アキレス腱部石灰化症	win	名詞
あきれすけんぶつう	アキレス腱部痛	win	名詞
あきれすけんぶぶんだんれつ	アキレス腱部分断裂	win	名詞
あきれすしゅういのうよう	アキレス周囲膿瘍	win	名詞
あくあちむなんこう	アクアチム軟膏	win	名詞
あくいき	亜区域	mac	名詞
あくいきせつじょ	亜区域切除	win	名詞
あくえきしつ	悪液質	both	名詞
あくえきしつあふた	悪液質アフタ	win	名詞
あくせい	悪性	win	名詞
あくせいMたんぱくけっしょう	悪性M蛋白血症	win	名詞
あくせいいんすりのーま	悪性インスリノーマ	win	名詞
あくせいえなめるじょうひしゅ	悪性エナメル上皮腫	win	名詞
あくせいえむたんぱくけっしょう	悪性M蛋白血症	win	名詞
あくせいかすいたいしゅよう	悪性下垂体腫瘍	win	名詞
あくせいかすいたいせんしゅ	悪性下垂体腺腫	win	名詞
あくせいかっしょくさいぼうしゅ	悪性褐色細胞腫	win	名詞
あくせいかりゅうさいぼうしゅ	悪性顆粒細胞腫	win	名詞
あくせいかんせつ	悪性関節	win	名詞
あくせいかんせつりうまち	悪性関節リウマチ	both	名詞
あくせいかんせんしゅよう	悪性汗腺腫瘍	win	名詞
あくせいかんようしゅ	悪性間葉腫	win	名詞
あくせいかんようせいかごしゅ	悪性間葉性過誤腫	win	名詞
あくせいがいじえん	悪性外耳炎	win	名詞
あくせいがいじしゅよう	悪性外耳腫瘍	win	名詞
あくせいがいじどうえん	悪性外耳道炎	both	名詞
あくせいがくかぶしゅよう	悪性顎下部腫瘍	win	名詞
あくせいがすとりのーま	悪性ガストリノーマ	win	名詞
あくせいきけいしゅ	悪性奇形腫	win	名詞
あくせいきょうせんしゅ	悪性胸腺腫	win	名詞
あくせいきょうまくちゅうひしゅ	悪性胸膜中皮腫	both	名詞
あくせいきょさいぼうしゅ	悪性巨細胞腫	win	名詞
あくせいぐるかごのーま	悪性グルカゴノーマ	win	名詞
あくせいぐろーむすしゅよう	悪性グロームス腫瘍	win	名詞
あくせいけっかんがいひしゅ	悪性血管外皮腫	both	名詞
あくせいけっかんないひしゅ	悪性血管内皮腫	win	名詞
あくせいこうけつあつ	悪性高血圧	mac	名詞
あくせいこうけつあつしょう	悪性高血圧症	both	名詞
あくせいこうじょうせんしゅ	悪性甲状腺腫	win	名詞
あくせいこうじょうせんしゅよう	悪性甲状腺腫瘍	mac	名詞
あくせいこうねつ	悪性高熱	mac	名詞
あくせいこうねつしょう	悪性高熱症	both	名詞
あくせいこくし	悪性黒子	mac	名詞
あくせいこくしょくしゅ	悪性黒色腫	both	名詞
あくせいこつしゅよう	悪性骨腫瘍	win	名詞
あくせいしきゅうしゅよう	悪性子宮腫瘍	win	名詞
あくせいしゅよう	悪性腫瘍	both	名詞
あくせいしゅよういでんしけんさ	悪性腫瘍遺伝子検査	win	名詞
あくせいしゅようがっぺいせいひふきんえん	悪性腫瘍合併性皮膚筋炎	win	名詞
あくせいしゅようこつてんい	悪性腫瘍骨転移	win	名詞
あくせいしゅようてんい	悪性腫瘍転移	win	名詞
あくせいしゅようにともなうひんけつ	悪性腫瘍に伴う貧血	win	名詞
あくせいしゅようはいてんい	悪性腫瘍肺転移	win	名詞
あくせいしょうこうぐん	悪性症候群	both	名詞
あくせいしょうのうしゅよう	悪性小脳腫瘍	win	名詞
あくせいしんけいこうしゅ	悪性神経膠腫	win	名詞
あくせいしんけいしょうしゅ	悪性神経鞘腫	win	名詞
あくせいしんせいぶつ	悪性新生物	mac	名詞
あくせいしんまくちゅうひしゅ	悪性心膜中皮腫	win	名詞
あくせいじゅうかくしゅよう	悪性縦隔腫瘍	win	名詞
あくせいじゅうもうじょうひしゅ	悪性絨毛上皮腫	win	名詞
あくせいじんこうかしょう	悪性腎硬化症	both	名詞
あくせいじんしゅよう	悪性腎腫瘍	win	名詞
あくせいすいないぶんぴしゅよう	悪性膵内分泌腫瘍	win	名詞
あくせいずいまくしゅ	悪性髄膜腫	win	名詞
あくせいせいじょうさいぼうしゅ	悪性星状細胞腫	win	名詞
あくせいせきさくしゅ	悪性脊索腫	win	名詞
あくせいせきずいしゅよう	悪性脊髄腫瘍	win	名詞
あくせいせきずいずいまくしゅ	悪性脊髄髄膜腫	win	名詞
あくせいせんいせいそしききゅうしゅ	悪性線維性組織球腫	both	名詞
あくせいそしききゅうしょう	悪性組織球症	win	名詞
あくせいそしききゅうしょうせいかんせつしょう	悪性組織球症性関節症	win	名詞
あくせいそまとすたちのーま	悪性ソマトスタチノーマ	win	名詞
あくせいだえきせんしゅよう	悪性唾液腺腫瘍	win	名詞
あくせいちゅうすいねんえきりゅう	悪性虫垂粘液瘤	win	名詞
あくせいちゅうひしゅ	悪性中皮腫	both	名詞
あくせいちょうしゅよう	悪性腸腫瘍	win	名詞
あくせいていりゅうこうがん	悪性停留睾丸	win	名詞
あくせいていりゅうせいそう	悪性停留精巣	win	名詞
あくせいてんか	悪性転化	mac	名詞
あくせいとうがいいんとうしゅ	悪性頭蓋咽頭腫	win	名詞
あくせいどぶんるい	悪性度分類	mac	名詞
あくせいにょうどうしゅよう	悪性尿道腫瘍	win	名詞
あくせいのうしつずいまくしゅ	悪性脳室髄膜腫	win	名詞
あくせいのうしゅよう	悪性脳腫瘍	win	名詞
あくせいのうずいまくしゅ	悪性脳髄膜腫	win	名詞
あくせいひまんさいぼうしゅ	悪性肥満細胞腫	win	名詞
あくせいひんけつ	悪性貧血	both	名詞
あくせいふくまくちゅうひしゅ	悪性腹膜中皮腫	win	名詞
あくせいほうじょうきたい	悪性胞状奇胎	win	名詞
あくせいほくろ	悪性黒子	win	名詞
あくせいぼうこうしゅよう	悪性膀胱腫瘍	win	名詞
あくせいぼうしんけいせつしゅ	悪性傍神経節腫	win	名詞
あくせいまっしょうしんけいしょうしゅ	悪性末梢神経鞘腫	win	名詞
あくせいようじょうしゅよう	悪性葉状腫瘍	win	名詞
あくせいらんそうしゅよう	悪性卵巣腫瘍	win	名詞
あくせいりょくないしょう	悪性緑内障	win	名詞
あくせいりんぱかんないひしゅ	悪性リンパ管内皮腫	win	名詞
あくせいりんぱしゅ	悪性リンパ腫	both	名詞
あくせいりんぱしゅこつずいしんじゅん	悪性リンパ腫骨髄浸潤	win	名詞
あくせさりーさいぼう	アクセサリー細胞	mac	名詞
あくせさりーぶんし	アクセサリー分子	mac	名詞
あくせつかん	握雪感	both	名詞
あくそん	アクソン	mac	名詞
あくたりっと	アクタリット	win	名詞
あくちのまいしん	アクチノマイシン	mac	名詞
あくちのみせすぞく	アクチノミセス属	mac	名詞
あくちびん	アクチビン	mac	名詞
あくちん	アクチン	mac	名詞
あくね	アクネ	win	名詞
あくねきん	アクネ菌	mac	名詞
あくび	あくび	win	名詞
あくびほっさ	欠伸発作	win	名詞
あくむ	悪夢	win	名詞
あくらるびしん	アクラルビシン	mac	名詞
あくりのーる	アクリノール	win	名詞
あくりのーるえき	アクリノール液	win	名詞
あくりのーるしょうどくえき	アクリノール消毒液	win	名詞
あくりのーるすいわぶつ	アクリノール水和物	win	名詞
あくりのーるちんくゆ	アクリノール・チンク油	win	名詞
あくろまいしんとろーち	アクロマイシントローチ	win	名詞
あくろまいしんなんこうさん	アクロマイシン軟膏	win	名詞
あくろめがりー	アクロメガリー	win	名詞
あぐらい	あぐら位	mac	名詞
あぐりかん	アグリカン	mac	名詞
あぐれっしぶNKさいぼうはっけつびょう	アグレッシブNK細胞白血病	win	名詞
あこうはんいかんえし	亜広範囲肝壊死	mac	名詞
あこにちん	アコニチン	mac	名詞
あこもどめーたー	アコモドメーター	mac	名詞
あごにすと	アゴニスト	mac	名詞
あさいかいよう	浅い潰瘍	mac	名詞
あさがおしょうこうぐん	朝顔症候群	win	名詞
あさしおん	アサシオン	win	名詞
あさふくしたてこうびょう	麻服仕立工病	win	名詞
あさんかちっそ	亜酸化窒素	both	名詞
あざ	あざ	win	名詞
あざしちじん	アザシチジン	mac	名詞
あざちおぷりん	アザチオプリン	mac	名詞
あざらしししょう	あざらし肢症	win	名詞
あざらしししょう	アザラシ肢症	mac	名詞
あしあくせいなんぶしゅよう	足悪性軟部腫瘍	win	名詞
あしあろ	アシアロ	mac	名詞
あしいぶつ	足異物	win	名詞
あしえそ	足壊疽	win	名詞
あしえん	足炎	win	名詞
あしかいほうそう	足開放創	win	名詞
あしかつえき	足滑液	win	名詞
あしかつえきのうえん	足滑液嚢炎	win	名詞
あしかのうせいかつえき	足化膿性滑液	win	名詞
あしかのうせいかつえきのうえん	足化膿性滑液嚢炎	win	名詞
あしかんぽうじょうはくせん	足汗疱状白癬	win	名詞
あしがいはんぼし	足外反母趾	win	名詞
あしがんせん	足頑癬	win	名詞
あしくび	足首	win	名詞
あしくびねんざ	足首捻挫	win	名詞
あしくろびる	アシクロビル	both	名詞
あしけっせんせいじょうみゃくえん	足血栓性静脈炎	win	名詞
あしさいぼう	足細胞	mac	名詞
あしざそう	足挫創	win	名詞
あししっしん	足湿疹	win	名詞
あししゅうじょうこつ	足舟状骨	win	名詞
あししょうぶこっせつこういしょう	足踵部骨折後遺症	win	名詞
あしじゃくねんせいこつなんこつしょう	足若年性骨軟骨症	win	名詞
あしじょくそう	足褥瘡	win	名詞
あしすとれいん	足ストレイン	win	名詞
あしせいしょくぼはん	足青色母斑	win	名詞
あしせっそう	足切創	win	名詞
あしせつだん	足切断	win	名詞
あしそんしょう	足損傷	win	名詞
あしだい	足第	win	名詞
あしだい1どねっしょう	足第1度熱傷	win	名詞
あしだい2どねっしょう	足第2度熱傷	win	名詞
あしだい3どねっしょう	足第3度熱傷	win	名詞
あしだいいちどねっしょう	足第1度熱傷	win	名詞
あしだいさんどねっしょう	足第3度熱傷	win	名詞
あしだいにどねっしょう	足第2度熱傷	win	名詞
あしちんきゅうせいざしょう	足陳旧性挫傷	win	名詞
あしつうふう	足痛風	win	名詞
あしつめはくせん	足爪白癬	win	名詞
あしでみあ	アシデミア	mac	名詞
あしとうしょう	足凍傷	win	名詞
あしとっき	足突起	win	名詞
あしどりふあんてい	足どり不安定	win	名詞
あしどれすえき	アシドレス液	win	名詞
あしどーしす	アシドーシス	both	名詞
あしねっしょう	足熱傷	win	名詞
あしねとばくたー	アシネトバクター	mac	名詞
あしのげか	足の外科	mac	名詞
あしのたはつかいほうこっせつ	足の多発開放骨折	win	名詞
あしのたはつこっせつ	足の多発骨折	win	名詞
あしはくせん	足白癬	win	名詞
あしぶみけんさ	足踏み検査	mac	名詞
あしへんぺいぼはん	足扁平母斑	win	名詞
あしほうそうえん	足蜂巣炎	win	名詞
あしぼしがんぐりおん	足母指ガングリオン	win	名詞
あしぼししゅりゅう	足母趾腫瘤	win	名詞
あしぼしつう	足母指痛	win	名詞
あしぼはん	足母斑	win	名詞
あしぼはんさいぼうぼはん	足母斑細胞母斑	win	名詞
あしみずむし	足水虫	win	名詞
あしゃーるちーるしょうこうぐん	アシャール・チール症候群	win	名詞
あしゆび	足指	both	名詞
あしゆび	趾	mac	名詞
あしゆびあくせいこくしょくしゅ	趾悪性黒色腫	win	名詞
あしゆびかんせつこうしゅく	趾関節拘縮	win	名詞
あしゆびそうかあくせいこくしょくしゅ	趾爪下悪性黒色腫	win	名詞
あしょうさん	亜硝酸	win	名詞
あしょうさんあみる	亜硝酸アミル	both	名詞
あしょうさんあみるきゅうにゅうしんおんす	亜硝酸アミル吸入心音図	win	名詞
あしょうさんえん	亜硝酸塩	mac	名詞
あしょうさんなとりうむ	亜硝酸ナトリウム	mac	名詞
あしりっぽうこつかいほうこっせつ	足立方骨開放骨折	win	名詞
あしりっぽうこつこっせつ	足立方骨骨折	win	名詞
あしりっぽうこつはくりこっせつ	足立方骨剥離骨折	win	名詞
あしる	アシル	mac	名詞
あしるか	アシル化	mac	名詞
あしるき	アシル基	mac	名詞
あしるこーえー	アシル-CoA	mac	名詞
あしろべっく	アシロベック	win	名詞
あじあこれら	アジアコレラ	win	名詞
あじあすぴろみせすしょう	アジアスピロミセス症	win	名詞
あじすかうんと	アジスカウント	win	名詞
あじすろまいしん	アジスロマイシン	mac	名詞
あじすろまいしんすいわぶつ	アジスロマイシン水和物	win	名詞
あじそんびょう	アジソン病	both	名詞
あじゅばんと	アジュバント	mac	名詞
あじゅばんとりょうほう	アジュバント療法	mac	名詞
あすくれ	アスクレ	win	名詞
あすげんかりゅう	アスゲン顆粒	win	名詞
あすこるびんさん	アスコルビン酸	both	名詞
あすぜすちっく	アスゼスチック	win	名詞
あすとまとっぷ	アストマトップ	win	名詞
あすとみんしろっぷ	アストミンシロップ	win	名詞
あすとりっくどらいしろっぷ	アストリックドライシロップ	win	名詞
あすとろさいと	アストロサイト	mac	名詞
あすとろさいとーま	アストロサイトーマ	both	名詞
あすぱらぎなーぜ	アスパラギナーゼ	mac	名詞
あすぱらぎん	アスパラギン	mac	名詞
あすぱらぎんぐるこさみんにょうしょう	アスパラギングルコサミン尿症	win	名詞
あすぱらぎんさん	アスパラギン酸	mac	名詞
あすぱるちるぐるこさみんにょうしょう	アスパルチルグルコサミン尿症	win	名詞
あすぴぞんずぽ	アスピゾンズポ	win	名詞
あすぴりん	アスピリン	both	名詞
あすぴりんじんましん	アスピリンじんま疹	win	名詞
あすぴりんぜんそく	アスピリン喘息	both	名詞
あすぴりんだいあるみねーと	アスピリン・ダイアルミネート	win	名詞
あすぴりんちゅうどく	アスピリン中毒	win	名詞
あすぴりんふたいしょう	アスピリン不耐症	win	名詞
あすべすとしょうたい	アスベスト小体	both	名詞
あすべすとはい	アスベスト肺	mac	名詞
あすぺるがーしょうこうぐん	アスペルガー症候群	both	名詞
あすぺるぎるす	アスペルギルス	mac	名詞
あすぺるぎるすこうげん	アスペルギルス抗原	win	名詞
あすぺるぎるすしゅ	アスペルギルス腫	win	名詞
あすぺるぎるすしょう	アスペルギルス症	both	名詞
あすぺるぎるすしょうせいがいじえん	アスペルギルス症性外耳炎	win	名詞
あすぺるぎるすせいはいえん	アスペルギルス性肺炎	win	名詞
あすぺるぎるすぞく	アルペルギルス属	mac	名詞
あすぺるぎろーま	アスペルギローマ	mac	名詞
あすもろーる	アスモロール	win	名詞
あすもろーるぱっぷ	アスモロールパップ	win	名詞
あすわーとしろっぷ	アスワートシロップ	win	名詞
あずきだい	小豆大	mac	名詞
あずとれおなむ	アズトレオナム	mac	名詞
あずのーるなんこう	アズノール軟膏	win	名詞
あずまねっくすついすとへらー	アズマネックスツイストヘラー	win	名詞
あずれん	アズレン	win	名詞
あずれんするほんさんなとりうむすいわぶつ	アズレンスルホン酸ナトリウム水和物	win	名詞
