いわざっくなんこう	イワザック軟膏	win	名詞
いわでくとがいようはいごうさんざ	イワデクト外用配合散剤	win	名詞
いわとみどどらいしろっぷ	イワトミドドライシロップ	win	名詞
いんあつ	陰圧	mac	名詞
いんあつこしつ	陰圧個室	mac	名詞
いんい	陰萎	win	名詞
いんえいけっそん	陰影欠損	mac	名詞
いんか	陰窩	mac	名詞
いんかえん	陰窩炎	win	名詞
いんかく	陰核	both	名詞
いんかくがん	陰核癌	win	名詞
いんかくのせんてんきけい	陰核の先天奇形	win	名詞
いんかくひだい	陰核肥大	win	名詞
いんかせいへんとうえん	陰窩性扁桃炎	win	名詞
いんかのうよう	陰窩膿瘍	mac	名詞
いんかるぼんざざい	インカルボン坐剤	win	名詞
いんかん	印環	mac	名詞
いんかん	員環	mac	名詞
いんかんさいぼう	印環細胞	mac	名詞
いんかんさいぼうがん	印環細胞癌	mac	名詞
いんがいし	院外死	mac	名詞
いんきゅべーたー	インキュベーター	win	名詞
いんきん	いんきん	win	名詞
いんくりのめーたー	インクリノメーター	win	名詞
いんくれちん	インクレチン	mac	名詞
いんくれみんしろっぷ	インクレミンシロップ	win	名詞
いんけい	陰茎	both	名詞
いんけいあくせいこくしょくしゅ	陰茎悪性黒色腫	win	名詞
いんけいあくせいしゅよう	陰茎悪性腫瘍	win	名詞
いんけいあくせいしゅようしゅじゅつ	陰茎悪性腫瘍手術	win	名詞
いんけいあつざしょう	陰茎圧挫傷	win	名詞
いんけいあつざそんしょう	陰茎圧挫損傷	win	名詞
いんけいいしゅく	陰茎萎縮	win	名詞
いんけいいぶつ	陰茎異物	win	名詞
いんけいいん	陰茎陰	win	名詞
いんけいいんのうふしゅ	陰茎陰嚢浮腫	win	名詞
いんけいえん	陰茎炎	win	名詞
いんけいかいほうそう	陰茎開放創	win	名詞
いんけいかいめんじょうけっかんしゅ	陰茎海綿状血管腫	win	名詞
いんけいかいよう	陰茎潰瘍	win	名詞
いんけいかんじょうこうぶがいしょう	陰茎環状溝部外傷	win	名詞
いんけいがいしょう	陰茎外傷	win	名詞
いんけいがん	陰茎癌	win	名詞
いんけいきとうぶがん	陰茎亀頭部癌	win	名詞
いんけいけいせいじゅつ	陰茎形成術	win	名詞
いんけいけいせいふぜんしょう	陰茎形成不全症	win	名詞
いんけいけっかく	陰茎結核	win	名詞
いんけいけっかんしぼうしゅ	陰茎血管脂肪腫	win	名詞
いんけいけっそん	陰茎欠損	win	名詞
いんけいこうしょくひこうしょう	陰茎紅色肥厚症	win	名詞
いんけいこんじろーま	陰茎コンジローマ	win	名詞
いんけいざしょう	陰茎挫傷	win	名詞
いんけいざそう	陰茎挫創	win	名詞
いんけいざめつしょう	陰茎挫滅傷	win	名詞
いんけいざめつそう	陰茎挫滅創	win	名詞
いんけいしっかん	陰茎疾患	win	名詞
いんけいしぼうしゅ	陰茎脂肪腫	win	名詞
いんけいしゅっけつ	陰茎出血	win	名詞
いんけいしゅよう	陰茎腫瘍	both	名詞
いんけいしゅりゅう	陰茎腫瘤	win	名詞
いんけいじぞくぼっきしょう	陰茎持続勃起症	win	名詞
いんけいじぞくぼっきしょうしゅじ	陰茎持続勃起症手術	win	名詞
いんけいせいけいせいこうけつ	陰茎成形性硬結	win	名詞
いんけいせっしょう	陰茎折傷	win	名詞
いんけいせっしょうしゅじゅつ	陰茎折症手術	win	名詞
いんけいせつしょう	陰茎折症	win	名詞
いんけいせつだん	陰茎切断	win	名詞
いんけいせつだんじゅつ	陰茎切断術	win	名詞
いんけいせんいしゅ	陰茎線維腫	win	名詞
いんけいせんいしゅしょう	陰茎線維腫症	mac	名詞
いんけいせんけい	陰茎尖圭	win	名詞
いんけいせんけいこんじろーま	陰茎尖圭コンジローマ	win	名詞
いんけいせんけいこんじろーむせつじょ	陰茎尖圭コンジローム切除術	win	名詞
いんけいぜんてきじゅつ	陰茎全摘術	win	名詞
いんけいそんしょう	陰茎損傷	win	名詞
いんけいたいぶがん	陰茎体部癌	win	名詞
いんけいだい	陰茎第	win	名詞
いんけいだい1どねっしょう	陰茎第1度熱傷	win	名詞
いんけいだい2どねっしょう	陰茎第2度熱傷	win	名詞
いんけいだい3どねっしょう	陰茎第3度熱傷	win	名詞
いんけいだいいちどねっしょう	陰茎第1度熱傷	win	名詞
いんけいだいさんどねっしょう	陰茎第3度熱傷	win	名詞
いんけいだいにどねっしょう	陰茎第2度熱傷	win	名詞
いんけいだぼくしょう	陰茎打撲傷	win	名詞
いんけいないいぶつ	陰茎内異物	win	名詞
いんけいにくしゅ	陰茎肉腫	win	名詞
いんけいねっしょう	陰茎熱傷	win	名詞
いんけいねんてんしょう	陰茎捻転症	win	名詞
いんけいのうよう	陰茎膿瘍	win	名詞
いんけいはいしんけい	陰茎背神経	mac	名詞
いんけいはいそく	陰茎背側	mac	名詞
いんけいはくはんしょう	陰茎白斑症	win	名詞
いんけいはくばんしょう	陰茎白板症	win	名詞
いんけいぱじぇっとびょう	陰茎パジェット病	win	名詞
いんけいひだい	陰茎肥大	win	名詞
いんけいびらん	陰茎びらん	win	名詞
いんけいふくそく	陰茎腹側	mac	名詞
いんけいふしゅ	陰茎浮腫	win	名詞
いんけいぶしゅよう	陰茎部腫瘍	win	名詞
いんけいぶとうつう	陰茎部疼痛	win	名詞
いんけいぶにょうどうかれつ	陰茎部尿道下裂	win	名詞
いんけいぶんぴぶつ	陰茎分泌物	win	名詞
いんけいへるぺす	陰茎ヘルペス	win	名詞
いんけいほうせんのうしゅ	陰茎縫線嚢腫	win	名詞
いんけいほうひぶがん	陰茎包皮部癌	win	名詞
いんけいゆうきょくさいぼうがん	陰茎有棘細胞癌	win	名詞
いんけいよういんかくけいせいしゅじゅつ	陰茎様陰核形成手術	win	名詞
いんけいりょうせいしゅよう	陰茎良性腫瘍	win	名詞
いんけいれっしょう	陰茎裂傷	win	名詞
いんけいれっそう	陰茎裂創	win	名詞
いんけいわんきょく	陰茎弯曲	win	名詞
いんこう	咽喉	win	名詞
いんこうあつざそんしょう	咽喉圧挫損傷	win	名詞
いんこうえき	咽喉液	win	名詞
いんこうかんそうかん	咽喉乾燥感	win	名詞
いんこうしゅっけつ	咽喉出血	win	名詞
いんこうしんけいしょう	咽喉神経症	win	名詞
いんこうつう	咽喉痛	win	名詞
いんこうとう	咽喉頭	mac	名詞
いんこうとういじょうかんしょう	咽喉頭異常感症	win	名詞
いんこうとういじょうしょう	咽喉頭異常症	mac	名詞
いんこうとういぶつかんしょう	咽喉頭異物感症	win	名詞
いんこうとうえん	咽喉頭炎	win	名詞
いんこうとうしょくどうしんけいしょう	咽喉頭食道神経症	win	名詞
いんこうとうしんけいしょう	咽喉頭神経症	win	名詞
いんこうとうちかくまひ	咽喉頭知覚麻痺	win	名詞
いんこうとうぶいわかん	咽喉頭部異和感	win	名詞
いんこうぶいぶつ	咽喉部異物	win	名詞
いんこぶ	陰股部	win	名詞
いんこぶがんせん	陰股部頑癬	win	名詞
いんごのうよう	咽後膿瘍	both	名詞
いんごのうようせっかいじゅつ	咽後膿瘍切開術	win	名詞
いんさいどぱっぷ	インサイドパップ	win	名詞
いんしでんたろーま	インシデンタローマ	win	名詞
いんしゅしへき	飲酒嗜癖	win	名詞
いんしょう	陰証	mac	名詞
いんしん	陰唇	win	名詞
いんしんあつざしょう	陰唇圧挫傷	win	名詞
いんしんあつざそんしょう	陰唇圧挫損傷	win	名詞
いんしんかいよう	陰唇潰瘍	win	名詞
いんしんざしょう	陰唇挫傷	win	名詞
いんしんざめつしょう	陰唇挫滅傷	win	名詞
いんしんざめつそう	陰唇挫滅創	win	名詞
いんしんしゅよう	陰唇腫瘍	win	名詞
いんしんせつだん	陰唇切断	win	名詞
いんしんひだい	陰唇肥大	win	名詞
いんしんへるにあ	陰唇ヘルニア	win	名詞
いんしんぽりーぷ	陰唇ポリープ	win	名詞
いんしんゆごう	陰唇癒合	win	名詞
いんじうむ	インジウム	win	名詞
いんじうむ111INおきしんえき	インジウム（111In）オキシン液	win	名詞
いんじごかるみん	インジゴカルミン	mac	名詞
いんじごかるみんしよう	インジゴカルミン使用	win	名詞
いんじなびる	インジナビル	mac	名詞
いんすい	飲水	mac	名詞
いんすりのーま	インスリノーマ	both	名詞
いんすりん	インスリン	mac	名詞
いんすりんいじょうしょう	インスリン異常症	win	名詞
いんすりんいぞんじょうたい	インスリン依存状態	mac	名詞
いんすりんいぞんせいとうにょうびょう	インスリン依存性糖尿病	both	名詞
いんすりんいぞんとうにょうびょう	インスリン依存糖尿病	win	名詞
いんすりんこうたいせいみつ	インスリン抗体	win	名詞
いんすりんさよう	インスリン作用	mac	名詞
いんすりんさんせい	インスリン産生	mac	名詞
いんすりんさんせいしゅよう	インスリン産生腫瘍	mac	名詞
いんすりんしょうほう	インスリン小胞	mac	名詞
いんすりんしょっく	インスリンショック	win	名詞
いんすりんしょっくりょうほう	インスリンショック療法	mac	名詞
いんすりんじこめんえきしょうこうぐん	インスリン自己免疫症候群	both	名詞
いんすりんていけっとう	インスリン低血糖	win	名詞
いんすりんていこうしょう	インスリン抵抗症	win	名詞
いんすりんていこうせいとうにょうびょう	インスリン抵抗性糖尿病	win	名詞
いんすりんひいぞんせいとうにょうびょう	インスリン非依存性糖尿病	win	名詞
いんすりんひいぞんとうにょうびょう	インスリン非依存糖尿病	win	名詞
いんすりんふおうしょう	インスリン不応症	win	名詞
いんすりんふかしけん	インスリン負荷試験	win	名詞
いんすりんぶんぴいじょうしょう	インスリン分泌異常症	win	名詞
いんすりんようせいちょういんし	インスリン様成長因子	mac	名詞
いんすりんれせぷたーいじょうしょう	インスリンレセプター異常症	win	名詞
いんせい	(-)	mac	名詞
いんせい	陰性	both	名詞
いんせいかでん	陰性荷電	mac	名詞
いんせいしょうじょう	陰性症状	mac	名詞
いんせいしょけん	陰性所見	win	名詞
いんせいちょうこう	陰性徴候	mac	名詞
いんせいでんか	陰性電荷	mac	名詞
いんせいはけい	陰性波形	mac	名詞
いんせいへんじさよう	陰性変時作用	mac	名詞
いんせいへんりょくさよう	陰性変力作用	mac	名詞
いんせいＴは	陰性T波	mac	名詞
いんたーふぇろん	インターフェロン	mac	名詞
いんたーふぇろんあるふぁ	インターフェロンα	win	名詞
いんたーふぇろんがんま	インターフェロンγ	win	名詞
いんたーふぇろんべーた	インターフェロンβ	win	名詞
いんたーふぇろんもうまくしょう	インターフェロン網膜症	win	名詞
いんたーべんしょん	インターベンション	mac	名詞
いんたーるえあろぞる	インタールエアロゾル	win	名詞
いんたーるさいりゅう	インタール細粒	win	名詞
いんたーるてんがんえき	インタール点眼液	win	名詞
いんたーるてんがんえきゆーでぃー	インタール点眼液	win	名詞
いんたーるてんびえき	インタール点鼻液	win	名詞
いんたーろいきん	インターロイキン	mac	名詞
いんだいれくとぼんでぃんぐそうち	インダイレクトボンディング装置	win	名詞
いんちんこう	インチンコウ	win	名詞
いんてぐりん	インテグリン	mac	名詞
いんてだーる	インテダール	win	名詞
いんてだーるがいようえき	インテダール外用液	win	名詞
いんてなーすぱっぷ	インテナースパップ	win	名詞
いんてばん	インテバン	win	名詞
いんてばんくりーむ	インテバンクリーム	win	名詞
いんてばんざざい	インテバン坐剤	win	名詞
いんてばんなんこう	インテバン軟膏	win	名詞
いんてるからーつむじゅうけつきゅうちゅうしょう	インテルカラーツム住血吸虫症	win	名詞
いんてん	陰転	mac	名詞
いんてんか	陰転化	mac	名詞
いんでらにっくざざい	インデラニック坐剤	win	名詞
いんでらにっくなんこう	インデラニック軟膏	win	名詞
いんでらぽろんざざい	インデラポロン坐剤	win	名詞
いんとう	咽頭	both	名詞
いんとうあくせいしゅよう	咽頭悪性腫瘍	win	名詞
いんとうあくせいしゅようしゅじゅつ	咽頭悪性腫瘍手術	win	名詞
いんとうあつざそんしょう	咽頭圧挫損傷	win	名詞
いんとうあれるぎー	咽頭アレルギー	win	名詞
いんとういじょうかん	咽頭異常感	win	名詞
いんとういじょうかんしょう	咽頭異常感症	win	名詞
いんとういぶつ	咽頭異物	win	名詞
いんとういぶつかん	咽頭異物感	win	名詞
いんとういぶつてきしゅつじゅつ	咽頭異物摘出術	win	名詞
いんとういわかん	咽頭異和感	win	名詞
いんとうえん	咽頭炎	win	名詞
いんとうえんがい	咽頭円蓋	mac	名詞
いんとうかいほうそう	咽頭開放創	win	名詞
いんとうかいよう	咽頭潰瘍	win	名詞
いんとうかくかしょう	咽頭角化症	win	名詞
いんとうかすいたい	咽頭下垂体	mac	名詞
いんとうかんおう	咽頭陥凹	mac	名詞
いんとうがい	咽頭蓋	both	名詞
いんとうがいしょう	咽頭外傷	win	名詞
いんとうがいのうほう	咽頭蓋嚢胞	win	名詞
いんとうがん	咽頭癌	win	名詞
いんとうき	咽頭期	mac	名詞
いんとうきかんえん	咽頭気管炎	win	名詞
いんとうきけい	咽頭奇形	win	名詞
いんとうきゅう	咽頭弓	mac	名詞
いんとうきょうさくしょう	咽頭狭窄症	win	名詞
いんとうきん	咽頭筋	mac	名詞
いんとうくう	咽頭腔	mac	名詞
いんとうくうがん	咽頭腔癌	win	名詞
いんとうけいしつ	咽頭憩室	win	名詞
いんとうけいぶしょくどういぶつかん	咽頭頚部食道異物感	win	名詞
いんとうけっかく	咽頭結核	win	名詞
いんとうけっかんしゅ	咽頭血管腫	win	名詞
いんとうけっしゅ	咽頭血腫	win	名詞
いんとうけつまくねつ	咽頭結膜熱	both	名詞
いんとうこう	咽頭溝	mac	名詞
いんとうこうかんげき	咽頭後間隙	mac	名詞
いんとうこうとうえん	咽頭喉頭炎	win	名詞
いんとうこうとうぎゃくりゅうしょう	咽頭喉頭逆流症	win	名詞
いんとうこうとうしんけいしょう	咽頭喉頭神経症	win	名詞
いんとうこうとうぶ	咽頭喉頭部	mac	名詞
いんとうこうぶ	咽頭口部	mac	名詞
いんとうこうへき	咽頭後壁	mac	名詞
いんとうこうやくかん	咽頭絞扼感	win	名詞
いんとうこつしゅ	咽頭骨腫	win	名詞
いんとうさっかけんさいじょう	咽頭擦過検査異常	win	名詞
いんとうし	咽頭枝	mac	名詞
いんとうしゃくねつかん	咽頭灼熱感	win	名詞
いんとうしゅういえん	咽頭周囲炎	win	名詞
いんとうしゅういのうよう	咽頭周囲膿瘍	win	名詞
いんとうしゅうしゅくきんまひ	咽頭収縮筋麻痺	win	名詞
いんとうしゅっけつ	咽頭出血	win	名詞
いんとうしゅよう	咽頭腫瘍	win	名詞
いんとうしゅりゅう	咽頭腫瘤	win	名詞
いんとうしょくどういこうぶ	咽頭食道移行部	mac	名詞
いんとうしょくどうけいしつ	咽頭食道憩室	win	名詞
いんとうしんけいそう	咽頭神経叢	mac	名詞
いんとうじふてりあ	咽頭ジフテリア	win	名詞
いんとうじょうひかけいせいしょう	咽頭上皮過形成症	win	名詞
いんとうじょうひないがん	咽頭上皮内癌	win	名詞
いんとうじょうひひこうしょう	咽頭上皮肥厚症	win	名詞
いんとうせんてんきけい	咽頭先天奇形	win	名詞
いんとうそう	咽頭相	mac	名詞
いんとうそうしょう	咽頭創傷	win	名詞
いんとうそんしょう	咽頭損傷	win	名詞
いんとうちかくいじょう	咽頭知覚異常	win	名詞
いんとうちふす	咽頭チフス	win	名詞
いんとうちゅうしゃ	咽頭注射	win	名詞
いんとうちょう	咽頭腸	mac	名詞
いんとうつう	咽頭痛	both	名詞
いんとうとうていばん	咽頭頭底板	mac	名詞
いんとうないいぶつ	咽頭内異物	win	名詞
いんとうないいぶつによるちっそく	咽頭内異物による窒息	win	名詞
いんとうにくしゅ	咽頭肉腫	win	名詞
いんとうにゅうとうしゅ	咽頭乳頭腫	win	名詞
いんとうねっしょう	咽頭熱傷	win	名詞
いんとうねんまくそんしょう	咽頭粘膜損傷	win	名詞
いんとうのう	咽頭嚢	both	名詞
いんとうのうしゅ	咽頭嚢腫	win	名詞
いんとうのうよう	咽頭膿瘍	win	名詞
いんとうはくはんしょう	咽頭白斑症	win	名詞
いんとうはんしゃ	咽頭反射	mac	名詞
いんとうひふろうこうへいさじゅつ	咽頭皮膚瘻孔閉鎖術	win	名詞
いんとうびぶ	咽頭鼻部	mac	名詞
いんとうふしゅ	咽頭浮腫	win	名詞
いんとうふしょく	咽頭腐蝕	win	名詞
いんとうふれぐもーね	咽頭フレグモーネ	win	名詞
いんとうぶけっしゅ	咽頭部血腫	win	名詞
いんとうぶざしょう	咽頭部挫傷	win	名詞
いんとうぶそんしょう	咽頭部損傷	win	名詞
いんとうへんとう	咽頭扁桃	mac	名詞
いんとうへんとうえん	咽頭扁桃炎	win	名詞
いんとうへんとうひだい	咽頭扁桃肥大	win	名詞
いんとうほうせん	咽頭縫線	mac	名詞
いんとうほっせき	咽頭発赤	win	名詞
いんとうぽりーぷ	咽頭ポリープ	win	名詞
いんとうまひ	咽頭麻痺	win	名詞
いんとうりょうせいしゅよう	咽頭良性腫瘍	win	名詞
いんとうるちゅうのうよう	咽頭流注膿瘍	win	名詞
いんとうろうへいさじゅつ	咽頭瘻閉鎖術	win	名詞
いんとらりぴっど	イントラリピッド	win	名詞
いんどごむようひふ	インドゴム様皮膚	win	名詞
いんどだにちふす	インドだにチフス	win	名詞
いんどのーるくりーむ	インドノールクリーム	win	名詞
いんどめさしん	インドメサシン	mac	名詞
いんどめたしん	インドメタシン	both	名詞
いんどめたしんがいようえき	インドメタシン外用液	win	名詞
いんどめたしんくりーむ	インドメタシンクリーム	win	名詞
いんどめたしんげる	インドメタシンゲル	win	名詞
いんどめたしんざざい	インドメタシン坐剤	win	名詞
いんどめたしんぱっぷ	インドメタシンパップ	win	名詞
いんどめろーるてんがんえき	インドメロール点眼液	win	名詞
いんない	院内	win	名詞
いんないかんせん	院内感染	win	名詞
いんないかんせんはいけつしょう	院内感染敗血症	win	名詞
いんないし	院内死	mac	名詞
いんないせいざい	院内製剤	mac	名詞
いんないにょうろかんせんしょう	院内尿路感染症	win	名詞
いんなみっとえき	インナミット液	win	名詞
いんなみっとがいようえき	インナミット外用液	win	名詞
いんなみっとくりーむ	インナミットクリーム	win	名詞
いんなみっとげる	インナミットゲル	win	名詞
いんのう	陰嚢	mac	名詞
いんのうあくせいこくしょくしゅ	陰嚢悪性黒色腫	win	名詞
いんのうあくせいしんせいぶつ	陰嚢悪性新生物	win	名詞
いんのうあつざそんしょう	陰嚢圧挫損傷	win	名詞
いんのうあてろーむ	陰嚢アテローム	win	名詞
いんのうえん	陰嚢炎	win	名詞
いんのうかいほうそう	陰嚢開放創	win	名詞
いんのうかいよう	陰嚢潰瘍	win	名詞
いんのうかいようけいせい	陰嚢潰瘍形成	win	名詞
いんのうがいしょう	陰嚢外傷	win	名詞
いんのうがん	陰嚢癌	win	名詞
いんのうきけい	陰嚢奇形	win	名詞
いんのうけっかく	陰嚢結核	win	名詞
いんのうけっかんかくかしゅ	陰嚢血管角化腫	win	名詞
いんのうけっかんしゅ	陰嚢血管腫	win	名詞
いんのうけっしゅ	陰嚢血腫	win	名詞
いんのうざしょう	陰嚢挫傷	win	名詞
いんのうざめつしょう	陰嚢挫滅傷	win	名詞
いんのうざめつそう	陰嚢挫滅創	win	名詞
いんのうしっしん	陰嚢湿疹	win	名詞
いんのうしゅだい	陰嚢腫大	win	名詞
いんのうしゅよう	陰嚢腫瘍	win	名詞
いんのうじょうみゃくりゅう	陰嚢静脈瘤	win	名詞
いんのうすいしゅ	陰嚢水腫	both	名詞
いんのうすいしゅしゅじゅつ	陰嚢水腫手術	win	名詞
いんのうすいしゅせんし	陰嚢水腫穿刺	win	名詞
いんのうすいりゅう	陰嚢水瘤	both	名詞
いんのうせつだん	陰嚢切断	win	名詞
いんのうそうようしょう	陰嚢そう痒症	win	名詞
いんのうだい1どねっしょう	陰嚢第1度熱傷	win	名詞
いんのうだい2どねっしょう	陰嚢第2度熱傷	win	名詞
いんのうだい3どねっしょう	陰嚢第3度熱傷	win	名詞
いんのうだいいちどねっしょう	陰嚢第1度熱傷	win	名詞
いんのうだいさんどねっしょう	陰嚢第3度熱傷	win	名詞
いんのうだいにどねっしょう	陰嚢第2度熱傷	win	名詞
いんのうちゅうかく	陰嚢中隔	mac	名詞
いんのうつう	陰嚢痛	win	名詞
いんのうないしぼうにくしゅ	陰嚢内脂肪肉腫	win	名詞
いんのうないしゅよう	陰嚢内腫瘍	win	名詞
いんのうないしゅりゅう	陰嚢内腫瘤	mac	名詞
いんのうないりょうせいしゅよう	陰嚢内良性腫瘍	win	名詞
いんのうなんせいせんいしゅ	陰嚢軟性線維腫	win	名詞
いんのうねっしょう	陰嚢熱傷	win	名詞
いんのうのうよう	陰嚢膿瘍	win	名詞
いんのうぱじぇっとびょう	陰嚢パジェット病	win	名詞
いんのうひかくけっかんしゅ	陰嚢被角血管腫	win	名詞
いんのうひふけっかんしゅ	陰嚢皮膚血管腫	win	名詞
いんのうひようしゅ	陰嚢皮様腫	win	名詞
いんのうびらん	陰嚢びらん	win	名詞
いんのうふしゅ	陰嚢浮腫	win	名詞
いんのうぶしゅりゅう	陰嚢部腫瘤	win	名詞
いんのうへるにあ	陰嚢ヘルニア	win	名詞
いんのうへるぺす	陰嚢ヘルペス	win	名詞
いんのうゆうきょくさいぼうがん	陰嚢有棘細胞癌	win	名詞
いんのうりゅうき	陰嚢隆起	mac	名詞
いんのうりょうせいしゅよう	陰嚢良性腫瘍	win	名詞
いんのうりょうせいしんせいぶつ	陰嚢良性新生物	win	名詞
いんのうれっしょう	陰嚢裂傷	win	名詞
いんのうれっそう	陰嚢裂創	win	名詞
いんばりあんとさ	インバリアント鎖	mac	名詞
いんひびたー	インヒビター	mac	名詞
いんひびん	インヒビン	mac	名詞
いんぴんじめんと	インピンジメント	mac	名詞
いんぴんじめんとしょうこうぐん	インピンジメント症候群	mac	名詞
いんぴーだんすおーじおめとりー	インピーダンス・オージオメトリー	mac	名詞
いんぴーだんすせいごう	インピーダンス整合	mac	名詞
いんふぉーむどこんせんと	インフォームドコンセント	mac	名詞
いんふゅーじょんりあくしょん	インフュージョンリアクション	mac	名詞
いんふりきしまぶ	インフリキシマブ	both	名詞
いんふるえんざ	インフルエンザ	win	名詞
いんふるえんざ(H5N1)	インフルエンザ（H5N1）	win	名詞
いんふるえんざAがた	インフルエンザA型	win	名詞
いんふるえんざAそれんがた	インフルエンザAソ連型	win	名詞
いんふるえんざAほんこんがた	インフルエンザA香港型	win	名詞
いんふるえんざBがた	インフルエンザB型	win	名詞
いんふるえんざういるす	インフルエンザウイルス	mac	名詞
いんふるえんざういるすえーがたこうたい	インフルエンザウイルスA型抗体価	win	名詞
いんふるえんざういるすこうげん	インフルエンザウイルス抗原	win	名詞
いんふるえんざういるすびーがたこうたい	インフルエンザウイルスB型抗体価	win	名詞
いんふるえんざえーがた	インフルエンザA型	win	名詞
いんふるえんざえーそれんがた	インフルエンザAソ連型	win	名詞
いんふるえんざえーほんこんがた	インフルエンザA香港型	win	名詞
いんふるえんざかんきん	インフルエンザ桿菌	mac	名詞
いんふるえんざかんれんのうしょう	インフルエンザ関連脳症	mac	名詞
いんふるえんざきかんしえん	インフルエンザ気管支炎	win	名詞
