うるくぞーるはいごうかりゅう	ウルクゾール配合顆粒	win	名詞
うるしによるあれるぎーせいせっしょくひふえん	ウルシによるアレルギー性接触皮膚炎	win	名詞
うるそかりゅう	ウルソ顆粒	win	名詞
うるそさん	ウルソ酸	mac	名詞
うるそでおきしこーるさん	ウルソデオキシコール酸	both	名詞
うるちょうこう	クスマウル徴候	mac	名詞
うるでっくす	ウルデックス	win	名詞
うるとらてくねかう	ウルトラテクネカウ	win	名詞
うるりっひしょうこうぐん	ウルリッヒ症候群	win	名詞
うるりっひびょう	ウルリッヒ病	win	名詞
うるりひふぁいへてぃがーしょうこうぐん	ウルリヒ・ファイヘティガー症候群	win	名詞
うれあーぜ	ウレアーゼ	mac	名詞
うれぱーるくりーむ	ウレパールクリーム	win	名詞
うれぱーるろーしょん	ウレパールローション	win	名詞
うろあしすさん	ウロアシス散	win	名詞
うろあしすはいごうさん	ウロアシス配合散	win	名詞
うろきなーぜ	ウロキナーゼ	both	名詞
うろばっぐ	ウロバッグ	win	名詞
うろびりのげん	ウロビリノゲン	mac	名詞
うろびりのーげん	ウロビリノーゲン	mac	名詞
うろびりのーげんていりょう	ウロビリノーゲン定量	win	名詞
うろびりん	ウロビリン	mac	名詞
うろびりんていりょう	ウロビリン定量	win	名詞
うろぽるふぃりんていりょう	ウロポルフィリン定量	win	名詞
うろまちっくえす	ウロマチック	win	名詞
うろまちっくえすひにょうきかようかんりゅうえき	ウロマチックS泌尿器科用灌流液	win	名詞
うわうるし	ウワウルシ	win	名詞
うわばいん	ウアバイン	mac	名詞
うんけいとう	温経湯	win	名詞
うんせいいん	温清飲	win	名詞
うんどう	運動	win	名詞
うんどうかく	運動覚	mac	名詞
うんどうかしょう	運動過少	mac	名詞
うんどうかじょう	運動過剰	win	名詞
うんどうかじょうしょう	運動過剰症	win	名詞
うんどうかたしょうこうぐん	運動過多症候群	win	名詞
うんどうかんじょ	運動緩徐	mac	名詞
うんどうき	運動器	both	名詞
うんどうき	運動機能	win	名詞
うんどうきのうのとくいてきはったつしょうがい	運動機能の特異的発達障害	win	名詞
うんどうきのうはついくしょうがい	運動機能発育障害	win	名詞
うんどうきのうはついくちえん	運動機能発育遅延	win	名詞
うんどうきふあんていしょう	運動器不安定症	both	名詞
うんどうげんしょうせい	運動減少性	win	名詞
うんどうこうしん	運動亢進	mac	名詞
うんどうこうしんせい	運動亢進性	win	名詞
うんどうこうしんせいたんどうじすきねじー	運動亢進性胆道ジスキネジー	win	名詞
うんどうこん	運動根	mac	名詞
うんどうしっこう	運動失行	win	名詞
うんどうしっちょう	運動失調	both	名詞
うんどうしっちょうがた	運動失調型	mac	名詞
うんどうしっちょうしょう	運動失調症	win	名詞
うんどうしっちょうせいのうせいまひ	運動失調性脳性麻痺	win	名詞
うんどうしっちょうせいべんぴ	運動失調性便秘	win	名詞
うんどうしゅうばん	運動終板	mac	名詞
うんどうしょうがい	運動障害	both	名詞
うんどうしんけい	運動神経	mac	名詞
うんどうしんけいしゅうまつせんじ	運動神経終末潜時	mac	名詞
うんどうしんぱく	運動心迫	win	名詞
うんどうじつう	運動時痛	mac	名詞
うんどうせい	運動性	both	名詞
うんどうせいげん	運動制限	mac	名詞
うんどうせいげんごちゅうすう	運動性言語中枢	mac	名詞
うんどうせいしつご	運動性失語	win	名詞
うんどうせいしつごしょう	運動性失語症	win	名詞
うんどうせいしんせん	運動性振戦	win	名詞
うんどうぜんや	運動前野	mac	名詞
うんどうたんい	運動単位	mac	名詞
うんどうたんいでんい	運動単位電位	mac	名詞
うんどうちょうせつしょうがい	運動調節障害	win	名詞
うんどうにゅーろん	運動ニューロン	mac	名詞
うんどうにゅーろんしっかん	運動ニューロン疾患	win	名詞
うんどうにゅーろんびょう	運動ニューロン病	win	名詞
うんどうはったつちえん	運動発達遅延	win	名詞
うんどうはったつちたい	運動発達遅滞	win	名詞
うんどうまひ	運動麻痺	both	名詞
うんどうや	運動野	mac	名詞
うんどうゆうはつせいぜんそく	運動誘発性喘息	win	名詞
うんどうりょうほう	運動療法	mac	名詞
うんなぼはん	ウンナ母斑	win	名詞
うんべるりひとてんかん	ウンベルリヒトてんかん	win	名詞
うーとふちょうこう	Uhthoff徴候	win	名詞
うーるびょう	ウール病	win	名詞
えあぞりん	エアゾリン	win	名詞
えあぞーるざい	エアゾール剤	mac	名詞
えあはんまーしょうこうぐん	エアハンマー症候群	win	名詞
えありーとくりーむ	エアリートクリーム	win	名詞
えありーとげる	エアリートゲル	win	名詞
えありーとろーしょん	エアリートローション	win	名詞
えあーさろんぱす	エアーサロンパス	win	名詞
えあーなーすくりーむ	エアーナースクリーム	win	名詞
えあーなーすなんこう	エアーナース軟膏	win	名詞
えいき	鋭器	mac	名詞
えいきそんしょう	鋭器損傷	mac	名詞
えいきゅうさいぼう	永久細胞	mac	名詞
えいきゅうし	永久歯	both	名詞
えいきゅうしたい	永久死体	mac	名詞
えいきゅうしはい	永久歯胚	win	名詞
えいきゅうしほうしゅつふぜん	永久歯萌出不全	win	名詞
えいきゅうじん	永久腎	mac	名詞
えいきゅうせい	永久性	win	名詞
えいきゅうにゅう	永久乳	mac	名詞
えいじ	嬰児	mac	名詞
えいじさつ	嬰児殺	mac	名詞
えいじし	嬰児屍	mac	名詞
えいじつ	エイジツ	win	名詞
えいじょはふくごう	鋭徐波複合	win	名詞
えいじーひ	A/G比	mac	名詞
えいず	AIDS	win	名詞
えいず	エイズ	win	名詞
えいずかんれんしょうこうぐん	AIDS関連症候群	win	名詞
えいずかんれんしょうこうぐん	エイズ関連症候群	win	名詞
えいずけんさようせい	AIDS検査陽性	win	名詞
えいずけんさようせい	エイズ検査陽性	win	名詞
えいずのうしょう	エイズ脳症	win	名詞
えいせいこんちゅう	衛生昆虫	mac	名詞
えいせいさいぼう	衛星細胞	mac	名詞
えいぞくせいしんぼうさいどう	永続性心房細動	win	名詞
えいぞぷとけんだくせいてんがんえき	エイゾプト懸濁性点眼液	win	名詞
えいてき	鋭的	mac	名詞
えいてきそんしょう	鋭的損傷	mac	名詞
えいとえー	Ⅷa	mac	名詞
えいどう	泳動	mac	名詞
えいは	鋭波	both	名詞
えいよういじょう	栄養異常	mac	名詞
えいようかじょう	栄養過剰	win	名詞
えいようかてーてる	栄養カテーテル	win	名詞
えいようかんり	栄養管理	mac	名詞
えいようがた	栄養型	mac	名詞
えいようけっかん	栄養血管	mac	名詞
えいようけつぼうしょう	栄養欠乏症	win	名詞
えいようこう	栄養孔	mac	名詞
えいようしえん	栄養支援	mac	名詞
えいようしっちょう	栄養失調	win	名詞
えいようしっちょうじょうたい	栄養失調状態	win	名詞
えいようしっちょうせいあくえきしつ	栄養失調性悪液質	win	名詞
えいようしっちょうせいせいじんこつなんかしょう	栄養失調性成人骨軟化症	win	名詞
えいようしっちょうせいはくないしょう	栄養失調性白内障	win	名詞
えいようしっちょうせいふしゅ	栄養失調性浮腫	win	名詞
えいようしょうがい	栄養障害	win	名詞
えいようしょうがいがたひょうひすいほうしょう	栄養障害型表皮水疱症	win	名詞
えいようしょうがいせいかくまくえん	栄養障害性角膜炎	win	名詞
えいようしょうがいせいししんけいいしゅく	栄養障害性視神経萎縮	win	名詞
えいようしんけいしょう	栄養神経症	win	名詞
えいようせいかんこうへん	栄養性肝硬変	win	名詞
えいようせいきょせきがきゅうせいひんけつ	栄養性巨赤芽球性貧血	win	名詞
えいようせいしょうもうしょう	栄養性消耗症	win	名詞
えいようせいしんきんしょう	栄養性心筋症	win	名詞
えいようせいていしんちょう	栄養性低身長	win	名詞
えいようせいふしゅ	栄養性浮腫	win	名詞
えいようたい	栄養体	mac	名詞
えいようとたいしゃ	栄養と代謝	mac	名詞
えいようどうみゃく	栄養動脈	mac	名詞
えいようふりょう	栄養不良	win	名詞
えいようふりょうかんれんとうにょうびょう	栄養不良関連糖尿病	win	名詞
えいようまく	栄養膜	mac	名詞
えいようまくごうほうたい	栄養膜合胞体	mac	名詞
えいようまくごうほうたいそう	栄養膜合胞体層	mac	名詞
えいようまくさいぼうそう	栄養膜細胞層	mac	名詞
えいようまくれっこう	栄養膜裂孔	mac	名詞
えいん	会陰	both	名詞
えいんえそ	会陰壊疽	win	名詞
えいんがいしょう	会陰外傷	win	名詞
えいんけいせいしゅじゅつ	会陰形成手術	win	名詞
えいんけっしゅ	会陰血腫	win	名詞
えいんけんちゅうしん	会陰腱中心	mac	名詞
えいんざしょう	会陰挫傷	win	名詞
えいんせっかいおよびほうごうじゅつ	会陰切開及び縫合術	win	名詞
えいんせっかいそうりかい	会陰切開創離開	win	名詞
えいんせっかいぶにくげしゅ	会陰切開部肉芽腫	win	名詞
えいんせんこつぶかいよう	会陰仙骨部潰瘍	win	名詞
えいんだい	会陰第	win	名詞
えいんだい1どねっしょう	会陰第1度熱傷	win	名詞
えいんだい2どねっしょう	会陰第2度熱傷	win	名詞
えいんだい3どねっしょう	会陰第3度熱傷	win	名詞
えいんだいいちどねっしょう	会陰第1度熱傷	win	名詞
えいんだいさんどねっしょう	会陰第3度熱傷	win	名詞
えいんだいにどねっしょう	会陰第2度熱傷	win	名詞
えいんちつへきれっしょう	会陰腟壁裂傷	win	名詞
えいんちつへきれっしょう	会陰膣壁裂傷	win	名詞
えいんねっしょう	会陰熱傷	win	名詞
えいんぶ	会陰部	win	名詞
えいんぶかのうそう	会陰部化膿創	win	名詞
えいんぶかんじだしょう	会陰部カンジダ症	win	名詞
えいんぶけっかんしぼうしゅ	会陰部血管脂肪腫	win	名詞
えいんぶけっしゅ	会陰部血腫	win	名詞
えいんぶこういしっしん	会陰部肛囲湿疹	win	名詞
えいんぶしぼうしゅ	会陰部脂肪腫	win	名詞
えいんぶしゅういのうよう	会陰部周囲膿瘍	win	名詞
えいんぶせつ	会陰部せつ	win	名詞
えいんぶそうかんせんしょう	会陰部創感染症	win	名詞
えいんぶだぼくけっしゅ	会陰部打撲血腫	win	名詞
えいんぶにくげしゅ	会陰部肉芽腫	win	名詞
えいんぶにょうどうかれつ	会陰部尿道下裂	win	名詞
えいんぶのうよう	会陰部膿瘍	win	名詞
えいんぶぱじぇっとびょう	会陰部パジェット病	win	名詞
えいんぶびらん	会陰部びらん	win	名詞
えいんぶほうごうしのうよう	会陰部縫合糸膿瘍	win	名詞
えいんぶほうそうえん	会陰部蜂巣炎	win	名詞
えいんぶよう	会陰部よう	win	名詞
えいんぶれっしょうほうごうふぜん	会陰部裂傷縫合不全	win	名詞
えいんへるにあ	会陰ヘルニア	win	名詞
えいんへるにあしゅじゅつ	会陰ヘルニア手術	win	名詞
えいんれっしょう	会陰裂傷	win	名詞
えいんれっしょうしゅうふくごかんせんしょう	会陰裂傷修復後感染症	win	名詞
えいんれっしょうだい	会陰裂傷第	win	名詞
えいんれっしょうだい1ど	会陰裂傷第1度	win	名詞
えいんれっしょうだい2ど	会陰裂傷第2度	win	名詞
えいんれっしょうだい3ど	会陰裂傷第3度	win	名詞
えいんれっしょうだい4ど	会陰裂傷第4度	win	名詞
えいんれっしょうだいいちど	会陰裂傷第1度	win	名詞
えいんれっしょうだいさんど	会陰裂傷第3度	win	名詞
えいんれっしょうだいにど	会陰裂傷第2度	win	名詞
えいんれっしょうだいよんど	会陰裂傷第4度	win	名詞
えいんれっそうほうごうじゅつ	会陰裂創縫合術	win	名詞
えおじん	エオジン	mac	名詞
えおじんこうせい	エオジン好性	mac	名詞
えかべとなとりうむすいわぶつ	エカベトナトリウム水和物	win	名詞
えきか	腋窩	both	名詞
えきかあくせいこくしょくしゅ	腋窩悪性黒色腫	win	名詞
えきかあくせいまっしょうしんけいしょうしゅ	腋窩悪性末梢神経鞘腫	win	名詞
えきかあつざしょう	腋窩圧挫傷	win	名詞
えきかかんじだしょう	腋窩カンジダ症	win	名詞
えきかがん	腋窩癌	win	名詞
えきかきていさいぼうがん	腋窩基底細胞癌	win	名詞
えきかきゅうせい	腋窩急性	win	名詞
えきかきゅうせいりんぱせつえん	腋窩急性リンパ節炎	win	名詞
えきかけっかんしぼうしゅ	腋窩血管脂肪腫	win	名詞
えきかけっかんしゅ	腋窩血管腫	win	名詞
えきかけっかんそんしょう	腋窩血管損傷	win	名詞
えきかこくしょくしゅ	腋窩黒色腫	win	名詞
えきかしっしん	腋窩湿疹	win	名詞
えきかしぼうしゅ	腋窩脂肪腫	win	名詞
えきかしゅちょう	腋窩腫脹	win	名詞
えきかしゅよう	腋窩腫瘍	win	名詞
えきかしゅりゅう	腋窩腫瘤	win	名詞
えきかしょう	腋窩鞘	mac	名詞
えきかしんけい	腋窩神経	mac	名詞
えきかしんけいそんしょう	腋窩神経損傷	win	名詞
えきかしんけいぶろっく	腋窩神経ブロック	win	名詞
えきかしんけいまひ	腋窩神経麻痺	win	名詞
えきかじょうみゃく	腋窩静脈	mac	名詞
えきかじょうみゃくそんしょう	腋窩静脈損傷	win	名詞
えきかせっかいかじょうひしゅ	腋窩石灰化上皮腫	win	名詞
えきかせつ	腋窩せつ	win	名詞
えきかせんざいせいはくせん	腋窩浅在性白癬	win	名詞
えきかそんしょう	腋窩損傷	win	名詞
えきかたかんしょう	腋窩多汗症	win	名詞
えきかだい	腋窩第	win	名詞
えきかだい1どねっしょう	腋窩第1度熱傷	win	名詞
えきかだい2どねっしょう	腋窩第2度熱傷	win	名詞
えきかだい3どねっしょう	腋窩第3度熱傷	win	名詞
えきかだいいちどねっしょう	腋窩第1度熱傷	win	名詞
えきかだいさんどねっしょう	腋窩第3度熱傷	win	名詞
えきかだいにどねっしょう	腋窩第2度熱傷	win	名詞
えきかどうみゃく	腋窩動脈	both	名詞
えきかどうみゃくけっせんしょう	腋窩動脈血栓症	win	名詞
えきかどうみゃくそんしょう	腋窩動脈損傷	win	名詞
えきかなんせいせんいしゅ	腋窩軟性線維腫	win	名詞
えきかなんちせいひふかいよう	腋窩難治性皮膚潰瘍	win	名詞
えきかにゅうぼう	腋窩乳房	win	名詞
えきかねっしょう	腋窩熱傷	win	名詞
えきかぱじぇっとびょう	腋窩パジェット病	win	名詞
えきかひふかいよう	腋窩皮膚潰瘍	win	名詞
えきかひふがん	腋窩皮膚癌	win	名詞
えきかぶかんじだしょう	腋窩部カンジダ症	win	名詞
えきかぶしゅりゅう	腋窩部腫瘤	win	名詞
えきかぶつう	腋窩部痛	win	名詞
えきかぶなんぶしゅよう	腋窩部軟部腫瘍	win	名詞
えきかぶのうよう	腋窩部膿瘍	win	名詞
えきかほうそうえん	腋窩蜂巣炎	win	名詞
えきかぼーえんびょう	腋窩ボーエン病	win	名詞
えきかゆうきょくさいぼうがん	腋窩有棘細胞癌	win	名詞
えきかよう	腋窩よう	win	名詞
えきかりんぱかんしゅ	腋窩リンパ管腫	win	名詞
えきかりんぱせつ	腋窩リンパ節	both	名詞
えきかりんぱせつしゅちょう	腋窩リンパ節腫脹	win	名詞
えきかりんぱせつてんい	腋窩リンパ節転移	win	名詞
えきざるべ	エキザルベ	win	名詞
えきしまれーざー	エキシマレーザー	mac	名詞
えきしゅう	腋臭	win	名詞
えきしゅうしょう	腋臭症	win	名詞
えきしゅうしょうしゅじゅつ	腋臭症手術	win	名詞
えきじょう	液状	win	名詞
えきじょうふぇのーる	液状フェノール	win	名詞
えきせいいんし	液性因子	mac	名詞
えきせいめんえき	液性免疫	mac	名詞
えきせめすたん	エキセメスタン	win	名詞
えきせんとりっくじんかくしょうがい	エキセントリック人格障害	win	名詞
えきせんとりっくぱーそなりてぃしょうがい	エキセントリックパーソナリティ障害	win	名詞
えきそこるぽーる	エキソコルポール	win	名詞
えきそさいとーしす	エキソサイトーシス	mac	名詞
えきそん	エキソン	mac	名詞
えきたいそくせん	液体塞栓	mac	名詞
えきたいちょりゅう	液体貯留	mac	名詞
えきたいほう	液体法	mac	名詞
えきのこっかす	エキノコッカス	mac	名詞
えきのこっくすしょう	エキノコックス症	win	名詞
えきのこっくすせいこつずいえん	エキノコックス性骨髄炎	win	名詞
えきもう	腋毛	mac	名詞
えくすとらにーるふくまくとうせきえき	エクストラニール腹膜透析液	win	名詞
えくすめーとさん	エクスメート散	win	名詞
えくせぐらんさん	エクセグラン散	win	名詞
えくせみどさん	エクセミド散	win	名詞
えくせらーぜかりゅう	エクセラーゼ顆粒	win	名詞
えくせらーぜはいごうかりゅう	エクセラーゼ配合顆粒	win	名詞
えくせるだーむがいようえき	エクセルダーム外用液	win	名詞
えくせるだーむくりーむ	エクセルダームクリーム	win	名詞
えくぼちょうこう	えくぼ兆候	mac	名詞
えくらーくりーむ	エクラークリーム	win	名詞
えくらーなんこう	エクラー軟膏	win	名詞
えくらーぷらすたー	エクラープラスター	win	名詞
えくらーろーしょん	エクラーローション	win	名詞
えくりんかんかん	エクリン汗管	mac	名詞
えくりんかんきょくさいぼうしゅ	エクリン汗棘細胞腫	win	名詞
えくりんかんこうがん	エクリン汗孔癌	win	名詞
えくりんかんこうしゅ	エクリン汗孔腫	win	名詞
えくりんかんせん	エクリン汗腺	mac	名詞
えくりんかんせんがん	エクリン汗腺癌	win	名詞
えくりんかんせんしゅ	エクリン汗腺腫	win	名詞
えくりんかんせんのしょうがい	エクリン汗腺の障害	win	名詞
えくりんかんのうしゅ	エクリン汗嚢腫	win	名詞
えくりんせんたんこうかんせんしゅ	エクリン先端孔汗腺腫	win	名詞
えこのみーくらすしょうこうぐん	エコノミークラス症候群	mac	名詞
えこりしんがんなんこう	エコリシン眼軟膏	win	名詞
えこりしんてんがんえき	エコリシン点眼液	win	名詞
えこーういるす	エコーウイルス	mac	名詞
えこーういるすかんせんしょう	エコーウイルス感染症	win	名詞
えこーういるすきかんしえん	エコーウイルス気管支炎	win	名詞
えこーういるすこうたいか	エコーウイルス抗体価	win	名詞
えこーういるすずいまくえん	エコーウイルス髄膜炎	win	名詞
えし	壊死	mac	名詞
えしかいよう	壊死潰瘍	win	名詞
えしごせいかんこうへん	壊死後性肝硬変	win	名詞
えしせい	壊死性	win	名詞
えしせいえんしょう	壊死性炎症	win	名詞
えしせいかいようせいこうないえん	壊死性潰瘍性口内炎	win	名詞
えしせいかいようせいししゅうえん	壊死性潰瘍性歯周炎	win	名詞
えしせいかいようせいしにくえん	壊死性潰瘍性歯肉炎	win	名詞
えしせいがいじえん	壊死性外耳炎	win	名詞
えしせいきょうまくえん	壊死性強膜炎	win	名詞
えしせいきんまくえん	壊死性筋膜炎	both	名詞
えしせいけっかんえん	壊死性血管炎	both	名詞
えしせいけつまくえん	壊死性結膜炎	win	名詞
えしせいこうないえん	壊死性口内炎	win	名詞
えしせいしょくどうえん	壊死性食道炎	win	名詞
えしせいすいえん	壊死性膵炎	win	名詞
えしせいだえきせんかせいしょう	壊死性唾液腺化生症	win	名詞
えしせいちょうえん	壊死性腸炎	both	名詞
えしせいとうしょう	壊死性凍傷	mac	名詞
えしせいどうみゃくえん	壊死性動脈炎	win	名詞
えしせいのうえん	壊死性脳炎	mac	名詞
えしせいのうひしょう	壊死性膿皮症	mac	名詞
えしせいはいえん	壊死性肺炎	win	名詞
えしせいみゃっかんえん	壊死性脈管炎	win	名詞
えしせいゆうそうせいこうはん	壊死性遊走性紅斑	mac	名詞
えしそう	壊死巣	mac	名詞
えしぶ	壊死部	mac	名詞
えじぷときょひしょう	エジプト巨脾症	win	名詞
えすかいん	エスカイン	win	名詞
えすき	S期	mac	名詞
えすくれざざい	エスクレ坐剤	win	名詞
えすじ	S児	mac	名詞
えすじじょう	S字状	mac	名詞
えすじじょうじょうみゃくどう	S字状静脈洞	mac	名詞
えすじょうけっちょう	S状結腸	mac	名詞
えすじょうけっちょうかんまく	S状結腸間膜	mac	名詞
えすじょうけっちょうどうみゃく	S状結腸動脈	mac	名詞
えすじょうどうこう	S状洞溝	mac	名詞
えすたぞらむ	エスタゾラム	both	名詞
えすてらーぜ	エステラーゼ	mac	名詞
えすてらーぜにじゅうせんしょく	エステラーゼ二重染色	mac	名詞
えすてるがた	エステル型	mac	名詞
えすてるちんどらいしろっぷ	エステルチンドライシロップ	win	名詞
えすとらじおーる	エストラジオール	mac	名詞
えすとらじおーるちょうふざい	エストラジオール貼付剤	win	名詞
えすとらむすちんりんさんえすてるなとりうむすいわぶつ	エストラムスチンリン酸エステルナトリウム水和物	win	名詞
えすとりおーる	エストリオール	both	名詞
えすとろげん	エストロゲン	mac	名詞
えすとろげんけつぼうせいちつえん	エストロゲン欠乏性膣炎	win	名詞
えすとろげんごなどとろぴんふかしけん	エストロゲン・プロゲステロン負荷試験	win	名詞
えすとろじぇん	エストロジェン	win	名詞
えすとろじぇんかじょうしょう	エストロジェン過剰症	win	名詞
えすとろじぇんけつぼうせいちつえん	エストロジェン欠乏性腟炎	win	名詞
えすとろじぇんさんせいしゅよう	エストロジェン産生腫瘍	win	名詞
えすとろじぇんれせぷたー	エストロジェンレセプター	win	名詞
えすとろん	エストロン	mac	名詞
えすぱれきさんかりゅう	エスパレキサン顆粒	win	名詞
えすぱんでいあ	エスパンデイア	win	名詞
えすぴーとろーち	SPトローチ	win	名詞
えすぺたっとてんびえき	エスペタット点鼻液	win	名詞
えすぽーひかよう	エスポー皮下用	win	名詞
えぜちみぶ	エゼチミブ	mac	名詞
えそ	壊疽	win	名詞
えそせい	壊疽性	both	名詞
えそせいいんとうえん	壊疽性咽頭炎	win	名詞
えそせいえん	壊疽性炎	mac	名詞
えそせいおうかくまく	壊疽性横隔膜	win	名詞
えそせいおうかくまくへるにあ	壊疽性横隔膜ヘルニア	win	名詞
えそせいきゅうしんじょうけっかくしん	壊疽性丘疹状結核疹	win	名詞
えそせいこうないえん	壊疽性口内炎	win	名詞
えそせいさい	壊疽性臍	win	名詞
えそせいさいへるにあ	壊疽性臍ヘルニア	win	名詞
えそせいしずいえん	壊疽性歯髄炎	win	名詞
えそせいしにくえん	壊疽性歯肉炎	win	名詞
えそせいそけい	壊疽性鼡径	win	名詞
えそせいそけいへるにあ	壊疽性鼡径ヘルニア	win	名詞
えそせいたいじょうほうしん	壊疽性帯状疱疹	win	名詞
えそせいたん	壊疽性胆	win	名詞
えそせいたんさいかんえん	壊疽性胆細管炎	win	名詞
えそせいたんのうえん	壊疽性胆嚢炎	win	名詞
えそせいだいたい	壊疽性大腿	win	名詞
えそせいだいたいへるにあ	壊疽性大腿ヘルニア	win	名詞
えそせいちゅうすいえん	壊疽性虫垂炎	win	名詞
えそせいのうひしょう	壊疽性膿皮症	both	名詞
えそせいびえん	壊疽性鼻炎	win	名詞
えそせいふくへき	壊疽性腹壁	win	名詞
えそせいふくへきへるにあ	壊疽性腹壁ヘルニア	win	名詞
えそせいへいさこうへるにあ	壊疽性閉鎖孔ヘルニア	win	名詞
えそせいへんとうしゅういえん	壊疽性扁桃周囲炎	win	名詞
