たい	他為	mac	名詞
てんいせいぜんとうどうがん	転移性前頭洞癌	win	名詞
てんいせいぜんりつせんしゅよう	転移性前立腺腫瘍	win	名詞
てんいせいだいちょうしゅよう	転移性大腸腫瘍	win	名詞
てんいせいちつしゅよう	転移性腟腫瘍	win	名詞
てんいせいちつしゅよう	転移性膣腫瘍	win	名詞
てんいせいちょうけいこつどうがん	転移性蝶形骨洞癌	win	名詞
てんいせいちょくちょうしゅよう	転移性直腸腫瘍	win	名詞
てんいせいとうがいこつしゅよう	転移性頭蓋骨腫瘍	win	名詞
てんいせいのうしゅよう	転移性脳腫瘍	both	名詞
てんいせいはいがん	転移性肺癌	win	名詞
てんいせいはいしゅよう	転移性肺腫瘍	both	名詞
てんいせいひしゅよう	転移性脾腫瘍	win	名詞
てんいせいひふがん	転移性皮膚癌	win	名詞
てんいせいひふしゅよう	転移性皮膚腫瘍	win	名詞
てんいせいびくうがん	転移性鼻腔癌	win	名詞
てんいせいふくじんしゅよう	転移性副腎腫瘍	win	名詞
てんいせいふくびくうがん	転移性副鼻腔癌	win	名詞
てんいせいふくへきしゅよう	転移性腹壁腫瘍	win	名詞
てんいせいへんぺいじょうひがん	転移性扁平上皮癌	win	名詞
てんいせいぼうこうがん	転移性膀胱癌	win	名詞
てんいせいらんそうがん	転移性卵巣癌	win	名詞
てんいせいりんぱせつしゅよう	転移性リンパ節腫瘍	win	名詞
てんいそう	転移巣	mac	名詞
てんいひべん	転位皮弁	mac	名詞
てんいんかんこくぎむ	転院勧告義務	mac	名詞
てんえー	Ⅹa	mac	名詞
てんかあどれなりん	添加アドレナリン	mac	名詞
てんかえぴねふりん	添加エピネフリン	mac	名詞
てんかん	てんかん	both	名詞
てんかんがっぺいにんしん	てんかん合併妊娠	win	名詞
てんかんきおう	てんかん既往	mac	名詞
てんかんごいっかせいまひ	てんかん後一過性麻痺	win	名詞
てんかんしょうほっさ	てんかん小発作	win	名詞
てんかんじゅうせきしょう	てんかん重積症	win	名詞
てんかんじゅうせきじょうたい	てんかん重積状態	both	名詞
てんかんせい	てんかん性	win	名詞
てんかんせいさくらんじょうたい	てんかん性錯乱状態	win	名詞
てんかんせいしょうがい	転換性障害	both	名詞
てんかんせいじどうしょう	てんかん性自動症	win	名詞
てんかんせいせいしんしょうがい	てんかん性精神障害	win	名詞
てんかんせいせいしんびょう	てんかん性精神病	win	名詞
てんかんたんじゅんぶぶんほっさ	てんかん単純部分発作	win	名詞
てんかんだいほっさ	てんかん大発作	win	名詞
てんかんはんのう	転換反応	win	名詞
てんかんひすてりー	転換ヒステリー	win	名詞
てんかんふくざつぶぶんほっさ	てんかん複雑部分発作	win	名詞
てんかんほっさ	てんかん発作	both	名詞
てんかんほっさじゅうせき	てんかん発作重積	win	名詞
てんかんほっさじゅうせきしょう	てんかん発作重積症	win	名詞
てんかんほっさじゅうせきじょうたい	てんかん発作重積状態	mac	名詞
てんかんようせいしんびょう	てんかん様精神病	win	名詞
てんかんようほっさ	てんかん様発作	win	名詞
てんがんえき	点眼液	win	名詞
てんがんよう	点眼用	win	名詞
てんがんようえりこり	点眼用エリコリ	win	名詞
てんけいてきへんずつう	典型的片頭痛	win	名詞
てんけいへんずつう	典型片頭痛	win	名詞
てんざ	転座	both	名詞
てんざとりそみー	転座トリソミー	win	名詞
てんざとりそみー	転座トリソミー13	win	名詞
てんざとりそみー	転座トリソミー18	win	名詞
てんざとりそみー	転座トリソミー21	win	名詞
てんざとりそみー13	転座トリソミー13	win	名詞
てんざとりそみー18	転座トリソミー18	win	名詞
てんざとりそみー21	転座トリソミー21	win	名詞
てんしかかいほうこっせつ	転子下開放骨折	win	名詞
てんしかこっせつ	転子下骨折	win	名詞
てんしかんかいほうこっせつ	転子間開放骨折	win	名詞
てんしかんこっせつ	転子間骨折	win	名詞
てんしかんつうかいほうこっせつ	転子貫通開放骨折	win	名詞
てんしかんつうこっせつ	転子貫通骨折	win	名詞
てんしけんえん	転子腱炎	win	名詞
てんしぶ	転子部	mac	名詞
てんしゃいんし	転写因子	mac	名詞
てんしろん	テンシロン	mac	名詞
てんしろんてすと	テンシロンテスト	both	名詞
てんじゅがん	天寿がん	mac	名詞
てんじょうかくかしょう	点状角化症	win	名詞
てんじょうかくしつゆうかいしょう	点状角質融解症	win	名詞
てんじょうかくまくえん	点状角膜炎	win	名詞
てんじょうかれいせいはくないしょう	点状加齢性白内障	win	名詞
てんじょうかんせん	点状乾癬	win	名詞
てんじょうしゅうぞくせいしきそせいぼはん	点状集簇性色素性母斑	win	名詞
てんじょうしゅうぞくせいぼはん	点状集簇性母斑	win	名詞
てんじょうしゅっけつ	点状出血	both	名詞
てんじょうなんこついけいせいしょう	点状軟骨異形成症	win	名詞
てんじょうのしゅっけつ	点状の出血	mac	名詞
てんじょうはくないしょう	点状白内障	win	名詞
てんじょうひょうそうかくまくえん	点状表層角膜炎	win	名詞
てんじょうひょうそうかくまくしょう	点状表層角膜症	mac	名詞
てんじょうみゃくらくまくないそうしょう	点状脈絡膜内層症	win	名詞
てんてきちゅうしゃ	点滴注射	win	名詞
てんてきよう	点滴用	win	名詞
てんとう	点頭	win	名詞
てんとうけいしゅく	点頭痙縮	win	名詞
てんとうけいれん	点頭痙攣	win	名詞
てんとうそう	転倒創	mac	名詞
てんとうてんかん	点頭てんかん	win	名詞
てんとうほっさ	点頭発作	win	名詞
てんとか	テント下	win	名詞
てんとかのうしゅよう	テント下脳腫瘍	win	名詞
てんとかりょうせいのうしゅよう	テント下良性脳腫瘍	win	名詞
てんとし	テント枝	mac	名詞
てんとじょう	テント上	win	名詞
てんとじょうTは	テント状T波	win	名詞
てんとじょうげ	テント上下	win	名詞
てんとじょうげあくせいずいまくしゅ	テント上下悪性髄膜腫	win	名詞
てんとじょうげしんけいこうしゅ	テント上下神経膠腫	win	名詞
てんとじょうげしんけいしょうしゅ	テント上下神経鞘腫	win	名詞
てんとじょうげずいまくしゅ	テント上下髄膜腫	win	名詞
てんとじょうげてんいせいしゅよう	テント上下転移性腫瘍	win	名詞
てんとじょうげのうしゅよう	テント上下脳腫瘍	win	名詞
てんとじょうしんけいしょうしゅ	テント上神経鞘腫	win	名詞
てんとじょうのうしゅよう	テント上脳腫瘍	win	名詞
てんとじょうりょうせいのうしゅよう	テント上良性脳腫瘍	win	名詞
てんとせっこん	テント切痕	both	名詞
てんとせっこんへるにあ	テント切痕ヘルニア	both	名詞
てんとつぜんへんい	点突然変異	mac	名詞
てんなんしょう	テンナンショウ	win	名詞
てんねん	天然	win	名詞
てんねんけいさんあるみにうむ	天然ケイ酸アルミニウム	win	名詞
てんねんし	天然歯	mac	名詞
てんねんほしついんし	天然保湿因子	mac	名詞
てんび	点鼻	mac	名詞
てんびえき	点鼻液	win	名詞
てんびやく	点鼻薬	mac	名詞
てんぷしけん	貼付試験	mac	名詞
てんぷじょう	貼付錠	mac	名詞
てんへんい	点変異	mac	名詞
てんぽうそう	天疱瘡	win	名詞
てんぽうそうがた	天疱瘡型	mac	名詞
てんぽらるぱっぷ	テンポラルパップ	win	名詞
てんま	テンマ	win	名詞
てんま	天麻	win	名詞
てんまくかのうしゅよう	天膜下脳腫瘍	win	名詞
てんまくじょうのうしゅよう	天膜上脳腫瘍	win	名詞
てんもんどう	テンモンドウ	win	名詞
てーかいんげんまつ	テーカイン原末	win	名詞
といんびーほう	トインビー法	mac	名詞
とぅえるぶえー	Ⅻa	mac	名詞
とぅれっとしょうこうぐん	トゥレット症候群	mac	名詞
とうあんぷるほう	糖アンプル法	win	名詞
とうい	糖衣	mac	名詞
とうい	頭位	both	名詞
とうい	頭囲	mac	名詞
とういかくだい	頭囲拡大	win	名詞
とういがんしん	頭位眼振	both	名詞
とういがんしんけんさ	頭位眼振検査	mac	名詞
とういげんうんしょう	頭位眩暈症	win	名詞
とういせいげんうんしょう	頭位性眩暈症	win	名詞
とういとうい	頭位/頭位	mac	名詞
とういのいじ	頭位の維持	mac	名詞
とういひとうい	頭位/非頭位	mac	名詞
とういへんか	頭位変化	mac	名詞
とういへんかん	頭位変換	mac	名詞
とういへんかんがんしん	頭位変換眼振	mac	名詞
とういへんかんがんしんけんさ	頭位変換眼振検査	mac	名詞
とういへんかんせい	頭位変換性	win	名詞
とういへんかんせいめまい	頭位変換性めまい	win	名詞
とういめまいしょう	頭位めまい症	win	名詞
とういんはんそう	当院搬送	mac	名詞
とうえいきょくせん	投影曲線	mac	名詞
とうえいほう	投影法	mac	名詞
とうか	当科	mac	名詞
とうかい	東海	win	名詞
とうかいほうそうこういしょう	頭開放創後遺症	win	名詞
とうかくじょうきとう	桃核承気湯	win	名詞
とうかこう	透過孔	mac	名詞
とうかせいこうしん	透過性亢進	mac	名詞
とうかせんりょう	等価線量	mac	名詞
とうかはんのう	糖化反応	mac	名詞
とうかん	盗汗	mac	名詞
とうかん	等感	mac	名詞
とうかんきょくせん	等感曲線	mac	名詞
とうかんしんかてーてる	套管針カテーテル	win	名詞
とうかんどきょくせん	等感度曲線	mac	名詞
とうがい	頭蓋	mac	名詞
とうがいいんとうかんのあくせいしゅよう	頭蓋咽頭管の悪性腫瘍	win	名詞
とうがいいんとうかんりょうせいしゅよう	頭蓋咽頭管良性腫瘍	win	名詞
とうがいいんとうしゅ	頭蓋咽頭腫	win	名詞
とうがいえんがいぶかいほうこっせつ	頭蓋円蓋部開放骨折	win	名詞
とうがいえんがいぶこっせつ	頭蓋円蓋部骨折	both	名詞
とうがいえんがいぶせんじょうこっせつ	頭蓋円蓋部線状骨折	win	名詞
とうがいか	頭蓋窩	mac	名詞
とうがいかん	頭蓋冠	mac	名詞
とうがいかんおう	頭蓋陥凹	win	名詞
とうがいかんにゅうしょう	頭蓋陥入症	win	名詞
とうがいがいしょう	頭蓋外傷	win	名詞
とうがいがんめんこつけいせいふぜんしょう	頭蓋顔面骨形成不全症	win	名詞
とうがいきゅうりゅうかいほうこっせつ	頭蓋穹隆開放骨折	win	名詞
とうがいきゅうりゅうこっせつ	頭蓋穹隆骨折	win	名詞
とうがいきゅうりゅうぶかいほうこっせつ	頭蓋穹隆部開放骨折	win	名詞
とうがいきゅうりゅうぶこっせつ	頭蓋穹隆部骨折	win	名詞
とうがいきゅうりゅうぶせんじょうこっせつ	頭蓋穹隆部線状骨折	win	名詞
とうがいけいついいこうぶきけい	頭蓋頸椎移行部奇形	mac	名詞
とうがいけつごうたい	頭蓋結合体	both	名詞
とうがいこっかんたんいけいせいしょう	頭蓋骨幹端異形成症	win	名詞
とうがいこつ	頭蓋骨	both	名詞
とうがいこつあくせいしゅよう	頭蓋骨悪性腫瘍	win	名詞
とうがいこついじょう	頭蓋骨異常	win	名詞
とうがいこつかいほうこっせつ	頭蓋骨開放骨折	win	名詞
とうがいこつかいほうせいかんぼつこっせつ	頭蓋骨開放性陥没骨折	win	名詞
とうがいこつかいほうせいふんさいこっせつ	頭蓋骨開放性粉砕骨折	win	名詞
とうがいこつかこつしょう	頭蓋骨過骨症	win	名詞
とうがいこつかんおうこっせつ	頭蓋骨陥凹骨折	win	名詞
とうがいこつかんぼつこっせつ	頭蓋骨陥没骨折	win	名詞
とうがいこつけっかんしゅ	頭蓋骨血管腫	win	名詞
とうがいこつけっそん	頭蓋骨欠損	win	名詞
とうがいこつこっせつ	頭蓋骨骨折	both	名詞
とうがいこつこっせつこういしょう	頭蓋骨骨折後遺症	win	名詞
とうがいこつこつずいえん	頭蓋骨骨髄炎	win	名詞
とうがいこつこつにくしゅ	頭蓋骨骨肉腫	win	名詞
とうがいこつこつまくかけっしゅ	頭蓋骨骨膜下血腫	win	名詞
とうがいこつこていぶつのとっしゅつ	頭蓋骨固定物の突出	win	名詞
とうがいこつしゅよう	頭蓋骨腫瘍	win	名詞
とうがいこつせんいしゅ	頭蓋骨線維腫	win	名詞
とうがいこつせんいせいこついけいせいしょう	頭蓋骨線維性骨異形成症	win	名詞
とうがいこつせんじょうこっせつ	頭蓋骨線状骨折	win	名詞
とうがいこつそうきゆごうしょう	頭蓋骨早期癒合症	mac	名詞
とうがいこつそんしょう	頭蓋骨損傷	win	名詞
とうがいこつたはつかいほうこっせつ	頭蓋骨多発開放骨折	win	名詞
とうがいこつたはつこっせつ	頭蓋骨多発骨折	win	名詞
とうがいこつないばんかこつしょう	頭蓋骨内板過骨症	win	名詞
とうがいこつぱじぇっとびょう	頭蓋骨パジェット病	win	名詞
とうがいこつふくざつこっせつ	頭蓋骨複雑骨折	win	名詞
とうがいこつふんさいこっせつ	頭蓋骨粉砕骨折	win	名詞
とうがいこつへいさこっせつ	頭蓋骨閉鎖骨折	win	名詞
とうがいこつへんけい	頭蓋骨変形	win	名詞
とうがいこつべんかんせん	頭蓋骨弁感染	win	名詞
とうがいこつほうごう	頭蓋骨縫合	mac	名詞
とうがいこつまくどう	頭蓋骨膜洞	win	名詞
とうがいこつまくりゅう	頭蓋骨膜瘤	win	名詞
とうがいこつゆごう	頭蓋骨癒合	mac	名詞
とうがいこつゆごうしょう	頭蓋骨癒合症	win	名詞
とうがいこつりょうせいしゅよう	頭蓋骨良性腫瘍	win	名詞
とうがいさいだいちょう	頭蓋最大長	mac	名詞
とうがいしゅういじょうみゃくどう	頭蓋周囲静脈洞	win	名詞
とうがいしょうちゅう	頭蓋小柱	mac	名詞
とうがいずいまくりゅう	頭蓋髄膜瘤	win	名詞
とうがいせきついひれつ	頭蓋脊椎披裂	win	名詞
とうがいせんてんいじょう	頭蓋先天異常	win	名詞
とうがいちょうえいは	頭蓋頂鋭波	win	名詞
とうがいついこつせつごうぶいじょう	頭蓋椎骨接合部異常	win	名詞
とうがいてい	頭蓋底	both	名詞
とうがいていかいほうこっせつ	頭蓋底開放骨折	win	名詞
とうがいていかんにゅうしょう	頭蓋底陥入症	both	名詞
とうがいていこっせつ	頭蓋底骨折	both	名詞
とうがいていこつにくしゅ	頭蓋底骨肉腫	win	名詞
とうがいていしゅよう	頭蓋底腫瘍	win	名詞
とうがいていせきさくしゅ	頭蓋底脊索腫	win	名詞
とうがいていのうりゅう	頭蓋底脳瘤	win	名詞
とうがいない	頭蓋内	both	名詞
とうがいないあつ	頭蓋内圧	mac	名詞
とうがいないあつこうしん	頭蓋内圧亢進	both	名詞
とうがいないあつこうしんしょう	頭蓋内圧亢進症	win	名詞
とうがいないあつていか	頭蓋内圧低下	win	名詞
とうがいないいぶつ	頭蓋内異物	win	名詞
とうがいないがっぺいしょう	頭蓋内合併症	win	名詞
とうがいないきしつせいしっかん	頭蓋内器質性疾患	win	名詞
とうがいないきしつせいしょうがい	頭蓋内器質性障害	win	名詞
とうがいないきしゅ	頭蓋内気腫	win	名詞
とうがいないきりゅう	頭蓋内気瘤	win	名詞
とうがいないけっかんしゅ	頭蓋内血管腫	win	名詞
とうがいないけっしゅ	頭蓋内血腫	mac	名詞
とうがいないさるこいどーしす	頭蓋内サルコイドーシス	win	名詞
とうがいないしっかん	頭蓋内疾患	win	名詞
とうがいないしゅっけつ	頭蓋内出血	both	名詞
とうがいないしゅよう	頭蓋内腫瘍	win	名詞
とうがいないじょうみゃくどうえん	頭蓋内静脈洞炎	win	名詞
とうがいないじょうみゃくどうけっせんしょう	頭蓋内静脈洞血栓症	win	名詞
とうがいないせっかいか	頭蓋内石灰化	mac	名詞
とうがいないせっかいかしょう	頭蓋内石灰化症	win	名詞
とうがいないせんきょせいびょうへん	頭蓋内占拠性病変	win	名詞
とうがいないそんしょうこういしょう	頭蓋内損傷後遺症	win	名詞
とうがいないてんい	頭蓋内転移	win	名詞
とうがいないどうみゃくりゅう	頭蓋内動脈瘤	win	名詞
とうがいないどうみゃくりゅうはれつによるくもまくかしゅ	頭蓋内動脈瘤破裂によるくも膜下出血	win	名詞
とうがいないのうしゅ	頭蓋内嚢腫	win	名詞
とうがいないのうほう	頭蓋内嚢胞	win	名詞
とうがいないのうよう	頭蓋内膿瘍	win	名詞
とうがいないのうようこういしょう	頭蓋内膿瘍後遺症	win	名詞
とうがいないはいさいぼうしゅよう	頭蓋内胚細胞腫瘍	win	名詞
とうがいないひふどう	頭蓋内皮膚洞	win	名詞
とうがいなんぶそしき	頭蓋軟部組織	mac	名詞
とうがいはれつ	頭蓋破裂	both	名詞
とうがいぶせきさくしゅ	頭蓋部脊索腫	win	名詞
とうがいへんけい	頭蓋変形	win	名詞
とうがいほうごうそうきゆうごうしょう	頭蓋縫合早期融合症	win	名詞
とうがいほうごうそうきゆごうしょう	頭蓋縫合早期癒合症	mac	名詞
とうがいゆごうふぜん	頭蓋癒合不全	win	名詞
とうがいりかいこっせつ	頭蓋離開骨折	win	名詞
とうがいれっこう	頭蓋裂孔	win	名詞
とうがいれつ	頭蓋裂	mac	名詞
とうがし	トウガシ	win	名詞
とうがらし	トウガラシ	win	名詞
とうがらしちんき	トウガラシチンキ	win	名詞
とうがらしまつ	トウガラシ末	win	名詞
とうき	トウキ	win	名詞
とうき	冬季	win	名詞
とうき	当帰	mac	名詞
とうきいんし	当帰飲子	win	名詞
とうきおうとげりしょう	冬期嘔吐下痢症	win	名詞
とうきけんちゅうとう	当帰建中湯	win	名詞
とうきしっしん	冬期湿疹	win	名詞
とうきしゃくやくさん	当帰芍薬散	both	名詞
とうきしゃくやくさんりょう	当帰芍薬散料	win	名詞
とうきとう	当帰湯	win	名詞
とうきゅうかた	投球肩	mac	名詞
とうきゅうこっせつ	投球骨折	win	名詞
とうきゅうしょうがいかた	投球障害肩	mac	名詞
とうきょくきん	頭棘筋	mac	名詞
とうきようたんおう	陶器様胆嚢	mac	名詞
とうくつ	橈屈	both	名詞サ変
とうくつ	頭屈	mac	名詞
とうけい	頭頚	win	名詞
とうけいぶ	頭頚部	both	名詞
とうけいぶがいしょう	頭頚部外傷	win	名詞
とうけいぶがん	頭頚部癌	win	名詞
とうけいぶざしょうこういしょう	頭頚部挫傷後遺症	win	名詞
とうけいぶつう	頭頚部痛	win	名詞
とうけいぶりょうせいなんぶしゅよう	頭頚部良性軟部腫瘍	win	名詞
とうけいぶりんぱせつ	頭頚部リンパ節	mac	名詞
とうけいりんぱせつ	頭頚リンパ節	win	名詞
とうけいりんぱぶ	頭頚リンパ部	win	名詞
とうけっしゅ	頭血腫	both	名詞
とうけつ	盗血	both	名詞
とうけつかた	凍結肩	win	名詞
とうけつこうちょく	凍結硬直	mac	名詞
とうけつりょうほう	凍結療法	mac	名詞
とうけん	透見	mac	名詞
とうげんせい	糖原性	mac	名詞
とうげんせいあみのさん	糖原性アミノ酸	mac	名詞
とうげんびょう	糖原病	both	名詞
とうげんびょう1がた	糖原病1型	win	名詞
とうげんびょう2がた	糖原病2型	win	名詞
とうげんびょう3がた	糖原病3型	win	名詞
とうげんびょう4がた	糖原病4型	win	名詞
とうげんびょう5がた	糖原病5型	win	名詞
とうげんびょう6がた	糖原病6型	win	名詞
とうげんびょう7がた	糖原病7型	win	名詞
とうげんびょういちがた	糖原病1型	win	名詞
とうげんびょうごがた	糖原病5型	win	名詞
とうげんびょうさんがた	糖原病3型	win	名詞
とうげんびょうなながた	糖原病7型	win	名詞
とうげんびょうにがた	糖原病2型	win	名詞
とうげんびょうよんがた	糖原病4型	win	名詞
とうげんびょうろくがた	糖原病6型	win	名詞
とうこうきょひしょう	登校拒否	win	名詞
とうこうきょひしょう	登校拒否症	win	名詞
とうこうしけん	透光試験	mac	名詞
とうこつ	橈骨	both	名詞
とうこつ	頭骨	win	名詞
とうこつえんいこったんせんそんしょう	橈骨遠位骨端線損傷	win	名詞
とうこつえんいたん	橈骨遠位端	win	名詞
とうこつえんいたんかいほうこっせつ	橈骨遠位端開放骨折	win	名詞
とうこつえんいたんかいほうせいふんさいこっせつ	橈骨遠位端開放性粉砕骨折	win	名詞
とうこつえんいたんかんせつないこっせつ	橈骨遠位端関節内骨折	win	名詞
とうこつえんいたんこっせつ	橈骨遠位端骨折	both	名詞
とうこつえんいたんふんさいこっせつ	橈骨遠位端粉砕骨折	win	名詞
とうこつかいほうこっせつ	橈骨開放骨折	win	名詞
とうこつかたん	橈骨下端	win	名詞
とうこつきれつこっせつ	橈骨亀裂骨折	win	名詞
とうこつきんいこったんせんそんしょう	橈骨近位骨端線損傷	win	名詞
とうこつきんいたんかいほうこっせつ	橈骨近位端開放骨折	win	名詞
とうこつきんいたんこっせつ	橈骨近位端骨折	win	名詞
とうこつぎかんせつ	橈骨偽関節	win	名詞
とうこつけいじょうとっき	橈骨茎状突起	win	名詞
とうこつけいじょうとっきかいほうこっせつ	橈骨茎状突起開放骨折	win	名詞
とうこつけいじょうとっきけんしょうえん	橈骨茎状突起腱鞘炎	win	名詞
とうこつけいじょうとっきこっせつ	橈骨茎状突起骨折	win	名詞
とうこつけいぶ	橈骨頚部	win	名詞
とうこつけいぶかいほうこっせつ	橈骨頚部開放骨折	win	名詞
とうこつけいぶこっせつ	橈骨頚部骨折	win	名詞
とうこつけっかんそんしょう	橈骨血管損傷	win	名詞
とうこつこっかん	橈骨骨幹	win	名詞
とうこつこっかんぶ	橈骨骨幹部	win	名詞
とうこつこっかんぶかいほうこっせつ	橈骨骨幹部開放骨折	win	名詞
とうこつこっかんぶこっせつ	橈骨骨幹部骨折	win	名詞
とうこつこっせつ	橈骨骨折	win	名詞
とうこつこっせつごへんけいちゆ	橈骨骨折後変形治癒	win	名詞
とうこつこつしゅ	橈骨骨腫	win	名詞
とうこつこつずいえん	橈骨骨髄炎	win	名詞
とうこつこつたん	橈骨骨端	win	名詞
とうこつこつにくしゅ	橈骨骨肉腫	win	名詞
とうこつしゃっこつえんいぶかいほうこっせつ	橈骨尺骨遠位部開放骨折	win	名詞
とうこつしゃっこつえんいぶこっせつ	橈骨尺骨遠位部骨折	win	名詞
とうこつしゃっこつかいほうこっせつ	橈骨尺骨開放骨折	win	名詞
とうこつしゃっこつこっかんぶかいほうこっせつ	橈骨尺骨骨幹部開放骨折	win	名詞
とうこつしゃっこつこっかんぶこっせつ	橈骨尺骨骨幹部骨折	win	名詞
とうこつしゃっこつこっせつ	橈骨尺骨骨折	win	名詞
とうこつしゅこんかんせつ	橈骨手根関節	both	名詞
とうこつしゅこんかんせつだっきゅう	橈骨手根関節脱臼	win	名詞
とうこつしゅこんかんせつねんざ	橈骨手根関節捻挫	win	名詞
とうこつしゅこんじんたいだんれつ	橈骨手根靱帯断裂	win	名詞
とうこつしゅよう	橈骨腫瘍	win	名詞
とうこつしょうとう	橈骨小頭	win	名詞
とうこつしんけい	橈骨神経	both	名詞
とうこつしんけいえん	橈骨神経炎	win	名詞
とうこつしんけいかんしょうこうぐん	橈骨神経管症候群	win	名詞
とうこつしんけいこう	橈骨神経溝	mac	名詞
とうこつしんけいしょうがい	橈骨神経傷害	win	名詞
とうこつしんけいしんしまひ	橈骨神経深枝麻痺	win	名詞
とうこつしんけいじょうわんぶそんしょう	橈骨神経上腕部損傷	win	名詞
とうこつしんけいせんし	橈骨神経浅枝	mac	名詞
とうこつしんけいそんしょう	橈骨神経損傷	win	名詞
とうこつしんけいだんれつ	橈骨神経断裂	win	名詞
とうこつしんけいふぜんまひ	橈骨神経不全麻痺	win	名詞
とうこつしんけいぶろっく	橈骨神経ブロック	win	名詞
とうこつしんけいまひ	橈骨神経麻痺	win	名詞
