たい	他為	mac	名詞
ちょうかんまくしゅりゅう	腸間膜腫瘤	win	名詞
ちょうかんまくしょうかかんかんしつしゅよう	腸間膜消化管間質腫瘍	win	名詞
ちょうかんまくしょうちょう	腸間膜小腸	mac	名詞
ちょうかんまくしんけいそうそんしょう	腸間膜神経叢損傷	win	名詞
ちょうかんまくじょうみゃくけっせんしょう	腸間膜静脈血栓症	win	名詞
ちょうかんまくじょうみゃくそんしょう	腸間膜静脈損傷	win	名詞
ちょうかんまくそんしょうしゅじゅつ	腸間膜損傷手術	win	名詞
ちょうかんまくどうみゃく	腸間膜動脈	win	名詞
ちょうかんまくどうみゃくけっせんしょう	腸間膜動脈血栓症	win	名詞
ちょうかんまくどうみゃくこうかしょう	腸間膜動脈硬化症	win	名詞
ちょうかんまくどうみゃくしんけいせつ	腸間膜動脈神経節	mac	名詞
ちょうかんまくどうみゃくそくせんしょう	腸間膜動脈塞栓症	win	名詞
ちょうかんまくどうみゃくそんしょう	腸間膜動脈損傷	win	名詞
ちょうかんまくにくしゅ	腸間膜肉腫	win	名詞
ちょうかんまくのうしゅ	腸間膜嚢腫	win	名詞
ちょうかんまくのうよう	腸間膜膿瘍	win	名詞
ちょうかんまくぶ	腸間膜部	mac	名詞
ちょうかんまくへいかつきんにくしゅ	腸間膜平滑筋肉腫	win	名詞
ちょうかんまくへるにあ	腸間膜ヘルニア	win	名詞
ちょうかんまくゆちゃく	腸間膜癒着	win	名詞
ちょうかんまくりょうせいしゅよう	腸間膜良性腫瘍	win	名詞
ちょうかんまくりんぱせつえん	腸間膜リンパ節炎	win	名詞
ちょうかんまくりんぱせつけっかく	腸間膜リンパ節結核	win	名詞
ちょうかんまくりんぱせつしゅちょう	腸間膜リンパ節腫脹	win	名詞
ちょうかんまくりんぱせつちんきゅうせいけっかく	腸間膜リンパ節陳旧性結核	win	名詞
ちょうかんまひ	腸管麻痺	win	名詞
ちょうかんまひせいべんぴ	腸管麻痺性便秘	win	名詞
ちょうかんゆちゃく	腸管癒着	win	名詞
ちょうかんゆちゃくしょうがい	腸管癒着障害	win	名詞
ちょうかんゆちゃくしょうしゅじゅつ	腸管癒着症手術	win	名詞
ちょうかんりようぼうこうかくだいじ	腸管利用膀胱拡大術	win	名詞
ちょうかんりんぱかんかくちょうしょう	腸管リンパ管拡張症	win	名詞
ちょうがいあめーばしょう	腸外アメーバ症	mac	名詞
ちょうがたべーちぇっとびょう	腸型ベーチェット病	win	名詞
ちょうがん	腸癌	win	名詞
ちょうき	聴器	mac	名詞
ちょうきがしょう	長期臥床	mac	名詞
ちょうきけいぞくずがいないのうはけ	長期継続頭蓋内脳波検査	win	名詞
ちょうきとうせき	長期透析	mac	名詞
ちょうきとうせきかんじゃ	長期透析患者	mac	名詞
ちょうきとうよ	長期投与	mac	名詞
ちょうきのうしょうがい	腸機能障害	win	名詞
ちょうきゅうきんかんせんしょう	腸球菌感染症	win	名詞
ちょうきゅうきんはいけつしょう	腸球菌敗血症	win	名詞
ちょうきゅうせいき	超急性期	mac	名詞
ちょうきゅうせいきちりょう	超急性期治療	mac	名詞
ちょうきゅうせいきょぜつ	超急性拒絶	mac	名詞
ちょうきょうさく	腸狭窄	win	名詞
ちょうきょうさくぶせっかいほうごうし	腸狭窄部切開縫合術	win	名詞
ちょうきょうしんけい	長胸神経	mac	名詞
ちょうきょこう	鳥距溝	mac	名詞
ちょうきょだいじ	超巨大児	win	名詞
ちょうきょだいじぶんべん	超巨大児分娩	win	名詞
ちょうきょりいりゅう	長距離移流	mac	名詞
ちょうきよご	長期予後	mac	名詞
ちょうきんつうしょう	頂筋痛症	win	名詞
ちょうけいこうがいしんけいせつぶろっ	蝶形口蓋神経節ブロック	win	名詞
ちょうけいこうはん	蝶形紅斑	mac	名詞
ちょうけいこつ	蝶形骨	both	名詞
ちょうけいこつかいほうこっせつ	蝶形骨開放骨折	win	名詞
ちょうけいこつきょく	蝶形骨棘	mac	名詞
ちょうけいこつこっせつ	蝶形骨骨折	win	名詞
ちょうけいこつしゅよう	蝶形骨腫瘍	win	名詞
ちょうけいこつずいまくしゅ	蝶形骨髄膜腫	win	名詞
ちょうけいこつたい	蝶形骨体	mac	名詞
ちょうけいこつどう	蝶形骨洞	both	名詞
ちょうけいこつどうえん	蝶形骨洞炎	win	名詞
ちょうけいこつどうがん	蝶形骨洞癌	win	名詞
ちょうけいこつどうこう	蝶形骨洞口	mac	名詞
ちょうけいこつどうぽりーぷ	蝶形骨洞ポリープ	win	名詞
ちょうけいこつふん	蝶形骨吻	mac	名詞
ちょうけいこつへいめんずいまくしゅ	蝶形骨平面髄膜腫	win	名詞
ちょうけいこつりょうずいまくしゅ	蝶形骨稜髄膜腫	win	名詞
ちょうけいしつ	腸憩室	win	名詞
ちょうけいしつえん	腸憩室炎	win	名詞
ちょうけいしつせんこう	腸憩室穿孔	win	名詞
ちょうけいじんたいえん	腸脛靱帯炎	win	名詞
ちょうけいじんたいしょうこうぐん	腸脛靱帯症候群	win	名詞
ちょうけいせいちょう	長径成長	mac	名詞
ちょうけいとうちょうじょうみゃくどう	蝶形頭頂静脈洞	mac	名詞
ちょうけいどう	蝶形洞	win	名詞
ちょうけいもうまく	蝶形網膜	win	名詞
ちょうけいもうまくじすとろふぃー	蝶形網膜ジストロフィー	win	名詞
ちょうけいろちょうこう	長経路徴候	mac	名詞
ちょうけっかく	腸結核	both	名詞
ちょうけっかくしょう	腸結核症	win	名詞
ちょうけっせき	腸結石	win	名詞
ちょうげんせんい	張原線維	win	名詞
ちょうこう	徴候	mac	名詞
ちょうこうがいこう	蝶口蓋孔	mac	名詞
ちょうこうがいどうみゃく	蝶口蓋動脈	mac	名詞
ちょうこうがいどうみゃくりゅう	蝶口蓋動脈瘤	win	名詞
ちょうこうそく	腸梗塞	mac	名詞
ちょうこうねつ	超高熱	win	名詞
ちょうこくしじうむしょう	腸コクシジウム症	win	名詞
ちょうこつ	腸骨	both	名詞
ちょうこつ	長骨	mac	名詞
ちょうこつかいほうこっせつ	腸骨開放骨折	win	名詞
ちょうこつかのうよう	腸骨窩膿瘍	win	名詞
ちょうこつかのうようせっかいじゅつ	腸骨窩膿瘍切開術	win	名詞
ちょうこつかのうようそうはじゅつ	腸骨窩膿瘍掻爬術	win	名詞
ちょうこつかふくしんけいぶろっく	腸骨下腹神経ブロック	win	名詞
ちょうこつかぶつう	腸骨窩部痛	win	名詞
ちょうこつきん	腸骨筋	mac	名詞
ちょうこつけっかんそんしょう	腸骨血管損傷	win	名詞
ちょうこつこっせつ	腸骨骨折	win	名詞
ちょうこつこつずいえん	腸骨骨髄炎	win	名詞
ちょうこつしゅよう	腸骨腫瘍	win	名詞
ちょうこつじょうみゃくあっぱくしょうこうぐん	腸骨静脈圧迫症候群	win	名詞
ちょうこつそけいしんけい	腸骨鼡径神経	mac	名詞
ちょうこつそけいしんけいぶろっく	腸骨鼠径神経ブロック	win	名詞
ちょうこつどうみゃくけっせんしょう	腸骨動脈血栓症	win	名詞
ちょうこつどうみゃくそくせんしょう	腸骨動脈塞栓症	win	名詞
ちょうこつどうみゃくりゅう	腸骨動脈瘤	win	名詞
ちょうこつはくりこっせつ	腸骨剥離骨折	win	名詞
ちょうこつばん	長骨盤	win	名詞
ちょうこつびこつきん	腸骨尾骨筋	mac	名詞
ちょうこつぶ	腸骨部	mac	名詞
ちょうこつぶざしょう	腸骨部挫傷	win	名詞
ちょうこつぶだぼくしょう	腸骨部打撲傷	win	名詞
ちょうこつぶつう	腸骨部痛	win	名詞
ちょうこつぶのうよう	腸骨部膿瘍	win	名詞
ちょうこつゆーいんぐにくしゅ	腸骨ユーイング肉腫	win	名詞
ちょうこつよくこっせつかんけつてきしゅし	腸骨翼骨折観血的手術	win	名詞
ちょうこつりょう	腸骨稜	both	名詞
ちょうこつりょうきょく	腸骨稜棘	win	名詞
ちょうこつりょうじゃくねんせいこつなんこつしょう	腸骨稜若年性骨軟骨症	win	名詞
ちょうこつりんぱせつてんい	腸骨リンパ節転移	win	名詞
ちょうこつりんぱのう	腸骨リンパ嚢	mac	名詞
ちょうさ	長鎖	mac	名詞
ちょうさいかいぼう	調査解剖	win	名詞
ちょうさしぼうさん	長鎖脂肪酸	mac	名詞
ちょうざい	長坐位	mac	名詞
ちょうざいきほんりょう	調剤基本料	win	名詞
ちょうざいよう	調剤用	win	名詞
ちょうざつおん	腸雑音	both	名詞
ちょうしかんおう	蝶篩陥凹	mac	名詞
ちょうしくっきん	長趾屈筋	mac	名詞
ちょうししんきん	長指伸筋	win	名詞
ちょうししんきん	長趾伸筋	mac	名詞
ちょうしっかん	腸疾患	win	名詞
ちょうしゅっけつ	腸出血	win	名詞
ちょうしゅよう	腸腫瘍	win	名詞
ちょうしょうきん	長掌筋	mac	名詞
ちょうしょうちょう	頂踵長	mac	名詞
ちょうしんけい	聴神経	both	名詞
ちょうしんけいいしゅく	聴神経萎縮	win	名詞
ちょうしんけいえん	聴神経炎	win	名詞
ちょうしんけいこうしゅ	聴神経膠腫	win	名詞
ちょうしんけいしゅよう	聴神経腫瘍	both	名詞
ちょうしんけいしょうがい	聴神経障害	both	名詞
ちょうしんけいしょうしゅ	聴神経鞘腫	both	名詞
ちょうしんけいそんしょう	聴神経損傷	win	名詞
ちょうしんけいのうしゅ	聴神経嚢腫	win	名詞
ちょうしんさんかく	聴診三角	mac	名詞
ちょうしんしょけん	聴診所見	mac	名詞
ちょうしんせいぶつ	腸新生物	win	名詞
ちょうじ	チョウジ	win	名詞
ちょうじくねん	腸軸捻	mac	名詞
ちょうじくねんてん	腸軸捻転	win	名詞
ちょうじくめんすいちょくだんそう	長軸面垂直断層	mac	名詞
ちょうじくめんすいへいだんそう	長軸面水平断層	mac	名詞
ちょうじすきねじあ	腸ジスキネジア	win	名詞
ちょうじすとましょう	腸ジストマ症	win	名詞
ちょうじゅうけつせんちゅうしょう	腸住血線虫症	win	名詞
ちょうじゅうせき	腸重積	mac	名詞
ちょうじゅうせきしょう	腸重積症	both	名詞
ちょうじゅうせきしょうさいはつ	腸重積症再発	win	名詞
ちょうじゅうせきしょうせいふくじゅつ	腸重積症整復術	win	名詞
ちょうじゅうそく	腸充塞	win	名詞
ちょうじゆ	チョウジ油	win	名詞
ちょうじょうひ	腸上皮	mac	名詞
ちょうじょうひかせい	腸上皮化生	both	名詞
ちょうずいし	長髄歯	win	名詞
ちょうせいこうどうはんのうちょうりょくけんさ	聴性行動反応聴力検査	mac	名詞
ちょうせいこちょう	腸性鼓腸	win	名詞
ちょうせいしたんひふえん	腸性肢端皮膚炎	win	名詞
ちょうせいしはんびょう	腸性紫斑病	win	名詞
ちょうせいせいぶんぴ	調整性分泌	mac	名詞
ちょうせいせんたんひふえん	腸性先端皮膚炎	win	名詞
ちょうせいのう	調整能	mac	名詞
ちょうせいのうかんはんのう	聴性脳幹反応	mac	名詞
ちょうせいのうかんはんのうけんさ	聴性脳幹反応検査	mac	名詞
ちょうせいはんのう	超生反応	mac	名詞
ちょうせいやく	調整薬	mac	名詞
ちょうせいゆうはつ	聴性誘発	win	名詞
ちょうせっかいじゅつ	腸切開術	win	名詞
ちょうせつ	調節	win	名詞
ちょうせついけい	調節縊頚	mac	名詞
ちょうせついじょうきんちょう	調節異常緊張	win	名詞
ちょうせつきんちょうけいれん	調節緊張痙攣	win	名詞
ちょうせつきんちょうしょう	調節緊張症	win	名詞
ちょうせつけいれん	調節痙攣	both	名詞
ちょうせつじょこういしょう	腸切除後遺症	win	名詞
ちょうせつすいじゃく	調節衰弱	win	名詞
ちょうせつせい	調節性	win	名詞
ちょうせつせいがんせいひろう	調節性眼精疲労	win	名詞
ちょうせつせいこうさいまひ	調節性虹彩麻痺	win	名詞
ちょうせつせいしゃし	調節性斜視	win	名詞
ちょうせつせいないしゃし	調節性内斜視	both	名詞
ちょうせつせいふくそう	調節性輻輳	mac	名詞
ちょうせつのう	調節能	mac	名詞
ちょうせつふぜん	調節不全	win	名詞
ちょうせつふぜんまひ	調節不全麻痺	win	名詞
ちょうせつまひ	調節麻痺	win	名詞
ちょうせんこう	腸穿孔	both	名詞
ちょうせんこうふくまくえん	腸穿孔腹膜炎	win	名詞
ちょうせんたくてきどうちゅうかがくりょうほう	超選択的動注化学療法	mac	名詞
ちょうせんつう	腸仙痛	win	名詞
ちょうせんてんせいゆちゃく	腸先天性癒着	win	名詞
ちょうぜんちゅうしょう	腸蠕虫症	win	名詞
ちょうぜんどう	腸蠕動	mac	名詞
ちょうたんじかんがた	超短時間型	mac	名詞
ちょうだんせい	超弾性	win	名詞
ちょうだんせいきょうせいようせん	超弾性矯正用線	win	名詞
ちょうだんせいこいるすぷりんぐ	超弾性コイルスプリング	win	名詞
ちょうちきんまくきゅう	腸恥筋膜弓	mac	名詞
ちょうちつろう	腸腟瘻	win	名詞
ちょうちふす	腸チフス	win	名詞
ちょうちふすせいかんせつえん	腸チフス性関節炎	win	名詞
ちょうちふすせいしんきんえん	腸チフス性心筋炎	win	名詞
ちょうちふすせいしんないまくえん	腸チフス性心内膜炎	win	名詞
ちょうちふすせいずいまくえん	腸チフス性髄膜炎	win	名詞
ちょうちふすせいはいえん	腸チフス性肺炎	win	名詞
ちょうつがいかんせつ	蝶番関節	mac	名詞
ちょうていしゅっさんたいじゅうじ	超低出産体重児	win	名詞
ちょうていしゅっしょう	超低出生	mac	名詞
ちょうていしゅっしょうたいじゅうじ	超低出生体重児	mac	名詞
ちょうていしゅっせい	超低出生	mac	名詞
ちょうていしゅっせいたいじゅうじ	超低出生体重児	both	名詞
ちょうてんい	腸転位	win	名詞
ちょうでんちょう	腸殿長	mac	名詞
ちょうとう	長頭	mac	名詞
ちょうとうこう	チョウトウコウ	win	名詞
ちょうとうさん	釣藤散	win	名詞
ちょうとうしょう	長頭症	win	名詞
ちょうとうそくしゅこんしんきん	長橈側手根伸筋	mac	名詞
ちょうとうそくしゅこんしんきんけんそんしょう	長橈側手根伸筋腱損傷	win	名詞
ちょうとうそくしゅこんしんきんけんだんれつ	長橈側手根伸筋腱断裂	win	名詞
ちょうとうそくしゅこんしんきんそんしょう	長橈側手根伸筋損傷	win	名詞
ちょうとうそくしゅこんしんきんだんれつ	長橈側手根伸筋断裂	win	名詞
ちょうとりこもなすしょう	腸トリコモナス症	win	名詞
ちょうどうじょうみゃくきけい	腸動静脈奇形	win	名詞
ちょうない	腸内	win	名詞
ちょうないかんせん	腸内感染	win	名詞
ちょうないがすはいきしょち	腸内ガス排気処置	win	名詞
ちょうないきん	腸内菌	mac	名詞
ちょうないくう	腸内腔	mac	名詞
ちょうないさいきんせいせきついえん	腸内細菌性脊椎炎	win	名詞
ちょうないてんきん	長内転筋	mac	名詞
ちょうないよう	腸内容	mac	名詞
ちょうねんてん	腸捻転	win	名詞
ちょうねんまく	腸粘膜	mac	名詞
ちょうのいろーぜ	腸ノイローゼ	win	名詞
ちょうのうしゅ	腸嚢腫	mac	名詞
ちょうのうよう	腸膿瘍	win	名詞
ちょうのしきゅうないまくしょう	腸の子宮内膜症	win	名詞
ちょうはえようちゅうしょう	腸はえ幼虫症	win	名詞
ちょうはん	聴斑	mac	名詞
ちょうひこつきん	長腓骨筋	mac	名詞
ちょうひしつ	聴皮質	mac	名詞
ちょうひしつけんぼうせいしつごしょう	超皮質健忘性失語症	win	名詞
ちょうひしつせいうんどうせいしつご	超皮質性運動性失語	win	名詞
ちょうひしつせいかんかくせいしつご	超皮質性感覚性失語	win	名詞
ちょうひしつせいしつご	超皮質性失語	win	名詞
ちょうびしょうがんきゅう	超微小眼球	win	名詞
ちょうふくしきゅう	重複子宮	mac	名詞
ちょうふくじんうにょうかん	重複腎盂尿管	mac	名詞
ちょうふくたんのう	重複胆嚢	mac	名詞
ちょうふくだいどうみゃくきゅう	重複大動脈弓	mac	名詞
ちょうふんごうじゅつ	腸吻合術	win	名詞
ちょうふんせんちゅうしょう	腸糞線虫症	win	名詞
ちょうぶ	頂部	mac	名詞
ちょうへいさしょうしゅじゅつ	腸閉鎖症手術	win	名詞
ちょうへいそく	腸閉塞	both	名詞
ちょうへいそくしょうしゅじゅつ	腸閉塞症手術	win	名詞
ちょうへきへるにあ	腸壁ヘルニア	win	名詞
ちょうへきむしんけいせつしょう	腸壁無神経節症	win	名詞
ちょうへるにあ	腸ヘルニア	win	名詞
ちょうほうせん	聴放線	mac	名詞
ちょうぼしがいてんきん	長母指外転筋	mac	名詞
ちょうぼしがいてんきんだんれつ	長母指外転筋断裂	win	名詞
ちょうぼしくっきん	長母指屈筋	mac	名詞
ちょうぼしくっきん	長母趾屈筋	mac	名詞
ちょうぼしくっきんけんだんれつ	長母指屈筋腱断裂	win	名詞
ちょうぼししんきん	長母指伸筋	mac	名詞
ちょうぼししんきん	長母趾伸筋	mac	名詞
ちょうぼししんきんけんそんしょう	長母指伸筋腱損傷	win	名詞
ちょうぼししんきんけんだんれつ	長母指伸筋腱断裂	win	名詞
ちょうぽりーぷしょう	腸ポリープ症	win	名詞
ちょうまひ	腸麻痺	win	名詞
ちょうみじゅくじ	超未熟児	win	名詞
ちょうめいさいぼうかんかんしゅ	澄明細胞汗管腫	win	名詞
ちょうめいさいぼうかんせんしゅ	澄明細胞汗腺腫	win	名詞
ちょうもう	聴毛	mac	名詞
ちょうやくびょう	跳躍病	win	名詞
ちょうようかりゅう	腸溶顆粒	win	名詞
ちょうようきん	腸腰筋	both	名詞
ちょうようきんえん	腸腰筋炎	win	名詞
ちょうようきんのうよう	腸腰筋膿瘍	win	名詞
ちょうようとう	腸癰湯	win	名詞
ちょうようどうみゃく	腸腰動脈	mac	名詞
ちょうりつふぜん	調律不全	mac	名詞
ちょうりょくいきち	聴力閾値	mac	名詞
ちょうりょくけっそん	聴力欠損	win	名詞
ちょうりょくしょうがい	聴力障害	win	名詞
ちょうりょくず	聴力図	mac	名詞
ちょうりょくせん	張力線	mac	名詞
ちょうりょくそうしつ	聴力喪失	win	名詞
ちょうりょくていか	聴力低下	win	名詞
ちょうりょくれべる	聴力レベル	mac	名詞
ちょうりんぱかんかくちょうしょう	腸リンパ管拡張症	mac	名詞
ちょうりんぱほんかん	腸リンパ本幹	both	名詞
ちょうるーぷ	腸ループ	mac	名詞
ちょうろう	腸瘻	win	名詞
ちょうろうこうきがっぺいしょう	腸瘻後期合併症	win	名詞
ちょうろうぞうせつじゅつ	腸瘻造設術	win	名詞
ちょうろっきん	腸肋筋	mac	名詞
ちょうわん	長腕	mac	名詞
ちょくげきそんしょう	直撃損傷	mac	名詞
ちょくじょう	直上	mac	名詞
ちょくじょうみゃくどう	直静脈洞	mac	名詞
ちょくせつあっぱくしけつ	直接圧迫止血	mac	名詞
ちょくせつえいどう	直接泳動	mac	名詞
ちょくせつがたびりるびん	直接型ビリルビン	mac	名詞
ちょくせつきょうけんほう	直接鏡検法	win	名詞
ちょくせつくーむすしけん	直接Coombs試験	win	名詞
ちょくせつけんいん	直接牽引	mac	名詞
ちょくせつけんきょう	直接検鏡	mac	名詞
ちょくせつこっせつちゆ	直接骨折治癒	mac	名詞
ちょくせつさよう	直接作用	mac	名詞
ちょくせつしいん	直接死因	mac	名詞
ちょくせつそけいへるにあ	直接鼠径ヘルニア	win	名詞
ちょくせつたいけん	直接体験	mac	名詞
ちょくせつびりるびん	直接ビリルビン	both	名詞
ちょくせつふくやくかくにんたんきりょうほう	直接服薬確認短期療法	mac	名詞
ちょくせんかそくき	直線加速器	win	名詞
ちょくせんかそくきによるていいほうしゃせ	直線加速器による定位放射線治療	win	名詞
ちょくせんかそくど	直線加速度	mac	名詞
ちょくぞうきょう	直像鏡	both	名詞
ちょくたつこうとうきょう	直達喉頭鏡	mac	名詞
ちょくちょう	直腸	win	名詞
ちょくちょうCA	直腸CA	win	名詞
ちょくちょうMALTりんぱしゅ	直腸MALTリンパ腫	win	名詞
ちょくちょうSじょうけっちょういぶつ	直腸S状結腸異物	win	名詞
ちょくちょうSじょうけっちょうえん	直腸S状結腸炎	win	名詞
ちょくちょうSじょうけっちょうがん	直腸S状結腸癌	win	名詞
ちょくちょうSじょうぶけっちょうがん	直腸S状部結腸癌	win	名詞
ちょくちょうSじょうぶじょうひないがん	直腸S状部上皮内癌	win	名詞
ちょくちょうあくせい	直腸悪性	win	名詞
ちょくちょうあくせいこくしょくしゅ	直腸悪性黒色腫	win	名詞
ちょくちょうあくせいしゅよう	直腸悪性腫瘍	win	名詞
ちょくちょうあくせいりんぱしゅ	直腸悪性リンパ腫	win	名詞
ちょくちょういぶつじょきょじゅつ	直腸異物除去術	win	名詞
ちょくちょういぶつそうにゅうこういしょう	直腸異物挿入後遺症	win	名詞
ちょくちょういんしんろう	直腸陰唇瘻	win	名詞
ちょくちょうえいんろう	直腸会陰瘻	win	名詞
ちょくちょうえすじょうけっちょういぶつ	直腸S状結腸異物	win	名詞
ちょくちょうえすじょうけっちょうえん	直腸S状結腸炎	win	名詞
ちょくちょうえすじょうぶけっちょうがん	直腸S状部結腸癌	win	名詞
ちょくちょうえすじょうぶじょうひないがん	直腸S状部上皮内癌	win	名詞
ちょくちょうえん	直腸炎	win	名詞
ちょくちょうおん	直腸温	mac	名詞
ちょくちょうかいよう	直腸潰瘍	win	名詞
ちょくちょうかるちのいど	直腸カルチノイド	win	名詞
ちょくちょうかんようけいしゅよう	直腸間葉系腫瘍	win	名詞
ちょくちょうがん	直腸癌	both	名詞
ちょくちょうがんきょうふしょう	直腸癌恐怖症	win	名詞
ちょくちょうがんこつてんい	直腸癌骨転移	win	名詞
ちょくちょうがんしゅじゅつこういしょう	直腸癌手術後遺症	win	名詞
ちょくちょうがんじゅつごさいはつ	直腸癌術後再発	win	名詞
ちょくちょうがんせんこう	直腸癌穿孔	win	名詞
ちょくちょうきょう	直腸鏡	win	名詞
ちょくちょうきょうさく	直腸狭窄	win	名詞
ちょくちょうきょうさくけいせいしゅじゅ	直腸狭窄形成手術	win	名詞
ちょくちょうきょうさくしょう	直腸狭窄症	win	名詞
ちょくちょうくろーんびょう	直腸クローン病	win	名詞
ちょくちょうけいしつ	直腸憩室	win	名詞
ちょくちょうけいしつえん	直腸憩室炎	win	名詞
ちょくちょうけいしつせんこう	直腸憩室穿孔	win	名詞
ちょくちょうけっかく	直腸結核	win	名詞
ちょくちょうこうもんきけい	直腸肛門奇形	mac	名詞
ちょくちょうこうもんきのう	直腸肛門機能	win	名詞
ちょくちょうこうもんしゅういのうよう	直腸肛門周囲膿瘍	win	名詞
ちょくちょうこうもんだつ	直腸肛門脱	win	名詞
ちょくちょうこうもんはんしゃ	直腸肛門反射	mac	名詞
ちょくちょうこうもんへいさ	直腸肛門閉鎖	mac	名詞
ちょくちょうこうもんろう	直腸肛門瘻	mac	名詞
ちょくちょうしきゅうか	直腸子宮窩	mac	名詞
ちょくちょうししん	直腸指診	mac	名詞
ちょくちょうしぼうしゅ	直腸脂肪腫	win	名詞
ちょくちょうしぼうにくしゅ	直腸脂肪肉腫	win	名詞
ちょくちょうしゅういえん	直腸周囲炎	win	名詞
ちょくちょうしゅういのうよう	直腸周囲膿瘍	win	名詞
ちょくちょうしゅういのうようせっかいじ	直腸周囲膿瘍切開術	win	名詞
ちょくちょうしゅっけつ	直腸出血	win	名詞
ちょくちょうしゅよう	直腸腫瘍	win	名詞
ちょくちょうしゅようてきしゅつじゅつ	直腸腫瘍摘出術	win	名詞
ちょくちょうしゅりゅう	直腸腫瘤	win	名詞
ちょくちょうしょうかかんかんしつしゅよう	直腸消化管間質腫瘍	win	名詞
ちょくちょうしょうがい	直腸障害	win	名詞
ちょくちょうしん	直腸診	mac	名詞
ちょくちょうじゅうせきしょう	直腸重積症	win	名詞
ちょくちょうじょうひないがん	直腸上皮内癌	win	名詞
ちょくちょうじょうみゃくりゅう	直腸静脈瘤	both	名詞
ちょくちょうせい	直腸性	mac	名詞
ちょくちょうせいべんぴ	直腸性便秘	win	名詞
