たい	他為	mac	名詞
たいあつぶんさんしんぐ	体圧分散寝具	mac	名詞
たいい	胎位	both	名詞
たいいいじょうしんせいじ	胎位異常新生児	win	名詞
たいいいじょうたいじ	胎位異常胎児	win	名詞
たいいせい	体位性	win	名詞
たいいせいしっしん	体位性失神	win	名詞
たいいせいしんせん	体位性振戦	win	名詞
たいいせいせきちゅうそくわんしょう	体位性脊柱側弯症	win	名詞
たいいせいたんぱくにょう	体位性蛋白尿	win	名詞
たいいせいていけつあつ	体位性低血圧	win	名詞
たいいせいていけつあつしょう	体位性低血圧症	win	名詞
たいいせいひんみゃくしょうこうぐん	体位性瀕脈症候群	mac	名詞
たいいせいめまい	体位性めまい	win	名詞
たいいほじ	体位保持	mac	名詞
たいいんじ	退院時	win	名詞
たいうんどうのう	耐運動能	mac	名詞
たいえきくぶん	体液区分	mac	名詞
たいえきせいめんえきふぜんしょう	体液性免疫不全症	win	名詞
たいえきそうしつ	体液喪失	mac	名詞
たいえきそせい	体液組成	mac	名詞
たいえきちょうせつふぜんしょう	体液調節不全症	win	名詞
たいえきちょりゅう	体液貯留	win	名詞
たいえきのうど	体液濃度	mac	名詞
たいえきりょう	体液量	both	名詞
たいえきりょうげんしょうしょう	体液量減少症	win	名詞
たいおんこうか	体温降下	mac	名詞
たいかくけつごうせん	対角結合線	mac	名詞
たいかくし	対角枝	mac	名詞
たいかくたい	対角帯	mac	名詞
たいかん	体幹	both	名詞
たいかん	帯環	win	名詞
たいかんあつざそんしょう	体幹圧挫損傷	win	名詞
たいかんいじょう	体感異常	win	名詞
たいかんかいほうそうこういしょう	体幹開放創後遺症	win	名詞
たいかんぎぷすしゃーれ	体幹ギプスシャーレ	win	名詞
たいかんぎぷすしーね	体幹ギプスシーネ	win	名詞
たいかんぎぷすほうたい	体幹ギプス包帯	win	名詞
たいかんけっかんしゅ	体幹血管腫	win	名詞
たいかんげんかくせいぶんれつびょう	体感幻覚性分裂病	win	名詞
たいかんこっせつこういしょう	体幹骨折後遺症	win	名詞
たいかんさっかそう	体幹擦過創	win	名詞
たいかんしょうしつ	体感消失	win	名詞
たいかんしょうせいとうごうしっちょうしょう	体感症性統合失調症	win	名詞
たいかんしょうせいぶんれつびょう	体感症性分裂病	win	名詞
たいかんしんけいそんしょうこういしょう	体幹神経損傷後遺症	win	名詞
たいかんせいしょくぼはん	体幹青色母斑	win	名詞
たいかんそんしょう	体幹損傷	win	名詞
たいかんたんしゅくがた	体幹短縮型	mac	名詞
たいかんだい	体幹第	win	名詞
たいかんだい1どねっしょう	体幹第1度熱傷	win	名詞
たいかんだい1どふしょく	体幹第1度腐蝕	win	名詞
たいかんだい2どねっしょう	体幹第2度熱傷	win	名詞
たいかんだい2どふしょく	体幹第2度腐蝕	win	名詞
たいかんだい3どねっしょう	体幹第3度熱傷	win	名詞
たいかんだい3どふしょく	体幹第3度腐蝕	win	名詞
たいかんだいいちどねっしょう	体幹第1度熱傷	win	名詞
たいかんだいいちどふしょく	体幹第1度腐蝕	win	名詞
たいかんだいさんどねっしょう	体幹第3度熱傷	win	名詞
たいかんだいさんどふしょく	体幹第3度腐蝕	win	名詞
たいかんだいにどねっしょう	体幹第2度熱傷	win	名詞
たいかんだいにどふしょく	体幹第2度腐蝕	win	名詞
たいかんだつり	帯環脱離	win	名詞
たいかんちゅうししょう	体幹虫刺症	win	名詞
たいかんとうしょう	体幹凍傷	win	名詞
たいかんねっしょう	体幹熱傷	win	名詞
たいかんのう	耐寒能	mac	名詞
たいかんのきゅうせいりんぱせつえん	体幹の急性リンパ節炎	win	名詞
たいかんはそん	帯環破損	win	名詞
たいかんひふじょうひないがん	体幹皮膚上皮内癌	win	名詞
たいかんひまん	体幹肥満	mac	名詞
たいかんひょうざいそんしょう	体幹表在損傷	win	名詞
たいかんひょうひぼはん	体幹表皮母斑	win	名詞
たいかんふしょく	体幹腐蝕	win	名詞
たいかんふてきごう	帯環不適合	win	名詞
たいかんぶ	体幹部	mac	名詞
たいかんぷらすちっくぎぷす	体幹プラスチックギプス	win	名詞
たいかんぷらすちっくぎぷすしーね	体幹プラスチックギプスシーネ	win	名詞
たいかんへんぺいぼはん	体幹扁平母斑	win	名詞
たいかんほうそうえん	体幹蜂巣炎	win	名詞
たいかんぼはん	体幹母斑	win	名詞
たいかんぼはんさいぼうぼはん	体幹母斑細胞母斑	win	名詞
たいかんよう	帯環用	win	名詞
たいかんようぶらけっと	帯環用ブラケット	win	名詞
たいかんろうじんせいけっかんしゅ	体幹老人性血管腫	win	名詞
たいが	胎芽	both	名詞
たいがい	体外	win	名詞
たいがいしきいんあつじんこうこきゅう	体外式陰圧人工呼吸器治療	win	名詞
たいがいしきしょうげきははさいりょうほう	体外式衝撃波破砕療法	mac	名詞
たいがいしきせきついこていじゅつ	体外式脊椎固定術	win	名詞
たいがいしきはいほじょ	体外式肺補助	win	名詞
たいがいしょうげきはじんにょうかん	体外衝撃波腎・尿管結石破砕術	win	名詞
たいがいしょうげきはたんせきはさいし	体外衝撃波胆石破砕術	win	名詞
たいがいしょうげきははせきじゅつ	体外衝撃波破石術	mac	名詞
たいがいじゅせい	体外受精	mac	名詞
たいがいぺーすめーきんぐ	体外ペースメーキング	win	名詞
たいがき	胎芽期	mac	名詞
たいがく	怠学	win	名詞
たいがせいにくしゅ	胎芽性肉腫	win	名詞
たいがん	体癌	win	名詞
たいきしゅくしゅ	待機宿主	mac	名詞
たいきせい	耐気性	mac	名詞
たいきてきしゅじゅつ	待機的手術	mac	名詞
たいきゃくしんけいしょう	退却神経症	mac	名詞
たいきりょうほう	待機療法	mac	名詞
たいくう	体腔	mac	名詞
たいくうないてんい	体腔内転移	mac	名詞
たいけいさいぼうそう	多型細胞層	mac	名詞
たいけいせい	退形成	mac	名詞
たいけいせいせいじょういしゅ	退形成性上衣腫	win	名詞
たいけいせいせいせいさいぼうしゅ	退形成性星細胞腫	win	名詞
たいげ	帯下	win	名詞
たいげかた	帯下過多	win	名詞
たいこう	胎向	both	名詞
たいこういじょうしんせいじ	胎向異常新生児	win	名詞
たいこういじょうたいじ	胎向異常胎児	win	名詞
たいこうかいせんいじょう	胎向回旋異常	win	名詞
たいこうき	退行期	win	名詞
たいこうきうつじょうたい	退行期うつ状態	win	名詞
たいこうきうつびょう	退行期うつ病	win	名詞
たいこうきげんかくもうそうじょうたい	退行期幻覚妄想状態	win	名詞
たいこうきこつそしょうしょう	退行期骨粗鬆症	win	名詞
たいこうきぱらのいあ	退行期パラノイア	win	名詞
たいこうきもうそうじょうたい	退行期妄想状態	win	名詞
たいこうきん	対抗筋	mac	名詞
たいこうし	対鉤歯	win	名詞
たいこうせいきんいしゅく	退行性筋萎縮	win	名詞
たいこうせいへんか	退行性変化	mac	名詞
たいこうはんしゃ	対光反射	mac	名詞
たいこうゆそう	対向輸送	mac	名詞
たいこうりゅう	対向流	mac	名詞
たいこうりゅうこうかんけい	対向流交換系	mac	名詞
たいこうりゅうぞうふうくけい	対向流増幅系	mac	名詞
たいごう	対合	mac	名詞
たいごきめいりょくけんさ	対語記銘力検査	win	名詞
たいさいぼういでんしくみかえ	体細胞遺伝子組換え	mac	名詞
たいさいぼうちょうとつぜんへんい	体細胞超突然変異	mac	名詞
たいさいぼうへんい	体細胞変異	mac	名詞
たいさつえい	他医撮影	win	名詞
たいし	体肢	mac	名詞
たいし	胎脂	mac	名詞
たいしつせい	体質性	win	名詞
たいしつせいおうだん	体質性黄疸	both	名詞
たいしつせいこうしんちょう	体質性高身長	win	名詞
たいしつせいこうびりるびんけっしょう	体質性高ビリルビン血症	win	名詞
たいしつせいさいせいふりょうせいひんけつ	体質性再生不良性貧血	win	名詞
たいしつせいししゅんきちはつしょう	体質性思春期遅発症	win	名詞
たいしつせいていしんちょう	体質性低身長	win	名詞
たいしゃがた	代謝型	mac	名詞
たいしゃきっこうざい	代謝拮抗剤	mac	名詞
たいしゃきっこうやく	代謝拮抗薬	mac	名詞
たいしゃこうしん	代謝亢進	mac	名詞
たいしゃこうそ	代謝酵素	mac	名詞
たいしゃさんぶつ	代謝産物	mac	名詞
たいしゃしょうがい	代謝障害	both	名詞
たいしゃせい	代謝性	win	名詞
たいしゃせいあしどーしす	代謝性アシドーシス	both	名詞
たいしゃせいあるかろーしす	代謝性アルカローシス	both	名詞
たいしゃせいこんすい	代謝性昏睡	win	名詞
たいしゃせいしんきんしょう	代謝性心筋症	win	名詞
たいしゃせいにゅーろぱしー	代謝性ニューロパシー	win	名詞
たいしゃせいのうしょう	代謝性脳症	win	名詞
たいしゃのう	代謝能	mac	名詞
たいしゃぶつ	代謝物	mac	名詞
たいしゃほうわがた	代謝飽和型	mac	名詞
たいしゃやはいせつ	代謝や排泄	mac	名詞
たいしゅうきょうふ	体臭恐怖	win	名詞
たいしゅく	退縮	mac	名詞
たいしょうぐん	対照群	mac	名詞
たいしょうりょうほう	対症療法	mac	名詞
たいしょくちょう	褪色調	mac	名詞
たいじ	胎児	win	名詞
たいじDIC	胎児DIC	win	名詞
たいじRhふてきごう	胎児Rh不適合	win	名詞
たいじあしどーしす	胎児アシドーシス	win	名詞
たいじあるこーるしょうこうぐん	胎児アルコール症候群	win	名詞
たいじあーるhふてきごう	胎児Rh不適合	win	名詞
たいじいじょう	胎児異常	win	名詞
たいじいんし	胎児因子	win	名詞
たいじいんしによるようすいかしょうしょう	胎児因子による羊水過少症	win	名詞
たいじいんしによるようすいかたしょう	胎児因子による羊水過多症	win	名詞
たいじえいようしっちょうしょう	胎児栄養失調症	win	名詞
たいじえいようふりょう	胎児栄養不良	win	名詞
たいじえしせいぜんちょうえん	胎児壊死性全腸炎	win	名詞
たいじえんしょう	胎児炎症	mac	名詞
たいじえんしょうはんのう	胎児炎症反応	mac	名詞
たいじかこうど	胎児下降度	win	名詞
たいじかし	胎児仮死	both	名詞
たいじかしのせいかがくてきいじょうをがっぺいするぶんべ	胎児仮死の生化学的異常を合併する分娩	win	名詞
たいじかじょうはついく	胎児過剰発育	win	名詞
たいじかじょうはついくのためのぼたいかんり	胎児過剰発育のための母体管理	win	名詞
たいじかんせん	胎児感染	mac	名詞
たいじかんゆけつしょうこうぐん	胎児間輸血症候群	mac	名詞
たいじがいかいてんじゅつ	胎児外回転術	win	名詞
たいじがた	胎児型	mac	名詞
たいじき	胎児期	mac	名詞
たいじきけい	胎児奇形	win	名詞
たいじきのうふぜん	胎児機能不全	mac	名詞
たいじきょう	胎児鏡	mac	名詞
たいじきょうか	胎児鏡下	mac	名詞
たいじきょうくうようすいくうしゃんとじゅつ	胎児胸腔・羊水腔シャント術	win	名詞
たいじきょうすい	胎児胸水	win	名詞
たいじけっこうどうたい	胎児血行動態	mac	名詞
たいじけつ	胎児血	mac	名詞
たいじけつえきがたふてきごう	胎児血液型不適合	win	名詞
たいじこつばんふきんこう	胎児骨盤不均衡	win	名詞
たいじこつばんふきんこうによるぶんべんていし	胎児骨盤不均衡による分娩停止	win	名詞
たいじさいたいかしけんらく	胎児臍帯下肢巻絡	win	名詞
たいじさいたいかたん	胎児臍帯過短	win	名詞
たいじさいたいかねんてん	胎児臍帯過捻転	win	名詞
たいじさいたいけいぶけんらく	胎児臍帯頚部巻絡	win	名詞
たいじさいたいけっせつ	胎児臍帯結節	win	名詞
たいじさいたいけんらく	胎児臍帯巻絡	win	名詞
たいじさいたいじょうしけんらく	胎児臍帯上肢巻絡	win	名詞
たいじしっけつ	胎児失血	win	名詞
たいじしゅくしょうじゅつ	胎児縮小術	win	名詞
たいじしゅっけつ	胎児出血	both	名詞
たいじしんおんいじょう	胎児心音異常	win	名詞
たいじしんおんふりょう	胎児心音不良	win	名詞
たいじしんだん	胎児診断	mac	名詞
たいじしんぱくじんつうず	胎児心拍陣痛図	both	名詞
たいじしんぱくすういじょう	胎児心拍数異常	win	名詞
たいじしんぱくすうきせん	胎児心拍数基線	mac	名詞
たいじしんぱくすうじんつうず	胎児心拍数陣痛図	win	名詞
たいじじすとれす	胎児ジストレス	both	名詞
たいじじすとれすのせいかがくてきいじょうをがっぺいする	胎児ジストレスの生化学的異常を合併する分娩	win	名詞
たいじじすとれすのせいかがくてきいじょうをがっぺいする	胎児ジストレスの生化学的異常合併分娩	win	名詞
たいじじゅんかんいざん	胎児循環遺残	win	名詞
たいじじょみゃく	胎児徐脈	win	名詞
たいじすいしゅ	胎児水腫	win	名詞
たいじすいじんしょう	胎児水腎症	win	名詞
たいじすいとうしょう	胎児水頭症	win	名詞
たいじせい	胎児性	win	名詞
たいじせいおうもんきんにくしゅ	胎児性横紋筋肉腫	mac	名詞
たいじせいがん	胎児性癌	win	名詞
たいじせいこうがんしゅよう	胎児性睾丸腫瘍	win	名詞
たいじせいせいそうしゅよう	胎児性精巣腫瘍	win	名詞
たいじせいせきがきゅうしょう	胎児性赤芽球症	win	名詞
たいじせいなんこついえいようしょう	胎児性軟骨異栄養症	win	名詞
たいじせいばいどく	胎児性梅毒	win	名詞
たいじせきがきゅうしょう	胎児赤芽球症	win	名詞
たいじたいばんきのうしょうがい	胎児胎盤機能障害	win	名詞
たいじたいばんきのうていか	胎児胎盤機能低下	win	名詞
たいじたいばんきのうふぜん	胎児胎盤機能不全	win	名詞
たいじちゅうすうしんけいけいきけい	胎児中枢神経系奇形	win	名詞
たいじちゅうだいのうみゃくさいこうけつりゅうそくど	胎児中大脳脈最高血流速度	mac	名詞
たいじていさんそけっしょう	胎児低酸素血症	win	名詞
たいじていさんそしょう	胎児低酸素症	win	名詞
たいじとうでんちょう	胎児頭殿長	win	名詞
たいじないかいてんじゅつ	胎児内回転術	win	名詞
たいじのようすいかんせんしょう	胎児の羊水感染症	win	名詞
たいじはいけつしょう	胎児敗血症	win	名詞
たいじはついくかど	胎児発育過度	win	名詞
たいじはついくせんえん	胎児発育遷延	win	名詞
たいじはついくちえん	胎児発育遅延	win	名詞
たいじはついくふぜん	胎児発育不全	both	名詞
たいじひだんといんしょうこうぐん	胎児ヒダントイン症候群	win	名詞
たいじひょうひ	胎児表皮	mac	名詞
たいじひんみゃく	胎児頻脈	win	名詞
たいじふくまくにんしん	胎児腹膜妊娠	win	名詞
たいじふせいみゃく	胎児不整脈	win	名詞
たいじぶ	胎児部	mac	名詞
たいじむさんそしょう	胎児無酸素症	win	名詞
たいじゅ	対珠	mac	名詞
たいじゅうげんしょう	体重減少	win	名詞
たいじゅうげんしょうせいせいむげっけい	体重減少性性無月経	win	名詞
たいじゅうげんしょうせいむげっけい	体重減少性無月経	win	名詞
たいじゅうぞうか	体重増加	both	名詞
たいじゅうぞうかふぜん	体重増加不全	win	名詞
たいじゅうぞうかふりょう	体重増加不良	win	名詞
たいじゅつのう	耐術能	mac	名詞
たいじゅんかん	体循環	mac	名詞
たいじゆけつ	胎児輸血	mac	名詞
たいじょう	帯状	win	名詞
たいじょうかい	帯状回	mac	名詞
たいじょうかいへるにあ	帯状回ヘルニア	mac	名詞
たいじょうかくまくこんだく	帯状角膜混濁	win	名詞
たいじょうかくまくしょう	帯状角膜症	win	名詞
たいじょうこう	帯状溝	mac	名詞
たいじょうしっしん	帯状湿疹	win	名詞
たいじょうせんい	苔状繊維	mac	名詞
たいじょうそく	帯状束	mac	名詞
たいじょうだつもうしょう	帯状脱毛症	win	名詞
たいじょうへるぺす	帯状ヘルペス	win	名詞
たいじょうほうしん	帯状疱疹	both	名詞
たいじょうほうしんういるす	帯状疱疹ウイルス	mac	名詞
たいじょうほうしんご	帯状疱疹後	win	名詞
たいじょうほうしんごけろいどけいせい	帯状疱疹後ケロイド形成	win	名詞
たいじょうほうしんごさんさしんけいつう	帯状疱疹後三叉神経痛	win	名詞
たいじょうほうしんごしつしんけいせつえん	帯状疱疹後膝神経節炎	win	名詞
たいじょうほうしんごしんけいつう	帯状疱疹後神経痛	win	名詞
たいじょうほうしんごたはつせい	帯状疱疹後多発性	win	名詞
たいじょうほうしんごたはつせいにゅーろぱちー	帯状疱疹後多発性ニューロパチー	win	名詞
たいじょうほうしんしんけいえん	帯状疱疹神経炎	win	名詞
たいじょうほうしんせい	帯状疱疹性	win	名詞
たいじょうほうしんせいかくけつまくえん	帯状疱疹性角結膜炎	win	名詞
たいじょうほうしんせいがいじえん	帯状疱疹性外耳炎	win	名詞
たいじょうほうしんせいきょうまくえん	帯状疱疹性強膜炎	win	名詞
たいじょうほうしんせいけつまくえん	帯状疱疹性結膜炎	win	名詞
たいじょうほうしんせいこうさいえん	帯状疱疹性虹彩炎	win	名詞
たいじょうほうしんせいこうさいもうようたいえん	帯状疱疹性虹彩毛様体炎	win	名詞
たいじょうほうしんせいずいまくえん	帯状疱疹性髄膜炎	win	名詞
たいじょうほうしんせいずいまくのうえん	帯状疱疹性髄膜脳炎	win	名詞
たいじょうほうしんせいせきずいえん	帯状疱疹性脊髄炎	win	名詞
たいじょうほうしんせいのうえん	帯状疱疹性脳炎	win	名詞
たいじょうほうしんせいのうせきずいえん	帯状疱疹性脳脊髄炎	win	名詞
たいじょうほうそう	帯状疱瘡	win	名詞
たいじようけつせいしっかん	胎児溶血性疾患	mac	名詞
たいじりん	対耳輪	mac	名詞
たいじんかんけいしょうがい	対人関係障害	win	名詞
たいじんかんけいりょうほう	対人関係療法	mac	名詞
たいじんきょうふしょう	対人恐怖症	win	名詞
たいじんこうりゅう	対人交流	mac	名詞
たいせい	体性	mac	名詞
たいせい	耐性	mac	名詞
たいせい	胎勢	both	名詞
たいせいえんしんせい	体性遠心性	mac	名詞
たいせいかいせんいじょう	胎勢回旋異常	win	名詞
たいせいかんかくや	体性感覚野	mac	名詞
たいせいかんかくゆうはつでんい	体性感覚誘発電位	win	名詞
たいせいき	胎生期	mac	名詞
たいせいきがん	胎生期癌	both	名詞
たいせいきじょ	耐性機序	mac	名詞
たいせいきなんちょう	胎生期難聴	mac	名詞
たいせいきゅうしんせい	体性求心性	mac	名詞
たいせいしんけい	体性神経	mac	名詞
たいせいちかくまひ	対性知覚麻痺	win	名詞
たいせいちつ	胎生腟	win	名詞
たいせいちつのうほう	胎生腟嚢胞	win	名詞
たいせいつう	体性痛	mac	名詞
たいせいなんこついえいようしょう	胎生軟骨異栄養症	win	名詞
たいせいにゅうさんきんさん	耐性乳酸菌散	win	名詞
たいせいはんしゃ	体性反射	mac	名詞
たいせいひしつ	胎性皮質	mac	名詞
たいせいらんし	対性乱視	win	名詞
たいせつ	体節	mac	名詞
たいせつぶんせつ	体節分節	mac	名詞
たいせん	苔癬	both	名詞
たいせんか	苔癬化	mac	名詞
たいせんじょうるいかんせん	苔癬状類乾癬	win	名詞
たいそう	タイソウ	win	名詞
たいそきのーるしろっぷ	タイソキノールシロップ	win	名詞
たいそく	体側	mac	名詞
たいそく	対側	mac	名詞
たいそくざしょう	対側挫傷	mac	名詞
たいそくせい	対側性	mac	名詞
たいそくそんしょう	対側損傷	both	名詞
たいそくはいもんりんぱせつ	対側肺門リンパ節	mac	名詞
たいぞくげんご	滞続言語	win	名詞
たいだーるじどうぼうこうせんじ	タイダール自動膀胱洗浄	win	名詞
たいちかくせいほっさ	体知覚性発作	win	名詞
たいとうのう	耐糖能	both	名詞
たいとうのういじょう	耐糖能異常	both	名詞
たいとうのうしょうがい	耐糖能障害	win	名詞
たいとけつごう	タイト結合	mac	名詞
たいどう	体動	mac	名詞
たいどうみゃくはいどうみゃくたんらく	体動脈肺動脈短絡手術	win	名詞
たいないかんせつ	体内関節	win	名詞
たいないかんせつぷろすてーしすのきかいてきがっぺいしょ	体内関節プロステーシスの機械的合併症	win	名詞
たいないそうすいぶんりょう	体内総水分量	mac	名詞
たいないどうたい	体内動態	mac	名詞
たいないぶんぷ	体内分布	mac	名詞
たいのう	胎嚢	mac	名詞
たいばん	胎盤	both	名詞
たいばんあっしゅつほう	胎盤圧出法	win	名詞
たいばんいざん	胎盤遺残	win	名詞
たいばんいじょう	胎盤異常	win	名詞
たいばんいちいじょう	胎盤位置異常	win	名詞
たいばんえし	胎盤壊死	win	名詞
たいばんえん	胎盤炎	win	名詞
たいばんからのたいじしっけつ	胎盤からの胎児失血	win	名詞
たいばんかんとん	胎盤嵌頓	win	名詞
たいばんかんもん	胎盤関門	mac	名詞
たいばんきのうしょうがい	胎盤機能障害	win	名詞
たいばんきのうていか	胎盤機能低下	win	名詞
たいばんきのうていかしんせいじ	胎盤機能低下新生児	win	名詞
たいばんきのうふぜんしょう	胎盤機能不全症	win	名詞
たいばんこうそく	胎盤梗塞	win	名詞
たいばんこうそくしんせいじ	胎盤梗塞新生児	win	名詞
たいばんこうそくたいじ	胎盤梗塞胎児	win	名詞
たいばんざんりゅう	胎盤残留	win	名詞
たいばんせいらくとげん	胎盤性ラクトゲン	mac	名詞
たいばんそうきはくり	胎盤早期剥離	win	名詞
たいばんそうきはくりしんせいじ	胎盤早期剥離新生児	win	名詞
たいばんそうきはくりたいじ	胎盤早期剥離胎児	win	名詞
たいばんちゅうかく	胎盤中隔	mac	名詞
たいばんのうほう	胎盤嚢胞	win	名詞
たいばんのきけい	胎盤の奇形	win	名詞
たいばんひこう	胎盤肥厚	mac	名詞
たいばんふぜんしょうこうぐん	胎盤不全症候群	win	名詞
たいばんふちゃくぶいじょう	胎盤付着部異常	mac	名詞
たいばんぶぶんざんりゅう	胎盤部分残留	win	名詞
たいばんぽりーぷ	胎盤ポリープ	win	名詞
たいばんまく	胎盤膜	mac	名詞
たいばんゆけつしょうこうぐん	胎盤輸血症候群	win	名詞
たいばんようしゅはくり	胎盤用手剥離	win	名詞
たいばんようしゅはくりじゅつ	胎盤用手剥離術	win	名詞
たいひょう	体表	win	名詞
たいひょうがいはいよう	体表外胚葉	mac	名詞
たいひょうひすそくしんでんず	体表ヒス束心電図	win	名詞
たいひょうめん	体表面	both	名詞
たいひょうめんしんでんず	体表面心電図	win	名詞
たいひょうめんせき	体表面積	both	名詞
たいひょうめんぺーしんぐほう	体表面ペーシング法	win	名詞
たいひょうめんぺーしんぐようでんき	体表面ペーシング用電極	win	名詞
たいぶ	体部	both	名詞
たいぶきんしゅ	体部筋腫	win	名詞
たいぶはくせん	体部白癬	win	名詞
たいぷれすちもぐらふ	体プレスチモグラフ	win	名詞
たいぷＡ	タイプA	mac	名詞
たいぷＡこうどう	タイプA行動	mac	名詞
たいへいこういじ	体平衡維持	mac	名詞
たいへき	体壁	mac	名詞
たいへきけっそん	体壁欠損	mac	名詞
たいべん	胎便	both	名詞
たいべんいれうす	胎便イレウス	win	名詞
たいべんきゅういんしょうこうぐん	胎便吸引症候群	both	名詞
たいべんせいふくまくえん	胎便性腹膜炎	win	名詞
