たい	他為	mac	名詞
たんのうかんのうほう	胆嚢管嚢胞	win	名詞
たんのうかんはれつ	胆嚢管破裂	win	名詞
たんのうかんひだい	胆嚢管肥大	win	名詞
たんのうかんへいそくしょう	胆嚢管閉塞症	win	名詞
たんのうかんゆちゃく	胆嚢管癒着	win	名詞
たんのうがいろうぞうせつじゅつ	胆嚢外瘻造設術	win	名詞
たんのうがん	胆嚢癌	both	名詞
たんのうきのうしょうがい	胆嚢機能障害	win	名詞
たんのうきのうふぜん	胆嚢機能不全	win	名詞
たんのうけっかく	胆嚢結核	win	名詞
たんのうけっせき	胆嚢結石	win	名詞
たんのうけっせきしょう	胆嚢結石症	win	名詞
たんのうけっそん	胆嚢欠損	win	名詞
たんのうけっちょうろう	胆嚢結腸瘻	win	名詞
たんのうこれすてろーしす	胆嚢コレステローシス	win	名詞
たんのうこれすてろーるぽりーぷ	胆嚢コレステロールポリープ	win	名詞
たんのうしゅういえん	胆嚢周囲炎	win	名詞
たんのうしゅういのうよう	胆嚢周囲膿瘍	win	名詞
たんのうしゅよう	胆嚢腫瘍	win	名詞
たんのうじすきねじあ	胆嚢ジスキネジア	win	名詞
たんのうじすきねじー	胆嚢ジスキネジー	win	名詞
たんのうじゅうにしちょうろう	胆嚢十二指腸瘻	win	名詞
たんのうすいしゅ	胆嚢水腫	win	名詞
たんのうせっかいけっせきてきしゅつじゅ	胆嚢切開結石摘出術	win	名詞
たんのうせんきんしゅ	胆嚢腺筋腫	win	名詞
たんのうせんきんしゅしょう	胆嚢腺筋腫症	win	名詞
たんのうせんきんしょう	胆嚢腺筋症	both	名詞
たんのうせんこう	胆嚢穿孔	win	名詞
たんのうせんし	胆嚢穿刺	mac	名詞
たんのうせんしゅ	胆嚢腺腫	win	名詞
たんのうそんしょう	胆嚢損傷	win	名詞
たんのうたんかんけっせきしょう	胆嚢胆管結石症	win	名詞
たんのうちくのう	胆嚢蓄膿	win	名詞
たんのうてきしゅつごしょうこうぐん	胆嚢摘出後症候群	win	名詞
たんのうてきしゅつごじょうたい	胆嚢摘出後状態	win	名詞
たんのうてきしゅつじゅつ	胆嚢摘出術	both	名詞
たんのうてきしゅつじゅつとじゅうにし	胆嚢摘出術と十二指腸空腸吻合術	win	名詞
たんのうにくしゅ	胆嚢肉腫	win	名詞
たんのうねんえきのうしゅ	胆嚢粘液嚢腫	win	名詞
たんのうねんてん	胆嚢捻転	win	名詞
たんのうのうしゅ	胆嚢嚢腫	win	名詞
たんのうのうよう	胆嚢膿瘍	win	名詞
たんのうひだい	胆嚢肥大	win	名詞
たんのうほう	胆嚢胞	win	名詞
たんのうぽりーぷ	胆嚢ポリープ	win	名詞
たんのうぽりーぷしょう	胆嚢ポリープ症	mac	名詞
たんのうゆちゃく	胆嚢瘉着	win	名詞
たんのうりょうせいしゅよう	胆嚢良性腫瘍	win	名詞
たんのうろう	胆嚢瘻	win	名詞
たんぱく	蛋白	win	名詞
たんぱくかろりーせいえいようしっちょうしょう	蛋白カロリー性栄養失調症	win	名詞
たんぱくけつごうほうわがた	蛋白結合飽和型	mac	名詞
たんぱくけつぼうせいひんけつ	蛋白欠乏性貧血	win	名詞
たんぱくさいぼうかいり	蛋白細胞解離	win	名詞
たんぱくしつきなーぜ	蛋白質キナーゼ	mac	名詞
たんぱくしつけつぼう	蛋白質欠乏	win	名詞
たんぱくしつけつぼうせいしょうがい	蛋白質欠乏性障害	win	名詞
たんぱくせん	蛋白栓	win	名詞
たんぱくていりょう	蛋白定量	win	名詞
たんぱくにょう	たんぱく尿	win	名詞
たんぱくにょう	蛋白尿	both	名詞
たんぱくにょうせい	蛋白尿性	win	名詞
たんぱくにょうひんけつ	蛋白尿貧血	win	名詞
たんぱくひけつごうりつ	蛋白非結合率	mac	名詞
たんぱくびょう	蛋白病	win	名詞
たんぱくふたいせいきゅうしゅうふりょうしょう	蛋白不耐性吸収不良症	win	名詞
たんぱくぶんかく	蛋白分画	win	名詞
たんぱくへんせい	蛋白変性	mac	名詞
たんぱくろうしゅつせいいちょうしょう	蛋白漏出性胃腸症	win	名詞
たんぱつがたぎゃくたい	単発型虐待	mac	名詞
たんぱつせい	単発性	win	名詞
たんぱつせいこつ	単発性骨	win	名詞
たんぱつせいこつのうしゅ	単発性骨嚢腫	both	名詞
たんぱつせいひかくけっかんしゅ	単発性被角血管腫	win	名詞
たんぱつはんのうせい	単発反応性	win	名詞
たんぱつはんのうせいうつびょう	単発反応性うつ病	win	名詞
たんひこつきん	短腓骨筋	mac	名詞
たんびいでんし	短尾遺伝子	mac	名詞
たんほうじょうちゅう	単包条虫	mac	名詞
たんほうじょうちゅうしょう	単包条虫症	mac	名詞
たんほうせい	単胞性	mac	名詞
たんほうせいはい	単胞性肺	win	名詞
たんほうせいはいえきのこっくすしょう	単胞性肺エキノコックス症	win	名詞
たんぼしがいてんきん	短母指外転筋	mac	名詞
たんぼしがいてんきんだんれつ	短母指外転筋断裂	win	名詞
たんぼしくっきん	短母指屈筋	mac	名詞
たんぼしくっきん	短母趾屈筋	mac	名詞
たんぼししんきん	短母指伸筋	mac	名詞
たんぼししんきん	短母趾伸筋	mac	名詞
たんぼししんきんけんだんれつ	短母指伸筋腱断裂	win	名詞
たんぽうじょうちゅうかんせんしょう	単包条虫感染症	win	名詞
たんぽうせいかん	単胞性肝	win	名詞
たんぽうせいかんえきのこっくすしょう	単胞性肝エキノコックス症	win	名詞
たんぽうせいこうじょうせん	単胞性甲状腺	win	名詞
たんぽうせいこうじょうせんえきのこっくす	単胞性甲状腺エキノコックス	win	名詞
たんぽなーで	タンポナーデ	mac	名詞
たんまひ	単麻痺	both	名詞
たんめいさいぼう	淡明細胞	mac	名詞
たんめいさいぼうがたじんさいぼうがん	淡明細胞型腎細胞癌	win	名詞
たんめいさいぼうがん	淡明細胞癌	both	名詞
たんめいさいぼうにくしゅ	淡明細胞肉腫	win	名詞
たんめいそう	淡明層	mac	名詞
たんようせいかんこうへん	単葉性肝硬変	win	名詞
たんろっこつしょうこうぐん	短肋骨症候群	win	名詞
たんわん	短腕	mac	名詞
たんをともなわないせき	痰を伴わない咳	mac	名詞
たーこっとしょうこうぐん	ターコット症候群	win	名詞
たーなーし	ターナー歯	win	名詞
たーなーしょうこうぐん	Tuner症候群	win	名詞
たーなーしょうこうぐん	Turner症候群	win	名詞
たーなーしょうこうぐん	ターナー症候群	both	名詞
たーなーしょうこうぐん	ターナー症候群46XY	win	名詞
たーなーしょうこうぐん46XY	ターナー症候群46XY	win	名詞
たーなーしょうこうぐんかくがた	ターナー症候群核型	win	名詞
たーなーしょうこうぐんかくがた	ターナー症候群核型45X	win	名詞
たーなーしょうこうぐんかくがた45X	ターナー症候群核型45X	win	名詞
たーなーしょうこうぐんもざいく	ターナー症候群モザイク	win	名詞
たーなーしょうこうぐんもざいく	ターナー症候群モザイク45X	win	名詞
たーなーしょうこうぐんもざいく	ターナー症候群モザイク46XX	win	名詞
たーなーしょうこうぐんもざいく45X	ターナー症候群モザイク45X	win	名詞
たーなーしょうこうぐんもざいく46XX	ターナー症候群モザイク46XX	win	名詞
たーなーじょせい	Turner女性	win	名詞
たーにけっと	ターニケット	mac	名詞
たーるべん	タール便	mac	名詞
ちあじどけい	チアジド系	mac	名詞
ちあぞりじん	チアゾリジン	mac	名詞
ちあぞりじんゆうどうたい	チアゾリジン誘導体	mac	名詞
ちあぞりん	チアゾリン	mac	名詞
ちあとんかりゅう	チアトン顆粒	win	名詞
ちあのーぜ	チアノーゼ	win	名詞
ちあのーぜせいせんてんせいしんしっかん	チアノーゼ性先天性心疾患	win	名詞
ちあのーぜほっさ	チアノーゼ発作	win	名詞
ちあぶーとてんがんえき	チアブート点眼液	win	名詞
ちあぷりどえんさんえん	チアプリド塩酸塩	win	名詞
ちあぷりどさいりゅう	チアプリド細粒	win	名詞
ちあぷりむさいりゅう	チアプリム細粒	win	名詞
ちあぷろふぇんさん	チアプロフェン酸	win	名詞
ちあまぞーる	チアマゾール	mac	名詞
ちあみん	チアミン	mac	名詞
ちあみんえんかぶつえんさんえん	チアミン塩化物塩酸塩	win	名詞
ちあみんしょうかぶつ	チアミン硝化物	win	名詞
ちあめろんかりゅう	チアメロン顆粒	win	名詞
ちあらりーどさいりゅう	チアラリード細粒	win	名詞
ちありーるさいりゅう	チアリール細粒	win	名詞
ちあんとーる	チアントール	win	名詞
ちいきほうかつしえんせんたー	地域包括支援センター	mac	名詞
ちいきほけん	地域保健	mac	名詞
ちいさながいしょう	小さな外傷	mac	名詞
ちぇっくばるぶ	チェックバルブ	mac	名詞
ちぇでぃあっく	チェディアック・東症候群	win	名詞
ちぇでぃあっくひがししょうこうぐん	チェディアック・東症候群	win	名詞
ちぇりーれっどすぽっと	チェリーレッドスポット	win	名詞
ちぇーんすとーくすこきゅう	チェーン・ストークス呼吸	win	名詞
ちえいようせい	遅栄養性	mac	名詞
ちえくーるてんてきよう	チエクール点滴用	win	名詞
ちえちえん	知恵遅延	win	名詞
ちえなむ	チエナム	mac	名詞
ちえんがたかびんしょう	遅延型過敏症	mac	名詞
ちえんこうだつぶんきょく	遅延後脱分極	mac	名詞
ちえんさいせい	遅延再生	mac	名詞
ちえんせいおうと	遅延性嘔吐	mac	名詞
ちえんせいはいにょう	遅延性排尿	win	名詞
ちえんせいぶんべん	遅延性分娩	win	名詞
ちえんそう	遅延相	mac	名詞
ちえんぞう	遅延像	mac	名詞
ちえんはんのう	遅延反応	mac	名詞
ちお	チオ	mac	名詞
ちおきさんてんけいしんけいよくせいやくちゅうどく	チオキサンテン系神経抑制薬中毒	win	名詞
ちおでにん	チオデニン	win	名詞
ちおばるびつれーとちゅうどく	チオバルビツレート中毒	win	名詞
ちおぺんたーる	チオペンタール	mac	名詞
ちおりだじん	チオリダジン	mac	名詞
ちおりゅうさんなとりうむ	チオ硫酸ナトリウム	win	名詞
ちおりゅうさんなとりうむすいわぶつ	チオ硫酸ナトリウム水和物	win	名詞
ちおれすちんさん	チオレスチン散	win	名詞
ちおーるき	チオール基	mac	名詞
ちかくいき	知覚域	mac	名詞
ちかくいじょう	知覚異常	both	名詞
ちかくいじょうせいだいたいしんけいつう	知覚異常性大腿神経痛	win	名詞
ちかくきのうしょうがい	知覚機能障害	win	名詞
ちかくこん	知覚根	mac	名詞
ちかくしょうがい	知覚障害	win	名詞
ちかくしんけい	知覚神経	mac	名詞
ちかくしんけいかびん	知覚神経過敏	win	名詞
ちかくしんけいしょうがい	知覚神経障害	mac	名詞
ちかくしんけいせつ	知覚神経節	mac	名詞
ちかくしんけいまひ	知覚神経麻痺	win	名詞
ちかくじゅようき	知覚受容器	mac	名詞
ちかくせい	知覚性	mac	名詞
ちかくせいいき	知覚性域	mac	名詞
ちかくせいしんけいせつ	知覚性神経節	mac	名詞
ちかくちゅうけいかく	知覚中継核	mac	名詞
ちかくどんま	知覚鈍麻	win	名詞
ちかくまひ	知覚麻痺	win	名詞
ちかくや	知覚野	mac	名詞
ちきじうむしゅうかぶつ	チキジウム臭化物	win	名詞
ちきじうむしゅうかぶつかりゅう	チキジウム臭化物顆粒	win	名詞
ちきょくじょはふくごう	遅棘徐波複合	win	名詞
ちくじょ	チクジョ	win	名詞
ちくせきしっかんせい	蓄積疾患性	win	名詞
ちくせつにんじん	チクセツニンジン	win	名詞
ちくちくかん	チクチク感	win	名詞
ちくにょう	畜尿	mac	名詞
ちくのう	蓄膿	mac	名詞
ちくぴろんさいりゅう	チクピロン細粒	win	名詞
ちくようせきちゅう	竹様脊柱	win	名詞
ちくろぴじんえんさんえん	チクロピジン塩酸塩	win	名詞
ちくろぴじんえんさんえんさいりゅう	チクロピジン塩酸塩細粒	win	名詞
ちくんぐにあねつ	チクングニア熱	mac	名詞
ちくんぐにやしゅっけつねつ	チクングニヤ出血熱	win	名詞
ちくんぐんやしゅっけつねつ	チクングンヤ出血熱	win	名詞
ちげさいくりん	チゲサイクリン	mac	名詞
ちこう	恥垢	both	名詞
ちこつ	恥骨	both	名詞
ちこつかいほうこっせつ	恥骨開放骨折	win	名詞
ちこつかかく	恥骨下角	mac	名詞
ちこつきん	恥骨筋	mac	名詞
ちこつけっせつ	恥骨結節	mac	名詞
ちこつけつごう	恥骨結合	mac	名詞
ちこつけつごういじょう	恥骨結合異常	win	名詞
ちこつけつごうえん	恥骨結合炎	win	名詞
ちこつけつごうかいり	恥骨結合開離	win	名詞
ちこつけつごうじゃくねんせいこつなんこつしょう	恥骨結合若年性骨軟骨症	win	名詞
ちこつけつごうぶ	恥骨結合部	win	名詞
ちこつけつごうめん	恥骨結合面	mac	名詞
ちこつけつごうりかいかんけつてきしゅし	恥骨結合離開観血的手術	win	名詞
ちこつけつごうりかいひかんけつてきせい	恥骨結合離開非観血的整復固定術	win	名詞
ちこつこっせつ	恥骨骨折	win	名詞
ちこつこつえん	恥骨骨炎	win	名詞
ちこつこつにくしゅ	恥骨骨肉腫	win	名詞
ちこつこつまくえん	恥骨骨膜炎	win	名詞
ちこつしゅよう	恥骨腫瘍	win	名詞
ちこつじょうぼうこうせんし	恥骨上膀胱穿刺	mac	名詞
ちこつじょうぼうこうせんしにょう	恥骨上膀胱穿刺尿	mac	名詞
ちこつせつ	恥骨櫛	mac	名詞
ちこつちょくちょうきん	恥骨直腸筋	mac	名詞
ちこつなんこつにくしゅ	恥骨軟骨肉腫	win	名詞
ちこつひろうこっせつ	恥骨疲労骨折	win	名詞
ちこつびこつきん	恥骨尾骨筋	mac	名詞
ちこつぶ	恥骨部	win	名詞
ちこつぶだぼく	恥骨部打撲	win	名詞
ちざにじんえんさんえん	チザニジン塩酸塩	win	名詞
ちざにじんかりゅう	チザニジン顆粒	win	名詞
ちざにんかりゅう	チザニン顆粒	win	名詞
ちし	智歯	mac	名詞
ちしがたひょうひすいほうしょう	致死型表皮水疱症	win	名詞
ちししゅういえん	智歯周囲炎	win	名詞
ちしせい	致死性	mac	名詞
ちしせいいけいせいしょう	致死性異形成症	mac	名詞
ちしせいかぞくせいふみんしょう	致死性家族性不眠症	win	名詞
ちしせいきんまくえん	致死性筋膜炎	mac	名詞
ちしせいこびとしょう	致死性小人症	win	名詞
ちしせいししたんしゅくがたていしんちょうしょう	致死性四肢短縮型低身長症	win	名詞
ちしせいしっしん	致死性失神	win	名詞
ちしてきさんちょう	致死的三徴	win	名詞
ちしてきふせいみゃく	致死的不整脈	mac	名詞
ちしなんせい	智歯難生	win	名詞
ちしのうど	致死濃度	mac	名詞
ちしりつ	致死率	mac	名詞
ちしれべる	致死レベル	mac	名詞
ちすためっとさいりゅう	チスタメット細粒	win	名詞
ちずじょうかいよう	地図状潰瘍	mac	名詞
ちずじょうかくまくえん	地図状角膜炎	win	名詞
ちずじょうこうないえん	地図状口内炎	win	名詞
ちずじょうぜつ	地図状舌	both	名詞
ちずじょうみゃくらくまくえん	地図状脈絡膜炎	win	名詞
ちちゅうかい	地中海	win	名詞
ちちゅうかいだにねつ	地中海だに熱	win	名詞
ちちゅうかいねつ	地中海熱	win	名詞
ちっくしょう	チック症	win	名詞
ちっくしょうがい	チック障害	both	名詞
ちっそ	窒素	win	名詞
ちっそかじょうけっしょう	窒素過剰血症	win	名詞
ちっそかじょうにょうしょう	窒素過剰尿症	win	名詞
ちっそく	窒息	win	名詞
ちっそくかん	窒息感	win	名詞
ちっそさんかぶつ	窒素酸化物	win	名詞
ちっそさんかぶつのどくさよう	窒素酸化物の毒作用	win	名詞
ちつ	膣	mac	名詞
ちつあくせいこくしょくしゅ	腟悪性黒色腫	win	名詞
ちつあくせいしゅよう	膣悪性腫瘍	win	名詞
ちつあでのーしす	膣アデノーシス	win	名詞
ちついじょう	腟異常	win	名詞
ちついじょうのためのぼたいかんり	腟異常のための母体管理	win	名詞
ちついぶつそうにゅうこういしょう	腟異物挿入後遺症	win	名詞
ちつえいんろう	腟会陰瘻	win	名詞
ちつえいんろう	膣会陰瘻	win	名詞
ちつえき	膣液	mac	名詞
ちつえん	腟炎	win	名詞
ちつえん	膣炎	win	名詞
ちつえんがい	腟円蓋	mac	名詞
ちつえんがい	膣円蓋	win	名詞
ちつおうちゅうかく	膣横中隔	mac	名詞
ちつかいほうそう	腟開放創	win	名詞
ちつかいほうそう	膣開放創	win	名詞
ちつかいよう	腟潰瘍	win	名詞
ちつかすい	腟下垂	win	名詞
ちつかすい	膣下垂	win	名詞
ちつかんじだしょう	腟カンジダ症	win	名詞
ちつかんじだしょう	膣カンジダ症	win	名詞
ちつがいいんかんじだしょう	膣外陰カンジダ症	win	名詞
ちつがこうそう	膣鵞口瘡	win	名詞
ちつがん	腟癌	win	名詞
ちつがん	膣癌	both	名詞
ちつきけい	膣奇形	win	名詞
ちつきょう	膣鏡	mac	名詞
ちつきょうさく	膣狭窄	win	名詞
ちつきょうさくしょう	腟狭窄症	win	名詞
ちつきょうさくしょう	膣狭窄症	win	名詞
ちつきょうしん	膣鏡診	mac	名詞
ちつきんしゅ	膣筋腫	win	名詞
ちつけい	腟痙	win	名詞
ちつけいれん	膣けいれん	mac	名詞
ちつけっしゅ	腟血腫	win	名詞
ちつけっしゅ	膣血腫	win	名詞
ちつけっそん	腟欠損	win	名詞
ちつけっそん	膣欠損	win	名詞
ちつけっそんしょう	膣欠損症	win	名詞
ちつけつしょう	膣欠症	win	名詞
ちつこう	膣口	mac	名詞
ちつこうきょうしょう	腟口狭小	win	名詞
ちつこうへいそく	膣口閉塞	win	名詞
ちつざざい	腟坐剤	win	名詞
ちつざしょう	腟挫傷	win	名詞
ちつしきしきゅうぼうけつごうしきえん	腟式子宮旁結合織炎切開術	win	名詞
ちつしきしゅじゅつ	膣式手術	mac	名詞
ちつしきらんそうのうしゅないようはいじ	腟式卵巣嚢腫内容排除術	win	名詞
ちつしゅよう	腟腫瘍	win	名詞
ちつしゅよう	膣腫瘍	win	名詞
ちつじゅうちゅうかく	膣縦中隔	mac	名詞
ちつじゅうもうせいしゅようてきしゅつし	腟絨毛性腫瘍摘出術	win	名詞
ちつじょう	膣錠	mac	名詞
ちつじょうひいけいせい	腟上皮異形成	win	名詞
ちつじょうひいけいせい	腟上皮異形成・異型度	win	名詞
ちつじょうひいけいせい	膣上皮異形成	win	名詞
ちつじょうひないがん	腟上皮内癌	win	名詞
ちつじょうひないがん	膣上皮内癌	win	名詞
ちつすめあさいぼうしんようせい	腟スメア細胞診陽性	win	名詞
ちつせんいしゅ	腟線維腫	win	名詞
ちつせんいしゅ	膣線維腫	win	名詞
ちつせんしょう	腟腺症	win	名詞
ちつせんしょう	膣腺症	win	名詞
ちつせんじょう	腟洗浄	win	名詞
ちつせんてんいじょう	膣先天異常	win	名詞
ちつぜんてい	腟前庭	win	名詞
ちつぜんてい	膣前庭	mac	名詞
ちつぜんていろう	膣前庭瘻	mac	名詞
ちつそんしょう	腟損傷	win	名詞
ちつそんしょう	膣損傷	win	名詞
ちつだつしょう	腟脱症	win	名詞
ちつだつしょう	膣脱症	win	名詞
ちつだんたん	腟断端	win	名詞
ちつだんたんえん	腟断端炎	win	名詞
ちつだんたんえん	膣断端炎	win	名詞
ちつだんたんきょじょうじゅつ	腟断端挙上術	win	名詞
ちつだんたんけっしゅ	膣断端血腫	win	名詞
ちつだんたんしゅっけつ	腟断端出血	win	名詞
ちつだんたんしゅっけつ	膣断端出血	win	名詞
ちつだんたんにくげ	腟断端肉芽	win	名詞
ちつだんたんにくげ	膣断端肉芽	win	名詞
ちつだんたんにくげけいせい	膣断端肉芽形成	win	名詞
ちつだんたんにくげしゅ	膣断端肉芽腫	win	名詞
ちつだんたんにくげそしき	膣断端肉芽組織	win	名詞
ちつだんたんぽりーぷ	腟断端ポリープ	win	名詞
ちつだんたんぽりーぷ	膣断端ポリープ	win	名詞
ちつちゅうかく	腟中隔	win	名詞
ちつちゅうかく	膣中隔	win	名詞
ちつちゅうかくせつじょじゅつ	腟中隔切除術	win	名詞
ちつちょうろうへいさじゅつ	腟腸瘻閉鎖術	win	名詞
ちつとりこもなすしょう	膣トリコモナス症	both	名詞
ちつないいぶつ	腟内異物	win	名詞
ちつないいぶつ	膣内異物	win	名詞
ちつないしょうしゃ	膣内照射	mac	名詞
ちつないよう	膣内容	mac	名詞
ちつにゅうとうしゅ	腟乳頭腫	win	名詞
ちつにゅうとうしゅ	膣乳頭腫	win	名詞
ちつねっしょう	腟熱傷	win	名詞
ちつねっしょう	膣熱傷	win	名詞
ちつのうしゅ	膣嚢腫	win	名詞
ちつのうほう	膣嚢胞	win	名詞
ちつのうよう	腟膿瘍	win	名詞
ちつはくはんしょう	腟白斑症	win	名詞
ちつはくはんしょう	膣白斑症	win	名詞
ちつばん	膣板	mac	名詞
ちつぶ	腟部	win	名詞
ちつぶびらん	腟部びらん	win	名詞
ちつぶびらん	膣部びらん	win	名詞
ちつぶんぴつえきちゅう	腟分泌液中	win	名詞
ちつぶんぴつえきちゅうLDH	腟分泌液中LDH	win	名詞
ちつぶんぴつえきちゅうあるふぁふぇと	腟分泌液中α-フェトプロテイン	win	名詞
ちつぶんぴつぶつ	腟分泌物	win	名詞
ちつぶんぴぶつ	膣分泌物	mac	名詞
ちつへいさ	腟閉鎖	win	名詞
ちつへいさ	膣閉鎖	mac	名詞
ちつへいさしょうじゅつ	腟閉鎖症術	win	名詞
ちつへいさじゅつ	腟閉鎖術	win	名詞
ちつへき	腟壁	win	名詞
ちつへき	膣壁	mac	名詞
ちつへきあくせいしゅようしゅじゅつ	腟壁悪性腫瘍手術	win	名詞
ちつへきかすい	腟壁下垂	win	名詞
ちつへきかすい	膣壁下垂	win	名詞
ちつへききんしゅ	腟壁筋腫	win	名詞
ちつへききんしゅ	膣壁筋腫	win	名詞
ちつへきけいせいしゅじゅつ	腟壁形成手術	win	名詞
ちつへきけっしゅほうごうそうりかい	腟壁血腫縫合創離開	win	名詞
ちつへきざしょう	膣壁挫傷	win	名詞
ちつへきしゅよう	膣壁腫瘍	win	名詞
ちつへきしゅようてきしゅつじゅつ	腟壁腫瘍摘出術	win	名詞
ちつへきせんけい	腟壁尖圭	win	名詞
ちつへきせんけいこんじろーま	腟壁尖圭コンジローマ	win	名詞
ちつへきせんけいこんじろーむせつじょ	腟壁尖圭コンジローム切除術	win	名詞
ちつへきのうしゅせつじょじゅつ	腟壁嚢腫切除術	win	名詞
ちつへきほうごうふぜん	腟壁縫合不全	win	名詞
ちつへきほうごうふぜん	膣壁縫合不全	win	名詞
ちつへきれっしょう	膣壁裂傷	win	名詞
ちつへきれっそうほうごうじゅつ	腟壁裂創縫合術	win	名詞
ちつぽりーぷ	腟ポリープ	win	名詞
ちつぽりーぷせつじょじゅつ	腟ポリープ切除術	win	名詞
ちつむけいせい	膣無形成	win	名詞
ちつゆちゃく	腟癒着	win	名詞
ちつりゅうけつしょう	腟留血症	win	名詞
ちつりょうせいしゅよう	腟良性腫瘍	win	名詞
ちつれっしょう	腟裂傷	win	名詞
ちつれっしょう	膣裂傷	win	名詞
ちつれっそう	膣裂創	win	名詞
ちつろう	腟瘻	win	名詞
ちつろう	膣瘻	win	名詞
ちてきしょうがい	知的障害	both	名詞
ちてきしょうがいせいせいしんびょう	知的障害性精神病	win	名詞
ちとれすと	チトレスト	win	名詞
ちねるちょうこう	チネル徴候	mac	名詞
ちのうけんさ	知能検査	mac	名詞
ちのうしょうがい	知能障害	mac	名詞
ちのうていか	知能低下	mac	名詞
ちのうはったつちえん	知能発達遅延	win	名詞
ちのうはついくちえん	知能発育遅延	win	名詞
ちのみちしょう	血の道症	win	名詞
ちはついっかせいじょみゃく	遅発一過性徐脈	mac	名詞
ちはつがたこつけいせいふぜんしょう	遅発型骨形成不全症	win	名詞
ちはつがたにんしんこうけつあつしょうこうぐん	遅発型妊娠高血圧症候群	win	名詞
ちはつがたようけつせいふくさよう	遅発型溶血性副作用	mac	名詞
ちはつげっけい	遅発月経	win	名詞
ちはつししゅんき	遅発思春期	both	名詞
ちはつせい	遅発性	win	名詞
ちはつせいういるすかんせんしょう	遅発性ウイルス感染症	mac	名詞
ちはつせいこうまくがいけっしゅ	遅発性硬膜外血腫	win	名詞
