ざい	坐位	mac	名詞
じゃくねんせいはんぷくせいかくまくしょうしたいしゅっけ	若年性反復性角膜硝子体出血	ime	名詞
じゃくねんせいぱーきんそんしょうこうぐん	若年性パーキンソン症候群	ime	名詞
じゃくねんせいぱーきんそんびょう	若年性パーキンソン病	ime	名詞
じゃくねんせいぱーきんそんびょうYahr3	若年性パーキンソン病Yahr3	ime	名詞
じゃくねんせいぱーきんそんびょうYahr4	若年性パーキンソン病Yahr4	ime	名詞
じゃくねんせいぱーきんそんびょうYahr5	若年性パーキンソン病Yahr5	ime	名詞
じゃくねんせいひふきんえん	若年性皮膚筋炎	ime	名詞
じゃくねんせいひまんしょう	若年性肥満症	ime	名詞
じゃくねんせいへるぺすじょうひふえん	若年性ヘルペス状皮膚炎	ime	名詞
じゃくねんせいへんぺいゆうぜい	若年性扁平疣贅	ime	名詞
じゃくねんせいぽりぽーしす	若年性ポリポーシス	mac	名詞
じゃくねんせいぽりーぷ	若年性ポリープ	ime	名詞
じゃくねんせいまんせいこうまくかけっしゅ	若年性慢性硬膜下血腫	ime	名詞
じゃくねんせいみおくろみーてんかん	若年性ミオクロミーてんかん	mac	名詞
じゃくねんせいみおくろーぬすてんかん	若年性ミオクローヌスてんかん	ime	名詞
じゃくねんせいりょくないしょう	若年性緑内障	ime	名詞
じゃくねんにがたとうにょうびょう	若年2型糖尿病	ime	名詞
じゃくねんにんしん	若年妊娠	ime	名詞
じゃくねんはっしょうがたりょうそくせいかんおんなんちょう	若年発症型両側性感音難聴	ime	名詞
じゃくねんはっしょうせいじんがたとうにょうびょう	若年発症成人型糖尿病	ime	名詞
じゃくねんはっしょうとうにょうびょう	若年発症糖尿病	ime	名詞
じゃくねんまひせいちほう	若年麻痺性痴呆	ime	名詞
じゃくねんもうまくぶんりしょう	若年網膜分離症	ime	名詞
じゃくらんはん	雀卵斑	ime	名詞
じゃしょうし	ジャショウシ	ime	名詞
じゃっかく	弱拡	mac	名詞
じゃっかくしや	弱拡視野	mac	名詞
じゃてん	ジャテン	mac	名詞
じゃどく	蛇毒	ime	名詞
じゃぬびあ	ジャヌビア	mac	名詞
じゃねーびょう	ジャネー病	ime	名詞
じゃんぱーひざ	ジャンパー膝	ime	名詞
じゃーみのーま	ジャーミノーマ	both	名詞
じゅう	重	ime	名詞
じゅうあい	獣愛	ime	名詞
じゅうい	縦位	mac	名詞
じゅういちいんし	XI因子	mac	名詞
じゅういんし	Ⅹ因子	mac	名詞
じゅうえー	Ⅹa	mac	名詞
じゅうかく	縦隔	both	名詞
じゅうかくあくせい	縦隔悪性	ime	名詞
じゅうかくあくせいしゅよう	縦隔悪性腫瘍	ime	名詞
じゅうかくあくせいしゅようしゅじゅつ	縦隔悪性腫瘍手術	ime	名詞
じゅうかくあくせいりんぱしゅ	縦隔悪性リンパ腫	ime	名詞
じゅうかくえん	縦隔炎	both	名詞
じゅうかくかくせいじゅつ	縦隔郭清術	ime	名詞
じゅうかくがん	縦隔癌	ime	名詞
じゅうかくきかんこうけいせいしゅじゅ	縦隔気管口形成手術	ime	名詞
じゅうかくきかんし	縦隔気管支	ime	名詞
じゅうかくきかんしのうほう	縦隔気管支嚢胞	ime	名詞
じゅうかくきけいしゅ	縦隔奇形腫	ime	名詞
じゅうかくきしゅ	縦隔気腫	both	名詞
じゅうかくきょう	縦隔鏡	ime	名詞
じゅうかくきょうまくえん	縦隔胸膜炎	ime	名詞
じゅうかくけっかく	縦隔結核	ime	名詞
じゅうかくけっしゅ	縦隔血腫	ime	名詞
じゅうかくこうじょうせんしゅ	縦隔甲状腺腫	ime	名詞
じゅうかくしぼうしゅ	縦隔脂肪腫	ime	名詞
じゅうかくしぼうにくしゅ	縦隔脂肪肉腫	ime	名詞
じゅうかくしゅよう	縦隔腫瘍	both	名詞
じゅうかくしゅようきょうせんてきしゅつ	縦隔腫瘍、胸腺摘出術	ime	名詞
じゅうかくしんけいがしゅ	縦隔神経芽腫	ime	名詞
じゅうかくしんけいしゅよう	縦隔神経腫瘍	ime	名詞
じゅうかくせっかいじゅつ	縦隔切開術	ime	名詞
じゅうかくせんいしょう	縦隔線維症	ime	名詞
じゅうかくたいしゅく	縦隔退縮	ime	名詞
じゅうかくどう	縦隔洞	ime	名詞
じゅうかくないけっしゅ	縦隔内血腫	mac	名詞
じゅうかくのうよう	縦隔膿瘍	ime	名詞
じゅうかくはいさいぼうしゅよう	縦隔胚細胞腫瘍	ime	名詞
じゅうかくひよう	縦隔皮様	ime	名詞
じゅうかくひようのうほう	縦隔皮様嚢胞	ime	名詞
じゅうかくぶ	縦隔部	mac	名詞
じゅうかくへるにあ	縦隔ヘルニア	ime	名詞
じゅうかくへんい	縦隔偏位	ime	名詞
じゅうかくめん	縦隔面	mac	名詞
じゅうかくらんおうのうしゅよう	縦隔卵黄嚢腫瘍	ime	名詞
じゅうかくりんぱせつしゅちょう	縦隔リンパ節腫脹	ime	名詞
じゅうかくりんぱせつてんい	縦隔リンパ節転移	ime	名詞
じゅうかでんりゅうし	重荷電粒子	mac	名詞
じゅうかでんりゅうしせん	重荷電粒子線	mac	名詞
じゅうきそんしょう	銃器損傷	mac	名詞
じゅうきょうせんい	縦橋繊維	mac	名詞
じゅうきんぞくゆうはつせいじんしょう	重金属誘発性腎症	ime	名詞
じゅうけい	縦径	mac	名詞
じゅうけつきゅうちゅう	住血吸虫	mac	名詞
じゅうけつきゅうちゅうしょう	住血吸虫症	both	名詞
じゅうけつきゅうちゅうしょうせいもんみゃくあつこうしん	住血吸虫症性門脈圧亢進症	ime	名詞
じゅうけつきゅうちゅうせいひふえん	住血吸虫性皮膚炎	ime	名詞
じゅうこっせつ	縦骨折	both	名詞
じゅうさ	重鎖	mac	名詞
じゅうさびょう	重鎖病	ime	名詞
じゅうさん	重散	ime	名詞
じゅうさんいんし	XIII因子	mac	名詞
じゅうさんえー	ⅩⅢa	mac	名詞
じゅうしつさんか	重質酸化	ime	名詞
じゅうしつさんかまぐねしうむ	重質酸化マグネシウム	ime	名詞
じゅうしつたんさん	重質炭酸	ime	名詞
じゅうしつたんさんまぐねしうむ	重質炭酸マグネシウム	ime	名詞
じゅうしょう	重症	both	名詞
じゅうしょうかいようせいだいちょうえん	重症潰瘍性大腸炎	ime	名詞
じゅうしょうかんえん	重症肝炎	mac	名詞
じゅうしょうかんせんしょう	重症感染症	ime	名詞
じゅうしょうがたしんしんしょう	重症型心身症	ime	名詞
じゅうしょうきゅうせいこきゅうきしょうこうぐん	重症急性呼吸器症候群	both	名詞
じゅうしょうきゅうせいすいえん	重症急性膵炎	ime	名詞
じゅうしょうきょけつし	重症虚血肢	ime	名詞
じゅうしょうきんむりょくしょう	重症筋無力症	both	名詞
じゅうしょうさいせいふりょうせいひんけつ	重症再生不良性貧血	ime	名詞
じゅうしょうしんしんしょう	重症心身症	ime	名詞
じゅうしょうしんしんしょうがい	重症心身障害	ime	名詞
じゅうしょうしんせいじかし	重症新生児仮死	ime	名詞
じゅうしょうじ	重症時	mac	名詞
じゅうしょうすいえん	重症膵炎	mac	名詞
じゅうしょうせいじんせいちょうほるもんぶんぴふぜん	重症成人成長ホルモン分泌不全	ime	名詞
じゅうしょうせんてんせいこうちゅうきゅうげんしょうしょ	重症先天性好中球減少症	ime	名詞
じゅうしょうぜんそくほっさ	重症喘息発作	ime	名詞
じゅうしょうたいじすいしゅ	重症胎児水腫	ime	名詞
じゅうしょうたけいしんしゅつせいこうはんきゅうせいき	重症多形滲出性紅斑・急性期	ime	名詞
じゅうしょうたけいしんしゅつせいこうはんてんきゅうせい	重症多形滲出性紅斑・急性期	ime	名詞
じゅうしょうとうぶがいしょう	重症頭部外傷	ime	名詞
じゅうしょうにんしんおそ	重症妊娠悪阻	ime	名詞
じゅうしょうにんしんこうけつあつしょうこうぐん	重症妊娠高血圧症候群	ime	名詞
じゅうしょうにんしんちゅうどくしょう	重症妊娠中毒症	ime	名詞
じゅうしょうねっしょう	重症熱傷	mac	名詞
じゅうしょうねっせいけっしょうばんげんしょうしょうこう	重症熱性血小板減少症候群	ime	名詞
じゅうしょうふくごうがためんえきふぜんしょう	重症複合型免疫不全症	both	名詞
じゅうしょうふくごうめんえきふぜんしょう	重症複合免疫不全症	both	名詞
じゅうしょうべんぴ	重症便秘	ime	名詞
じゅうしょうべんぴしょう	重症便秘症	ime	名詞
じゅうしんどうようけい	重心動揺計	both	名詞
じゅうしんどうようけんさ	重心動揺検査	mac	名詞
じゅうじさつ	銃自殺	ime	名詞
じゅうじさつみすい	銃自殺未遂	ime	名詞
じゅうじじんたい	十字靱帯	ime	名詞
じゅうじじんたいそんしょう	十字靱帯損傷	ime	名詞
じゅうじつせいらんそうしゅよう	充実性卵巣腫瘍	ime	名詞
じゅうせきし	重積歯	ime	名詞
じゅうせっかい	縦切開	mac	名詞
じゅうぜんだいほとう	十全大補湯	both	名詞
じゅうそう	縦走	mac	名詞
じゅうそう	重曹	ime	名詞
じゅうそう	銃創	ime	名詞
じゅうそうかいよう	縦走潰瘍	mac	名詞
じゅうそうすい	重曹水	mac	名詞
じゅうそうへんぺいじょうひ	重層扁平上皮	mac	名詞
じゅうそく	縦束	mac	名詞
じゅうそくきゅう	縦足弓	mac	名詞
じゅうたんさんえん	重炭酸塩	ime	名詞
じゅうてんぶつかこう	充填物過高	ime	名詞
じゅうてんぶつそぞう	充填物粗造	ime	名詞
じゅうてんぶつだつらく	充填物脱落	ime	名詞
じゅうてんぶつだつり	充填物脱離	ime	名詞
じゅうてんぶつていい	充填物低位	ime	名詞
じゅうてんぶつはそん	充填物破損	ime	名詞
じゅうてんぶつふてきごう	充填物不適合	ime	名詞
じゅうど	重度	ime	名詞
じゅうどうつ	重度うつ	mac	名詞
じゅうどえいようしっちょう	重度栄養失調	ime	名詞
じゅうどかし	重度仮死	mac	名詞
じゅうどすとれすはんのう	重度ストレス反応	ime	名詞
じゅうどせいしんちたい	重度精神遅滞	ime	名詞
じゅうどせいしんはったつちたい	重度精神発達遅滞	ime	名詞
じゅうどちてきしょうがい	重度知的障害	ime	名詞
じゅうにいんし	XII因子	mac	名詞
じゅうにえー	Ⅻa	mac	名詞
じゅうにしいしょせいいねんまく	十二指異所性胃粘膜	ime	名詞
じゅうにしちょう	十二指腸	ime	名詞
じゅうにしちょうBrunnerせんしゅ	十二指腸Brunner腺腫	ime	名詞
じゅうにしちょうあくせい	十二指腸悪性	ime	名詞
じゅうにしちょうあくせいがすとりのーま	十二指腸悪性ガストリノーマ	ime	名詞
じゅうにしちょうあくせいしゅよう	十二指腸悪性腫瘍	ime	名詞
じゅうにしちょうあくせいそまとすたちのーま	十二指腸悪性ソマトスタチノーマ	ime	名詞
じゅうにしちょうあくせいりんぱしゅ	十二指腸悪性リンパ腫	ime	名詞
じゅうにしちょういしょせいいねんまく	十二指腸異所性胃粘膜	ime	名詞
じゅうにしちょういぶつ	十二指腸異物	ime	名詞
じゅうにしちょういれうす	十二指腸イレウス	ime	名詞
じゅうにしちょうえん	十二指腸炎	ime	名詞
じゅうにしちょうかいよう	十二指腸潰瘍	ime	名詞
じゅうにしちょうかいようはんこん	十二指腸潰瘍瘢痕	ime	名詞
じゅうにしちょうかるちのいど	十二指腸カルチノイド	ime	名詞
じゅうにしちょうがすとりのーま	十二指腸ガストリノーマ	ime	名詞
じゅうにしちょうがん	十二指腸癌	ime	名詞
じゅうにしちょうきゅうごぶかいよう	十二指腸球後部潰瘍	ime	名詞
じゅうにしちょうきゅうぶ	十二指腸球部	both	名詞
じゅうにしちょうきゅうぶへんけい	十二指腸球部変形	ime	名詞
じゅうにしちょうきょうさく	十二指腸狭窄	ime	名詞
じゅうにしちょうきょうさくしょう	十二指腸狭窄症	ime	名詞
じゅうにしちょうきょだいかいよう	十二指腸巨大潰瘍	ime	名詞
じゅうにしちょうくうちょうきょく	十二指腸空腸曲	mac	名詞
じゅうにしちょうくうちょうふんごうし	十二指腸空腸吻合術	ime	名詞
じゅうにしちょうくろーんびょう	十二指腸クローン病	ime	名詞
じゅうにしちょうけいしつ	十二指腸憩室	ime	名詞
じゅうにしちょうけいしつえん	十二指腸憩室炎	ime	名詞
じゅうにしちょうけいしつしゅっけつ	十二指腸憩室出血	ime	名詞
じゅうにしちょうけいしつしょう	十二指腸憩室症	ime	名詞
じゅうにしちょうけいしつせんこう	十二指腸憩室穿孔	ime	名詞
じゅうにしちょうけっかく	十二指腸結核	ime	名詞
じゅうにしちょうけっかんしゅ	十二指腸血管腫	ime	名詞
じゅうにしちょうしぼうしゅ	十二指腸脂肪腫	ime	名詞
じゅうにしちょうしゅういえん	十二指腸周囲炎	ime	名詞
じゅうにしちょうしゅよう	十二指腸腫瘍	ime	名詞
じゅうにしちょうしゅりゅう	十二指腸腫瘤	ime	名詞
じゅうにしちょうしょうかかんかんしつしゅよう	十二指腸消化管間質腫瘍	ime	名詞
じゅうにしちょうしんけいないぶんぴがん	十二指腸神経内分泌癌	ime	名詞
じゅうにしちょうしんけいないぶんぴしゅよう	十二指腸神経内分泌腫瘍	ime	名詞
じゅうにしちょうじょうひないがん	十二指腸上皮内癌	ime	名詞
じゅうにしちょうじょうみゃくりゅう	十二指腸静脈瘤	ime	名詞
じゅうにしちょうせんいしゅ	十二指腸線維腫	ime	名詞
じゅうにしちょうせんこう	十二指腸穿孔	both	名詞
じゅうにしちょうせんこうふくまくえん	十二指腸穿孔腹膜炎	ime	名詞
じゅうにしちょうせんしゅ	十二指腸腺腫	ime	名詞
じゅうにしちょうぜんもんみゃく	十二指腸前門脈	ime	名詞
じゅうにしちょうそうけいしつてきしゅつ	十二指腸窓憩室摘出術	ime	名詞
じゅうにしちょうそうたんかんえん	十二指腸総胆管炎	ime	名詞
じゅうにしちょうそまとすたちのーま	十二指腸ソマトスタチノーマ	ime	名詞
じゅうにしちょうそんしょう	十二指腸損傷	both	名詞
じゅうにしちょうぞんでほう	十二指腸ゾンデ法	ime	名詞
じゅうにしちょうちゅうしょう	十二指腸虫症	ime	名詞
じゅうにしちょうちゅうひんけつ	十二指腸虫貧血	ime	名詞
じゅうにしちょうにゅうとうえん	十二指腸乳頭炎	ime	名詞
じゅうにしちょうにゅうとうがん	十二指腸乳頭癌	ime	名詞
じゅうにしちょうにゅうとうきょうさく	十二指腸乳頭狭窄	ime	名詞
じゅうにしちょうにゅうとうしゅよう	十二指腸乳頭腫瘍	ime	名詞
じゅうにしちょうにゅうとうぶ	十二指腸乳頭部	ime	名詞
じゅうにしちょうにゅうとうぶがん	十二指腸乳頭部癌	both	名詞
じゅうにしちょうにゅうとうぶしゅよう	十二指腸乳頭部腫瘍	ime	名詞
じゅうにしちょうねんえきしゅ	十二指腸粘液腫	ime	名詞
じゅうにしちょうねんまくかしゅよう	十二指腸粘膜下腫瘍	ime	名詞
じゅうにしちょうはれつ	十二指腸破裂	ime	名詞
じゅうにしちょうびらん	十二指腸びらん	ime	名詞
じゅうにしちょうぶるんねるせんしゅ	十二指腸ブルンネル腺腫	ime	名詞
じゅうにしちょうへいかつきんしゅ	十二指腸平滑筋腫	ime	名詞
じゅうにしちょうへいかつきんにくしゅ	十二指腸平滑筋肉腫	ime	名詞
じゅうにしちょうへいさ	十二指腸閉鎖	ime	名詞
じゅうにしちょうへいそく	十二指腸閉塞	ime	名詞
じゅうにしちょうへんけい	十二指腸変形	ime	名詞
じゅうにしちょうぼうへるにあ	十二指腸傍ヘルニア	ime	名詞
じゅうにしちょうぽりぽーしす	十二指腸ポリポーシス	ime	名詞
じゅうにしちょうぽりーぷ	十二指腸ポリープ	ime	名詞
じゅうにしちょうぽりーぽーじす	十二指腸ポリーポージス	ime	名詞
じゅうにしちょうめいにゅうすい	十二指腸迷入膵	ime	名詞
じゅうにしちょうりょうせいしゅよう	十二指腸良性腫瘍	ime	名詞
じゅうにしちょうりんぱかんしゅ	十二指腸リンパ管腫	ime	名詞
じゅうにしちょうろう	十二指腸瘻	ime	名詞
じゅうはちじょうせんしょくたいいじょう	18常染色体異常	ime	名詞
じゅうひようぼはん	獣皮様母斑	both	名詞
じゅうふく	重複	ime	名詞
じゅうふくがん	重複癌	ime	名詞
じゅうふくこっせつ	重複骨折	ime	名詞
じゅうふくしきゅう	重複子宮	ime	名詞
じゅうふくしきゅうしゅじゅつ	重複子宮手術	ime	名詞
じゅうふくしょうかかん	重複消化管	ime	名詞
じゅうふくじん	重複腎	ime	名詞
じゅうふくじんう	重複腎盂	ime	名詞
じゅうふくじんうにょうかん	重複腎盂尿管	ime	名詞
じゅうふくじんどうみゃく	重複腎動脈	ime	名詞
じゅうふくせい	重複性	ime	名詞
じゅうふくせいあてとーしす	重複性アテトーシス	ime	名詞
じゅうふくせいかん	重複精管	ime	名詞
じゅうふくせいすいちょくこつばんかいほうこっせつ	重複性垂直骨盤開放骨折	ime	名詞
じゅうふくせいすいちょくこつばんこっせつ	重複性垂直骨盤骨折	ime	名詞
じゅうふくそうぼうべんこう	重複僧帽弁口	ime	名詞
じゅうふくたん	重複胆	ime	名詞
じゅうふくたんかん	重複胆管	ime	名詞
じゅうふくたんのう	重複胆嚢	ime	名詞
じゅうふくたんのうかん	重複胆嚢管	ime	名詞
じゅうふくだいどうみゃくきゅう	重複大動脈弓	ime	名詞
じゅうふくちつ	重複腟	ime	名詞
じゅうふくちつ	重複膣	ime	名詞
じゅうふくちょう	重複腸	ime	名詞
じゅうふくつめ	重複爪	ime	名詞
じゅうふくにゅうとう	重複乳頭	ime	名詞
じゅうふくにょうかん	重複尿管	ime	名詞
じゅうふくにょうどう	重複尿道	ime	名詞
じゅうふくへてろせつごうがたかまじょうかしょうがい	重複ヘテロ接合型鎌状化障害	ime	名詞
じゅうふくぼうこう	重複膀胱	ime	名詞
じゅうふくぼし	重複母指	ime	名詞
じゅうふくゆうもん	重複幽門	ime	名詞
じゅうまんき	充満期	mac	名詞
じゅうみはいどくとう	十味敗毒湯	ime	名詞
じゅうめいはんのう	従命反応	mac	名詞
じゅうもう	絨毛	mac	名詞
じゅうもうかんくう	絨毛間腔	mac	名詞
じゅうもうがん	絨毛癌	both	名詞
じゅうもうけっかんしゅ	絨毛血管腫	ime	名詞
じゅうもうじょうせんしゅ	絨毛状腺腫	mac	名詞
じゅうもうじょうひがん	絨毛上皮癌	ime	名詞
じゅうもうじょうひしゅ	絨毛上皮腫	ime	名詞
じゅうもうせいけん	絨毛生検	mac	名詞
じゅうもうせいごなどとろぴん	絨毛性ゴナドトロピン	mac	名詞
じゅうもうせいしっかん	絨毛性疾患	ime	名詞
じゅうもうせいしゅよう	絨毛性腫瘍	ime	名詞
じゅうもうせんしゅ	絨毛腺腫	ime	名詞
じゅうもうまく	絨毛膜	mac	名詞
じゅうもうまくかけっしゅ	絨毛膜下血腫	ime	名詞
じゅうもうまくくう	絨毛膜腔	mac	名詞
じゅうもうまくけっかんしゅ	絨毛膜血管腫	ime	名詞
じゅうもうまくばん	絨毛膜板	mac	名詞
じゅうもうまくむもうぶ	絨毛膜無毛部	mac	名詞
じゅうもうまくゆうもうぶ	絨毛膜有毛部	mac	名詞
じゅうもうまくようまくえん	絨毛膜羊膜炎	both	名詞
じゅうもうようまくえん	絨毛羊膜炎	ime	名詞
じゅうやく	ジュウヤク	ime	名詞
じゅくしゅ	粥腫	mac	名詞
じゅくしゅしょう	粥腫症	ime	名詞
じゅくじょう	粥状	mac	名詞
じゅくじょうこうか	粥状硬化	mac	名詞
じゅくじょうこうかしょう	粥状硬化症	mac	名詞
じゅくじょうこうかはん	粥状硬化斑	mac	名詞
じゅくじょうだいどうみゃくこうかしょう	粥状大動脈硬化症	ime	名詞
じゅけつじ	受血児	mac	名詞
じゅし	樹脂	ime	名詞
じゅしじょうかくまくえん	樹枝状角膜炎	ime	名詞
じゅしじょうかくまくかいよう	樹枝状角膜潰瘍	ime	名詞
じゅしじょうはくないしょう	樹枝状白内障	ime	名詞
じゅしじょうひはん	樹枝状皮斑	ime	名詞
じゅしじょうふはいもう	樹枝状腐敗網	mac	名詞
じゅしょうがん	受傷眼	ime	名詞
じゅしょうきてん	受傷機転	mac	名詞
じゅしょうじき	受傷時期	mac	名詞
じゅしょうちょくご	受傷直後	mac	名詞
じゅしょうぶい	受傷部位	mac	名詞
じゅしょうめんせき	受傷面積	mac	名詞
じゅじょうさいぼう	樹状細胞	mac	名詞
じゅじょうとっき	樹状突起	mac	名詞
じゅすいじさつ	入水自殺	ime	名詞
じゅすいじさつみすい	入水自殺未遂	ime	名詞
じゅずじょうきょうさく	数珠状狭窄	mac	名詞
じゅせいのう	受精能	mac	名詞
じゅっちゅうかいしゅうしき	術中回収式	mac	名詞
じゅっちゅうしょうしゃ	術中照射	mac	名詞
じゅっちゅうじんそくしんだん	術中迅速診断	mac	名詞
じゅっちゅうＩＣＧけいこうけっかんさつえい	術中ICG蛍光血管撮影	mac	名詞
じゅつご	術後	ime	名詞
じゅつごいかいよう	術後胃潰瘍	ime	名詞
じゅつごいじゅうにしちょうかいよう	術後胃十二指腸潰瘍	ime	名詞
じゅつごいぶつたいないいざん	術後異物体内遺残	ime	名詞
じゅつごいれうす	術後イレウス	ime	名詞
じゅつごえんげしょうがい	術後嚥下障害	ime	名詞
じゅつごおうかくまくかのうよう	術後横隔膜下膿瘍	ime	名詞
じゅつごおしん	術後悪心	ime	名詞
じゅつごかがくりょうほう	術後化学療法	mac	名詞
じゅつごかすいたいきのうていかしょう	術後下垂体機能低下症	ime	名詞
じゅつごかんえん	術後肝炎	ime	名詞
じゅつごかんしょうがい	術後肝障害	ime	名詞
じゅつごかんせんしょう	術後感染症	ime	名詞
じゅつごかんどうみゃくれんしゅくしょう	術後冠動脈攣縮症	ime	名詞
じゅつごかんり	術後管理	ime	名詞
じゅつごがっぺいしょう	術後合併症	both	名詞
じゅつごがんないえん	術後眼内炎	ime	名詞
じゅつごがんめんしんけいまひ	術後顔面神経麻痺	ime	名詞
じゅつごきゅうしゅうふりょう	術後吸収不良	ime	名詞
じゅつごきゅうしゅうふりょうせいこつそしょうしょう	術後吸収不良性骨粗鬆症	ime	名詞
じゅつごきゅうしゅうふりょうせいこつなんかしょう	術後吸収不良性骨軟化症	ime	名詞
じゅつごきゅうせいかんえん	術後急性肝炎	ime	名詞
じゅつごぎゃくりゅうせい	術後逆流性	ime	名詞
じゅつごぎゃくりゅうせいしょくどうえん	術後逆流性食道炎	ime	名詞
じゅつごくうきそくせんしょう	術後空気塞栓症	ime	名詞
じゅつごけいずいそんしょう	術後頚髄損傷	ime	名詞
じゅつごけいれんほっさ	術後痙攣発作	ime	名詞
じゅつごけっしゅ	術後血腫	ime	名詞
じゅつごけつまくえん	術後結膜炎	ime	名詞
じゅつごけろいど	術後ケロイド	ime	名詞
じゅつごけろいどけいせい	術後ケロイド形成	ime	名詞
じゅつごけろいどはんこん	術後ケロイド瘢痕	ime	名詞
じゅつごこういせい	術後後遺性	ime	名詞
じゅつごこうがいけっそん	術後口蓋欠損	ime	名詞
じゅつごこうがんあつしょう	術後高眼圧症	ime	名詞
じゅつごこうさいえん	術後虹彩炎	ime	名詞
じゅつごこうじょうせんきのうていかしょう	術後甲状腺機能低下症	ime	名詞
じゅつごこうもんきょうさく	術後肛門狭窄	ime	名詞
じゅつごこきゅうふぜん	術後呼吸不全	ime	名詞
じゅつごこつずいえん	術後骨髄炎	ime	名詞
じゅつごさいはつ	術後再発	ime	名詞
じゅつごさんさしんけいつう	術後三叉神経痛	ime	名詞
じゅつござんいいえん	術後残胃胃炎	ime	名詞
じゅつござんいえん	術後残胃炎	ime	名詞
じゅつござんぞんろうこう	術後残存瘻孔	ime	名詞
じゅつごしにくたいしゅく	術後歯肉退縮	ime	名詞
じゅつごしゅじゅつそうけろいど	術後手術創ケロイド	ime	名詞
じゅつごしゅっけつせい	術後出血性	ime	名詞
じゅつごしゅっけつせいしょっく	術後出血性ショック	ime	名詞
