ざい	坐位	mac	名詞
じょうみゃくろかくほ	静脈路確保	mac	名詞
じょうもんしれつ	上門歯列	ime	名詞
じょうゆう	常優	ime	名詞
じょうよう	上葉	mac	名詞
じょうようしょうさいぼうはいがん	上葉小細胞肺癌	ime	名詞
じょうようはいがん	上葉肺癌	ime	名詞
じょうようはいせんがん	上葉肺腺癌	ime	名詞
じょうようはいだいさいぼうがん	上葉肺大細胞癌	ime	名詞
じょうようはいへんぺいじょうひがん	上葉肺扁平上皮癌	ime	名詞
じょうようひしょうさいぼうはいがん	上葉非小細胞肺癌	ime	名詞
じょうようふか	常用負荷	ime	名詞
じょうようむきはい	上葉無気肺	ime	名詞
じょうようやく	常用薬	mac	名詞
じょうようりょう	常用量	mac	名詞
じょうれつ	常劣	ime	名詞
じょうろくおうとつじんたい	上肋横突靱帯	mac	名詞
じょうろっこつか	上肋骨窩	mac	名詞
じょうわん	上腕	ime	名詞
じょうわんあくせいせんいせいそしききゅうしゅ	上腕悪性線維性組織球腫	ime	名詞
じょうわんあくせいなんぶしゅよう	上腕悪性軟部腫瘍	ime	名詞
じょうわんあくせいまっしょうしんけいしょうしゅ	上腕悪性末梢神経鞘腫	ime	名詞
じょうわんあつざしょう	上腕圧挫傷	ime	名詞
じょうわんおうもんきんにくしゅ	上腕横紋筋肉腫	ime	名詞
じょうわんおせんそう	上腕汚染創	ime	名詞
じょうわんかいせんじょうみゃく	上腕回旋静脈	mac	名詞
じょうわんかいせんどうみゃく	上腕回旋動脈	mac	名詞
じょうわんかいよう	上腕潰瘍	ime	名詞
じょうわんかじょうぶ	上腕顆上部	ime	名詞
じょうわんかつまくにくしゅ	上腕滑膜肉腫	ime	名詞
じょうわんかろうせいきんえん	上腕過労性筋炎	ime	名詞
じょうわんかんつうじゅうそう	上腕貫通銃創	ime	名詞
じょうわんきていさいぼうがん	上腕基底細胞癌	ime	名詞
じょうわんきん	上腕筋	mac	名詞
じょうわんきんえん	上腕筋炎	ime	名詞
じょうわんきんきんまくえん	上腕筋筋膜炎	ime	名詞
じょうわんきんざしょう	上腕筋挫傷	ime	名詞
じょうわんきんつう	上腕筋痛	ime	名詞
じょうわんきんにくつう	上腕筋肉痛	ime	名詞
じょうわんきんにくないいぶつざんりゅう	上腕筋肉内異物残留	ime	名詞
じょうわんけっかんしぼうしゅ	上腕血管脂肪腫	ime	名詞
じょうわんけっかんしゅ	上腕血管腫	ime	名詞
じょうわんけっかんそんしょう	上腕血管損傷	ime	名詞
じょうわんけっせんせいじょうみゃくえん	上腕血栓性静脈炎	ime	名詞
じょうわんけんぶつう	上腕肩部痛	ime	名詞
じょうわんげかけい	上腕外科頚	ime	名詞
じょうわんこっとうえし	上腕骨頭壊死	ime	名詞
じょうわんこつ	上腕骨	ime	名詞
じょうわんこつえんいこったんせんそんしょう	上腕骨遠位骨端線損傷	ime	名詞
じょうわんこつえんいこったんせんりかい	上腕骨遠位骨端線離開	ime	名詞
じょうわんこつえんいたんかいほうこっせつ	上腕骨遠位端開放骨折	ime	名詞
じょうわんこつえんいたんかいほうせいふんさいこっせつ	上腕骨遠位端開放性粉砕骨折	ime	名詞
じょうわんこつえんいたんこっせつ	上腕骨遠位端骨折	ime	名詞
じょうわんこつえんいたんふんさいこっせつ	上腕骨遠位端粉砕骨折	ime	名詞
じょうわんこつえんいぶこつしゅよう	上腕骨遠位部骨腫瘍	ime	名詞
じょうわんこつかいほうこっせつ	上腕骨開放骨折	ime	名詞
じょうわんこつかいほうせいだっきゅうこっせつ	上腕骨開放性脱臼骨折	ime	名詞
じょうわんこつかいほうせいふんさいこっせつ	上腕骨開放性粉砕骨折	ime	名詞
じょうわんこつかいぼうけいかいほうこっせつ	上腕骨解剖頚開放骨折	ime	名詞
じょうわんこつかいぼうけいこっせつ	上腕骨解剖頚骨折	ime	名詞
じょうわんこつかかいほうせいふんさいこっせつ	上腕骨顆開放性粉砕骨折	ime	名詞
じょうわんこつかかんかいほうこっせつ	上腕骨顆間開放骨折	ime	名詞
じょうわんこつかかんこっせつ	上腕骨顆間骨折	ime	名詞
じょうわんこつかじょう	上腕骨顆上	ime	名詞
じょうわんこつかじょうかいほうこっせつ	上腕骨顆上開放骨折	ime	名詞
じょうわんこつかじょうこっせつ	上腕骨顆上骨折	both	名詞
じょうわんこつかたん	上腕骨下端	ime	名詞
じょうわんこつかっしゃ	上腕骨滑車	mac	名詞
じょうわんこつかっしゃこっせつ	上腕骨滑車骨折	ime	名詞
じょうわんこつかふんさいこっせつ	上腕骨顆粉砕骨折	ime	名詞
じょうわんこつかぶ	上腕骨顆部	ime	名詞
じょうわんこつかぶかいほうこっせつ	上腕骨顆部開放骨折	ime	名詞
じょうわんこつかぶこっせつ	上腕骨顆部骨折	ime	名詞
じょうわんこつかんせつとっきかいほうこっせつ	上腕骨関節突起開放骨折	ime	名詞
じょうわんこつかんせつとっきこっせつ	上腕骨関節突起骨折	ime	名詞
じょうわんこつがいか	上腕骨外顆	ime	名詞
じょうわんこつがいかえん	上腕骨外顆炎	ime	名詞
じょうわんこつがいかかいほうこっせつ	上腕骨外顆開放骨折	ime	名詞
じょうわんこつがいかこっせつ	上腕骨外顆骨折	both	名詞
じょうわんこつがいじょうかえん	上腕骨外上顆炎	ime	名詞
じょうわんこつがいじょうかかいほうこっせつ	上腕骨外上顆開放骨折	ime	名詞
じょうわんこつがいじょうかこっせつ	上腕骨外上顆骨折	ime	名詞
じょうわんこつがいそくじょうか	上腕骨外側上顆	ime	名詞
じょうわんこつきょさいぼうしゅ	上腕骨巨細胞腫	ime	名詞
じょうわんこつきんいこったんせんそんしょう	上腕骨近位骨端線損傷	ime	名詞
じょうわんこつきんいこったんせんりかい	上腕骨近位骨端線離開	ime	名詞
じょうわんこつきんいたんかいほうこっせつ	上腕骨近位端開放骨折	ime	名詞
じょうわんこつきんいたんかいほうせいふんさいこっせつ	上腕骨近位端開放性粉砕骨折	ime	名詞
じょうわんこつきんいたんこっせつ	上腕骨近位端骨折	ime	名詞
じょうわんこつきんいたんびょうてきこっせつ	上腕骨近位端病的骨折	ime	名詞
じょうわんこつきんいたんふんさいこっせつ	上腕骨近位端粉砕骨折	ime	名詞
じょうわんこつきんいぶきょさいぼうしゅ	上腕骨近位部巨細胞腫	ime	名詞
じょうわんこつきんいぶこつしゅよう	上腕骨近位部骨腫瘍	ime	名詞
じょうわんこつぎかんせつしょう	上腕骨偽関節症	ime	名詞
じょうわんこつけいぶ	上腕骨頚部	ime	名詞
じょうわんこつけいぶ	上腕骨頸部	mac	名詞
じょうわんこつけいぶかいほうこっせつ	上腕骨頚部開放骨折	ime	名詞
じょうわんこつけいぶこっせつ	上腕骨頚部骨折	ime	名詞
じょうわんこつけいぶへんけいちゆこっせつ	上腕骨頚部変形治癒骨折	ime	名詞
じょうわんこつげかけい	上腕骨外科頚	ime	名詞
じょうわんこつげかけいかいほうこっせつ	上腕骨外科頚開放骨折	ime	名詞
じょうわんこつげかけいかいほうせいだっきゅうこっせつ	上腕骨外科頚開放性脱臼骨折	ime	名詞
じょうわんこつげかけいこっせつ	上腕骨外科頚骨折	ime	名詞
じょうわんこつげかけいだっきゅうこっせつ	上腕骨外科頚脱臼骨折	ime	名詞
じょうわんこつこっかんぶ	上腕骨骨幹部	ime	名詞
じょうわんこつこっかんぶかいほうこっせつ	上腕骨骨幹部開放骨折	ime	名詞
じょうわんこつこっかんぶこっせつ	上腕骨骨幹部骨折	both	名詞
じょうわんこつこっかんぶこつしゅよう	上腕骨骨幹部骨腫瘍	ime	名詞
じょうわんこつこっかんぶびょうてきこっせつ	上腕骨骨幹部病的骨折	ime	名詞
じょうわんこつこっせつ	上腕骨骨折	ime	名詞
じょうわんこつこっとう	上腕骨骨頭	ime	名詞
じょうわんこつこっとうかいほうこっせつ	上腕骨骨頭開放骨折	ime	名詞
じょうわんこつこっとうこっせつ	上腕骨骨頭骨折	ime	名詞
じょうわんこつこっとうじゃくねんせいこつなんこつしょう	上腕骨骨頭若年性骨軟骨症	ime	名詞
じょうわんこつこつずいえん	上腕骨骨髄炎	ime	名詞
じょうわんこつこつにくしゅ	上腕骨骨肉腫	ime	名詞
じょうわんこつしゃくそくじょうかえん	上腕骨尺側上顆炎	ime	名詞
じょうわんこつしゅよう	上腕骨腫瘍	ime	名詞
じょうわんこつしょうけっせつこっせつ	上腕骨小結節骨折	ime	名詞
じょうわんこつしょうとう	上腕骨小頭	both	名詞
じょうわんこつしょうとうかいほうこっせつ	上腕骨小頭開放骨折	ime	名詞
じょうわんこつしょうとうこっせつ	上腕骨小頭骨折	ime	名詞
じょうわんこつしょうとうじゃくねんせいこつなんこつしょ	上腕骨小頭若年性骨軟骨症	ime	名詞
じょうわんこつじょうかえん	上腕骨上顆炎	ime	名詞
じょうわんこつじんこうこっとうちかんじゅつご	上腕骨人工骨頭置換術後	ime	名詞
じょうわんこつせんいせいこついけいせいしょう	上腕骨線維性骨異形成症	ime	名詞
じょうわんこつそんしょう	上腕骨損傷	ime	名詞
じょうわんこつだいけっせつかいほうこっせつ	上腕骨大結節開放骨折	ime	名詞
じょうわんこつだいけっせつこっせつ	上腕骨大結節骨折	ime	名詞
じょうわんこつだいけっせつはくりこっせつ	上腕骨大結節剥離骨折	ime	名詞
じょうわんこつだっきゅうこっせつ	上腕骨脱臼骨折	ime	名詞
じょうわんこつつうかかいほうこっせつ	上腕骨通顆開放骨折	ime	名詞
じょうわんこつつうかこっせつ	上腕骨通顆骨折	ime	名詞
じょうわんこつとう	上腕骨頭	mac	名詞
じょうわんこつとうそくじょうかえん	上腕骨橈側上顆炎	ime	名詞
じょうわんこつないか	上腕骨内顆	ime	名詞
じょうわんこつないかかいほうこっせつ	上腕骨内顆開放骨折	ime	名詞
じょうわんこつないかこっせつ	上腕骨内顆骨折	ime	名詞
じょうわんこつないかびょうてきこっせつ	上腕骨内果病的骨折	ime	名詞
じょうわんこつないじょうかえん	上腕骨内上顆炎	ime	名詞
じょうわんこつないじょうかかいほうこっせつ	上腕骨内上顆開放骨折	ime	名詞
じょうわんこつないじょうかこっせつ	上腕骨内上顆骨折	ime	名詞
じょうわんこつないそくじょうか	上腕骨内側上顆	ime	名詞
じょうわんこつないそくじょうかえん	上腕骨内側上顆炎	ime	名詞
じょうわんこつないはんしょう	上腕骨内反症	ime	名詞
じょうわんこつのうしゅ	上腕骨嚢腫	ime	名詞
じょうわんこつのぶんべんそんしょう	上腕骨の分娩損傷	ime	名詞
じょうわんこつびょうてきこっせつ	上腕骨病的骨折	ime	名詞
じょうわんこつふんさいこっせつ	上腕骨粉砕骨折	ime	名詞
じょうわんこつへんけいちゆこっせつ	上腕骨変形治癒骨折	ime	名詞
じょうわんこつゆーいんぐにくしゅ	上腕骨ユーイング肉腫	ime	名詞
じょうわんこつらせんこっせつ	上腕骨らせん骨折	ime	名詞
じょうわんさっかしょう	上腕擦過傷	ime	名詞
じょうわんさっかそう	上腕擦過創	ime	名詞
じょうわんさんかくきんぶぶんだんれつ	上腕三角筋部分断裂	ime	名詞
じょうわんさんとうきん	上腕三頭筋	both	名詞
じょうわんさんとうきんきんえん	上腕三頭筋筋炎	ime	名詞
じょうわんさんとうきんけんけんしょうえん	上腕三頭筋腱腱鞘炎	ime	名詞
じょうわんさんとうきんけんしょうえん	上腕三頭筋腱鞘炎	ime	名詞
じょうわんさんとうきんだんれつ	上腕三頭筋断裂	ime	名詞
じょうわんさんとうきんつう	上腕三頭筋痛	ime	名詞
じょうわんさんとうきんふぜんだんれつ	上腕三頭筋不全断裂	ime	名詞
じょうわんざそう	上腕挫創	ime	名詞
じょうわんざめつしょう	上腕挫滅傷	ime	名詞
じょうわんざめつそう	上腕挫滅創	ime	名詞
じょうわんしぼうしゅ	上腕脂肪腫	ime	名詞
じょうわんしぼうにくしゅ	上腕脂肪肉腫	ime	名詞
じょうわんしゅりゅう	上腕腫瘤	ime	名詞
じょうわんしんけいえん	上腕神経炎	ime	名詞
じょうわんしんけいこんえん	上腕神経根炎	ime	名詞
じょうわんしんけいこんそんしょう	上腕神経根損傷	ime	名詞
じょうわんしんけいそうあっぱくしょう	上腕神経叢圧迫症	ime	名詞
じょうわんしんけいそうかいがたまひ	上腕神経叢下位型麻痺	ime	名詞
じょうわんしんけいそうかんぜんまひ	上腕神経叢完全麻痺	ime	名詞
じょうわんしんけいそうしょうがい	上腕神経叢傷害	ime	名詞
じょうわんしんけいそうしょうこうぐん	上腕神経叢症候群	ime	名詞
じょうわんしんけいそうじょういがたまひ	上腕神経叢上位型麻痺	ime	名詞
じょうわんしんけいそうてんい	上腕神経叢転位	ime	名詞
じょうわんしんけいそうまひ	上腕神経叢麻痺	ime	名詞
じょうわんしんけいつう	上腕神経痛	ime	名詞
じょうわんしんけいまひ	上腕神経麻痺	ime	名詞
じょうわんしんどうみゃく	上腕深動脈	mac	名詞
じょうわんじょうみゃく	上腕静脈	mac	名詞
じょうわんじょうみゃくえん	上腕静脈炎	ime	名詞
じょうわんじょうみゃくけっせんしょう	上腕静脈血栓症	ime	名詞
じょうわんじょうみゃくそんしょう	上腕静脈損傷	ime	名詞
じょうわんせいしょくぼはん	上腕青色母斑	ime	名詞
じょうわんせっかいかじょうひしゅ	上腕石灰化上皮腫	ime	名詞
じょうわんせつだん	上腕切断	ime	名詞
じょうわんせつだんたんしんけいしゅ	上腕切断端神経腫	ime	名詞
じょうわんせんいにくしゅ	上腕線維肉腫	ime	名詞
じょうわんぜんわんかいほうこっせつ	上腕前腕開放骨折	ime	名詞
じょうわんぜんわんこっせつ	上腕前腕骨折	ime	名詞
じょうわんそんしょう	上腕損傷	ime	名詞
じょうわんたんどくけっそん	上腕単独欠損	ime	名詞
じょうわんたんめいさいぼうにくしゅ	上腕淡明細胞肉腫	ime	名詞
じょうわんだい	上腕第	ime	名詞
じょうわんだい1どねっしょう	上腕第1度熱傷	ime	名詞
じょうわんだい2どねっしょう	上腕第2度熱傷	ime	名詞
じょうわんだい3どねっしょう	上腕第3度熱傷	ime	名詞
じょうわんだいいちどねっしょう	上腕第1度熱傷	ime	名詞
じょうわんだいけっせつぶ	上腕大結節部	ime	名詞
じょうわんだいさんどねっしょう	上腕第3度熱傷	ime	名詞
じょうわんだいにどねっしょう	上腕第2度熱傷	ime	名詞
じょうわんだぼくしょう	上腕打撲傷	ime	名詞
じょうわんつう	上腕痛	ime	名詞
じょうわんとうそくきんぶぶんだんれつ	上腕頭側筋部分断裂	ime	名詞
じょうわんどうみゃく	上腕動脈	both	名詞
じょうわんどうみゃくそんしょう	上腕動脈損傷	ime	名詞
じょうわんどうみゃくひょうざいかほ	上腕動脈表在化法	ime	名詞
じょうわんどうみゃくりゅう	上腕動脈瘤	ime	名詞
じょうわんなんせいせんいしゅ	上腕軟性線維腫	ime	名詞
じょうわんなんぶしゅよう	上腕軟部腫瘍	ime	名詞
じょうわんにとうきん	上腕二頭筋	both	名詞
じょうわんにとうきんえん	上腕二頭筋炎	ime	名詞
じょうわんにとうきんきんえん	上腕二頭筋筋炎	ime	名詞
じょうわんにとうきんけんえん	上腕二頭筋腱炎	ime	名詞
じょうわんにとうきんけんしゅういえん	上腕二頭筋腱周囲炎	ime	名詞
じょうわんにとうきんけんしょうえん	上腕二頭筋腱鞘炎	ime	名詞
じょうわんにとうきんけんだんれつ	上腕二頭筋腱断裂	ime	名詞
じょうわんにとうきんそんしょう	上腕二頭筋損傷	ime	名詞
じょうわんにとうきんだんれつ	上腕二頭筋断裂	ime	名詞
じょうわんにとうきんちょうとうけんえん	上腕二頭筋長頭腱炎	ime	名詞
じょうわんにとうきんちょうとうけんだんれつ	上腕二頭筋長頭腱断裂	ime	名詞
じょうわんにとうきんつう	上腕二頭筋痛	ime	名詞
じょうわんねっしょう	上腕熱傷	ime	名詞
じょうわんのうよう	上腕膿瘍	ime	名詞
じょうわんひかけっしゅ	上腕皮下血腫	ime	名詞
じょうわんひふがん	上腕皮膚癌	ime	名詞
じょうわんひふけっそんそう	上腕皮膚欠損創	ime	名詞
じょうわんひふりょうせいしゅよう	上腕皮膚良性腫瘍	ime	名詞
じょうわんふしゅ	上腕浮腫	ime	名詞
じょうわんぶあくせいこくしょくしゅ	上腕部悪性黒色腫	ime	名詞
じょうわんぶかいほうそう	上腕部開放創	ime	名詞
じょうわんぶざしょう	上腕部挫傷	ime	名詞
じょうわんぶしゅちょう	上腕部腫脹	ime	名詞
じょうわんぶしゅりゅう	上腕部腫瘤	ime	名詞
じょうわんぶたんじゅんせいけっかんしゅ	上腕部単純性血管腫	ime	名詞
じょうわんぶつう	上腕部痛	ime	名詞
じょうわんへんぺいぼはん	上腕扁平母斑	ime	名詞
じょうわんほうそうえん	上腕蜂巣炎	ime	名詞
じょうわんほうそうじょうなんぶにくしゅ	上腕胞巣状軟部肉腫	ime	名詞
じょうわんぼはん	上腕母斑	ime	名詞
じょうわんぼはんさいぼうぼはん	上腕母斑細胞母斑	ime	名詞
じょうわんぼーえんびょう	上腕ボーエン病	ime	名詞
じょうわんめるけるさいぼうがん	上腕メルケル細胞癌	ime	名詞
じょうわんゆうきょくさいぼうがん	上腕有棘細胞癌	ime	名詞
じょうわんりゅうきせいひふせんいにくしゅ	上腕隆起性皮膚線維肉腫	ime	名詞
じょうわんるいじょうひにくしゅ	上腕類上皮肉腫	ime	名詞
じょがいしんだん	除外診断	mac	名詞
じょきょ	除去	ime	名詞
じょくそう	褥創	mac	名詞
じょくそう	褥瘡	ime	名詞
じょくそうかんせん	褥瘡感染	ime	名詞
じょくそうせい	褥瘡性	ime	名詞
じょくそうせいかいよう	褥瘡性潰瘍	ime	名詞
じょくふ	褥婦	ime	名詞
じょこうじゅつ	除睾術	mac	名詞
じょこきゅう	徐呼吸	mac	名詞
じょこつ	鋤骨	both	名詞
じょさいどう	除細動	mac	名詞
じょさいどうき	除細動器	mac	名詞
じょさまいしろっぷさん	ジョサマイシロップ	ime	名詞
じょさまいどらいしろっぷ	ジョサマイドライシロップ	ime	名詞
じょしがいせいきあくせいしゅようしゅ	女子外性器悪性腫瘍手術	ime	名詞
じょしがいせいきしゅようてきしゅつし	女子外性器腫瘍摘出術	ime	名詞
じょししきじょうしょう	女子色情症	ime	名詞
じょしにょうどうだつしゅじゅつ	女子尿道脱手術	ime	名詞
じょしまんせい	女子慢性	ime	名詞
じょしまんせいびまんせいだつもうしょう	女子慢性びまん性脱毛症	ime	名詞
じょすい	除水	mac	名詞
じょすいりょう	除水量	mac	名詞
じょせい	女性	ime	名詞
じょせいか	女性化	mac	名詞
じょせいかこうがんしょう	女性化睾丸症	ime	名詞
じょせいかしょう	女性化症	ime	名詞
じょせいかせいはんいんよう	女性仮性半陰陽	both	名詞
じょせいかにゅうぼう	女性化乳房	mac	名詞
じょせいかにゅうぼうしょう	女性化乳房症	ime	名詞
じょせいかふくじんしゅよう	女性化副腎腫瘍	ime	名詞
じょせいがいせいしょくきせんてんいじょう	女性外生殖器先天異常	ime	名詞
じょせいきゅうせいこつばんほうそうえん	女性急性骨盤蜂巣炎	ime	名詞
じょせいぎはんいんよう	女性偽半陰陽	ime	名詞
じょせいせいき	女性性器	mac	名詞
じょせいせいきいじょう	女性性器異常	ime	名詞
じょせいせいきがん	女性性器癌	ime	名詞
じょせいせいききけい	女性性器奇形	ime	名詞
じょせいせいきけっかく	女性性器結核	ime	名詞
じょせいせいきだつ	女性性器脱	ime	名詞
じょせいせいきはついくいじょう	女性性器発育異常	ime	名詞
じょせいにょうどうりゅう	女性尿道瘤	ime	名詞
じょせいはっしょう	女性発症	mac	名詞
じょせいふぞくきえん	女性付属器炎	mac	名詞
じょせいふにんしょう	女性不妊症	ime	名詞
じょせいまんせいこつばんほうそうえん	女性慢性骨盤蜂巣炎	ime	名詞
じょそうざいちゅうどく	除草剤中毒	ime	名詞
じょのうこうちょく	除脳硬直	both	名詞
じょのうしい	除脳肢位	mac	名詞
じょは	徐波	both	名詞
じょはすいみん	徐波睡眠	mac	名詞
じょはすいみんきじぞくせいきょくじょはをしめすてんかんせいのうしょう	徐波睡眠期持続性棘徐波を示すてんかん性脳症	ime	名詞
じょはんのうほう	除反応法	mac	名詞
じょひしつこうちょく	除皮質硬直	both	名詞
じょひしつしい	除皮質肢位	mac	名詞
じょびき	鋤鼻器	mac	名詞
じょほうかりゅう	徐放顆粒	ime	名詞
じょほうざい	徐放剤	mac	名詞
じょほうせい	徐放性	mac	名詞
じょほうせいざい	徐放製剤	mac	名詞
じょほうせいせいざい	徐放性製剤	mac	名詞
じょみゃく	徐脈	both	名詞
じょみゃくせいしっしん	徐脈性失神	ime	名詞
じょみゃくせいしんぼうさいどう	徐脈性心房細動	ime	名詞
じょみゃくせいふせいみゃく	徐脈性不整脈	both	名詞
じょみゃくひんみゃくしょうこうぐん	徐脈頻脈症候群	both	名詞
じょみゃくほっさ	徐脈発作	ime	名詞
じょーんずこっせつ	ジョーンズ骨折	mac	名詞
じようかんちょう	滋養浣腸	ime	名詞
じらぜぷえんさんえん	ジラゼプ塩酸塩	ime	名詞
じらぜぷえんさんえんすいわぶつ	ジラゼプ塩酸塩水和物	ime	名詞
じりつくんれんほう	自律訓練法	mac	名詞
じりつしんけい	自律神経	both	名詞
じりつしんけいいじょう	自律神経異常	ime	名詞
じりつしんけいえん	自律神経炎	ime	名詞
じりつしんけいかびんしょう	自律神経過敏症	ime	名詞
じりつしんけいかびんじょうたい	自律神経過敏状態	ime	名詞
じりつしんけいきのうしょうがい	自律神経機能障害	ime	名詞
じりつしんけいけいしょうがい	自律神経系障害	ime	名詞
じりつしんけいしっちょうしょう	自律神経失調症	ime	名詞
じりつしんけいしょう	自律神経症	ime	名詞
じりつしんけいしょうがい	自律神経障害	both	名詞
じりつしんけいしょうこうぐん	自律神経症候群	ime	名詞
じりつしんけいせい	自律神経性	ime	名詞
じりつしんけいせいてんかん	自律神経性てんかん	ime	名詞
じりつしんけいせいにゅーろぱしー	自律神経性ニューロパシー	ime	名詞
じりつしんけいせいにゅーろぱちー	自律神経性ニューロパチー	ime	名詞
じりつしんけいせいほっさ	自律神経性発作	ime	名詞
じりつしんけいせつ	自律神経節	mac	名詞
じりつしんけいちょうせつしょうがい	自律神経調節障害	ime	名詞
じりつしんけいちょうせつふぜん	自律神経調節不全	ime	名詞
じりつしんけいてんかん	自律神経てんかん	ime	名詞
じりつしんけいはんしゃせいとうつう	自律神経反射性疼痛	ime	名詞
じりつしんけいはんしゃてんかん	自律神経反射てんかん	ime	名詞
じりつしんけいふあんていしょう	自律神経不安定症	ime	名詞
じりつしんけいほっさ	自律神経発作	ime	名詞
じりつせいしんけいいんせいぼうこう	自律性神経因性膀胱	ime	名詞
じりつせいしんけいしっちょうしょう	自律性神経失調症	ime	名詞
じりつちょうせつしっちょうしょう	自律調節失調症	ime	名詞
じりつちょうせつしょうがい	自律調節障害	ime	名詞
じりん	耳輪	mac	名詞
じりんきゃく	耳輪脚	mac	名詞
じりんまいぼつしょう	耳輪埋没症	ime	名詞
じるだざっくなんこう	ジルダザック軟膏	ime	名詞
じるちあぜむえんさんえん	ジルチアゼム塩酸塩	ime	名詞
