ざい	坐位	mac	名詞
ざいいそうかん	在医総管	ime	名詞
ざいいんしぼう	在院死亡	mac	名詞
ざいざるしろっぷ	ザイザルシロップ	ime	名詞
ざいしゅじゅつ	坐位手術	mac	名詞
ざいせきもうそう	罪責妄想	mac	名詞
ざいたい	在胎	mac	名詞
ざいたいきかん	在胎期間	mac	名詞
ざいたく	在宅	ime	名詞
ざいたくかんご	在宅看護	mac	名詞
ざいたくしもん	在宅指紋	mac	名詞
ざいちゅうしん	坐位中心	mac	名詞
ざいちゅうしんらいふすたいる	坐位中心ライフスタイル	mac	名詞
ざいつほう	ザイツ法	mac	名詞
ざくろひ	ザクロヒ	ime	名詞
ざこつ	坐骨	both	名詞
ざこつかいほうこっせつ	坐骨開放骨折	ime	名詞
ざこつかいめんたいきん	坐骨海綿体筋	mac	名詞
ざこつかつえきほうえん	坐骨滑液包炎	ime	名詞
ざこつきょく	坐骨棘	mac	名詞
ざこつけっせつ	坐骨結節	both	名詞
ざこつけっせつねんえきほうえん	坐骨結節粘液包炎	ime	名詞
ざこつけっせつはくりこっせつ	坐骨結節剥離骨折	ime	名詞
ざこつけっせつぶかつえきほうえん	坐骨結節部滑液包炎	ime	名詞
ざこつけっせつぶだぼくしょう	坐骨結節部打撲傷	ime	名詞
ざこつけつごうたい	坐骨結合体	ime	名詞
ざこつこうもんか	坐骨肛門窩	mac	名詞
ざこつこっせつ	坐骨骨折	ime	名詞
ざこつこつえん	坐骨骨炎	ime	名詞
ざこつしゅよう	坐骨腫瘍	ime	名詞
ざこつしんけい	坐骨神経	both	名詞
ざこつしんけいえん	坐骨神経炎	ime	名詞
ざこつしんけいかいほうせいだんれつ	坐骨神経開放性断裂	ime	名詞
ざこつしんけいこうやくしょう	坐骨神経絞扼症	ime	名詞
ざこつしんけいこんえん	坐骨神経根炎	ime	名詞
ざこつしんけいしょうがい	坐骨神経障害	ime	名詞
ざこつしんけいそんしょう	坐骨神経損傷	ime	名詞
ざこつしんけいつう	坐骨神経痛	ime	名詞
ざこつしんけいつうせいしんけいあっぱくしょう	坐骨神経痛性神経圧迫症	ime	名詞
ざこつしんけいぶろっく	坐骨神経ブロック	ime	名詞
ざこつしんけいまひ	坐骨神経麻痺	ime	名詞
ざこつたんしんけいえん	坐骨単神経炎	ime	名詞
ざこつたんしんけいこんえん	坐骨単神経根炎	ime	名詞
ざこつだいたいじんたい	坐骨大腿靱帯	mac	名詞
ざこつちこつなんこつけつごうじゃくねんせいこつなんこつ	坐骨恥骨軟骨結合若年性骨軟骨症	ime	名詞
ざこつちょくちょう	坐骨直腸	ime	名詞
ざこつちょくちょうか	坐骨直腸窩	mac	名詞
ざこつちょくちょうかしぼうにくしゅ	坐骨直腸窩脂肪肉腫	ime	名詞
ざこつちょくちょうかじろう	坐骨直腸窩痔瘻	ime	名詞
ざこつちょくちょうかのうよう	坐骨直腸窩膿瘍	ime	名詞
ざこつちょくちょうへるにあ	坐骨直腸ヘルニア	ime	名詞
ざこつひろうこっせつ	坐骨疲労骨折	ime	名詞
ざこつぶだぼくしょう	坐骨部打撲傷	ime	名詞
ざこつぶつう	坐骨部痛	ime	名詞
ざこつぶとうつう	坐骨部疼痛	ime	名詞
ざこつぶねんえきほうえん	坐骨部粘液包炎	ime	名詞
ざこつへるにあ	坐骨ヘルニア	ime	名詞
ざこつへるにあしゅじゅつ	坐骨ヘルニア手術	ime	名詞
ざこつほうじんたい	坐骨包靱帯	ime	名詞
ざこつほうじんたいすとれいん	坐骨包靱帯ストレイン	ime	名詞
ざこつほうじんたいねんざ	坐骨包靱帯捻挫	ime	名詞
ざざい	坐剤	ime	名詞
ざしょう	挫傷	both	名詞
ざしょうこういしょう	挫傷後遺症	ime	名詞
ざじてんしろっぷ	ザジテンシロップ	ime	名詞
ざじてんてんがんえき	ザジテン点眼液	ime	名詞
ざじてんてんがんえきゆーでぃー	ザジテン点眼液	ime	名詞
ざじてんてんびえき	ザジテン点鼻液	ime	名詞
ざじてんどらいしろっぷ	ザジテンドライシロップ	ime	名詞
ざじとまてんがんえき	ザジトマ点眼液	ime	名詞
ざじとまてんびえき	ザジトマ点鼻液	ime	名詞
ざそう	ざ瘡	ime	名詞
ざそう	挫創	both	名詞
ざそう	痤瘡	mac	名詞
ざそうがた	ざ瘡型	mac	名詞
ざそうはんこん	ざ瘡瘢痕	ime	名詞
ざそうようひふしっしん	ざ瘡様皮膚湿疹	ime	名詞
ざそうようほっしん	ざ瘡様発疹	ime	名詞
ざつせいらんし	雑性乱視	ime	名詞
ざめつ	挫滅	both	名詞
ざめつしょう	挫滅傷	ime	名詞
ざめつしょうこうぐん	挫滅症候群	both	名詞
ざめつそう	挫滅創	ime	名詞
ざめつりん	挫滅輪	mac	名詞
ざやく	坐薬	ime	名詞
ざらかむはいごうてんがんえき	ザラカム配合点眼液	ime	名詞
ざるこにんえき	ザルコニン液	ime	名詞
ざるちふぇんてんがんえき	ザルチフェン点眼液	ime	名詞
ざるちふぇんてんびえき	ザルチフェン点鼻液	ime	名詞
ざるっくすくりーむ	ザルックスクリーム	ime	名詞
ざるっくすなんこう	ザルックス軟膏	ime	名詞
ざるつまんけっせつせいじすとろふぃー	ザルツマン結節性ジストロフィー	ime	名詞
ざるとぷろふぇん	ザルトプロフェン	ime	名詞
ざれつそう	挫裂創	mac	名詞
ざろんちんしろっぷ	ザロンチンシロップ	ime	名詞
ざんい	残胃	both	名詞
ざんいいえん	残胃胃炎	ime	名詞
ざんいえん	残胃炎	ime	名詞
ざんいかいよう	残胃潰瘍	ime	名詞
ざんいがたとうごうしっちょうしょう	残遺型統合失調症	both	名詞
ざんいがん	残胃癌	ime	名詞
ざんいじかくひふべん	残遺痔核皮膚弁	ime	名詞
ざんいせい	残遺性	mac	名詞
ざんいぶんれつびょう	残遺分裂病	ime	名詞
ざんき	残基	mac	名詞
ざんきりょう	残気量	mac	名詞
ざんこん	残根	ime	名詞
ざんこんじょう	残根上	ime	名詞
ざんこんじょうたい	残根状態	mac	名詞
ざんこんじょうのぎし	残根上の義歯	ime	名詞
ざんごうあし	ざんごう足	ime	名詞
ざんごうねつ	ざんごう熱	ime	名詞
ざんさ	残渣	mac	名詞
ざんずいえん	残髄炎	ime	名詞
ざんぞんせいしこん	残存性歯根	ime	名詞
ざんぞんせいしこんのうほう	残存性歯根嚢胞	ime	名詞
ざんぞんにょうかんてきしゅつじゅつ	残存尿管摘出術	ime	名詞
ざんぞんのうほう	残存嚢胞	ime	名詞
ざんにょうかん	残尿感	both	名詞
ざんにょうそくていけんさ	残尿測定検査	ime	名詞
ざんぴーくかりゅう	ザンピーク顆粒	ime	名詞
ざんりゅうのうほう	残留嚢胞	mac	名詞
ざんりゅうらんそうしょうこうぐん	残留卵巣症候群	ime	名詞
じ	ジ	mac	名詞
じ	痔	ime	名詞
じあえん	次亜塩	ime	名詞
じあえんそさんなとりうむ	次亜塩素酸ナトリウム	mac	名詞
じあえんそさんなとりうむちゅうどく	次亜塩素酸ナトリウム中毒	ime	名詞
じあしるぐりせろーる	ジアシルグリセロール	mac	名詞
じあすたーぜ	ジアスターゼ	ime	名詞
じあぜぱむ	ジアゼパム	both	名詞
じあぞきしど	ジアゾキシド	mac	名詞
じあのいなみん	ジアノイナミン	ime	名詞
じあるじあしょう	ジアルジア症	both	名詞
じい	自慰	ime	名詞
じいんこうかとう	滋陰降火湯	ime	名詞
じいんしほうとう	滋陰至宝湯	ime	名詞
じうてれんかりゅう	ジウテレン顆粒	ime	名詞
じぇいぞろふと	ジェイゾロフト	ime	名詞
じぇのげすと	ジェノゲスト	mac	名詞
じぇのとろぴん	ジェノトロピン	ime	名詞
じぇふぁーそんこっせつ	ジェファーソン骨折	ime	名詞
じえちるかるばまじん	ジエチルカルバマジン	mac	名詞
じえちるすちるべすとろーる	ジエチルスチルベストロール	mac	名詞
じおう	ジオウ	ime	名詞
じおぷたー	ジオプター	mac	名詞
じおぷとりー	ジオプトリー	mac	名詞
じおんきょうはんしゃ	耳音響反射	mac	名詞
じおんきょうほうしゃけんさ	耳音響放射	ime	名詞
じかい	耳介	both	名詞
じかいあくせいこくしょくしゅ	耳介悪性黒色腫	ime	名詞
じかいあくせいしゅようしゅじゅつ	耳介悪性腫瘍手術	ime	名詞
じかいあつざしょう	耳介圧挫傷	ime	名詞
じかいいぶつ	耳介異物	ime	名詞
じかいえそ	耳介壊疽	ime	名詞
じかいかいほうそう	耳介開放創	ime	名詞
じかいかしゅよう	耳介下腫瘍	ime	名詞
じかいかつそう	耳介割創	ime	名詞
じかいかんつうそう	耳介貫通創	ime	名詞
じかいがいしょうせいいぶつ	耳介外傷性異物	ime	名詞
じかいがいしょうせいしきそちんちゃく	耳介外傷性色素沈着	ime	名詞
じかいがいしょうせいしゅちょう	耳介外傷性腫脹	ime	名詞
じかいがいしょうせいひかいぶつ	耳介外傷性皮下異物	ime	名詞
じかいがん	耳介癌	ime	名詞
じかいきけい	耳介奇形	ime	名詞
じかいけいせいいじょう	耳介形成異常	ime	名詞
じかいけいせいしゅじゅつ	耳介形成手術	ime	名詞
じかいけいせいしょうがい	耳介形成障害	ime	名詞
じかいけっかんしぼうしゅ	耳介血管脂肪腫	ime	名詞
じかいけっしゅ	耳介血腫	both	名詞
じかいけっしゅかいそうじゅつ	耳介血腫開窓術	ime	名詞
じかいけっそん	耳介欠損	ime	名詞
じかいこうそう	耳介咬創	ime	名詞
じかいこうぶ	耳介後部	mac	名詞
じかいこうぶしゅちょう	耳介後部腫脹	ime	名詞
じかいこうぶしゅりゅう	耳介後部腫瘤	ime	名詞
じかいこうめん	耳介後面	mac	名詞
じかいご	耳介後	ime	名詞
じかいごりんぱせつ	耳介後リンパ節	ime	名詞
じかいさっかそう	耳介擦過創	ime	名詞
じかいざしょう	耳介挫傷	ime	名詞
じかいざそう	耳介挫創	ime	名詞
じかいざめつしょう	耳介挫滅傷	ime	名詞
じかいざめつそう	耳介挫滅創	ime	名詞
じかいしそう	耳介刺創	ime	名詞
じかいしっしん	耳介湿疹	ime	名詞
じかいしぼうしゅ	耳介脂肪腫	ime	名詞
じかいしゅういえん	耳介周囲炎	ime	名詞
じかいしゅういしっしん	耳介周囲湿疹	ime	名詞
じかいしゅうへんしゅちょう	耳介周辺腫脹	ime	名詞
じかいしゅよう	耳介腫瘍	ime	名詞
じかいしゅようてきしゅつじゅつ	耳介腫瘍摘出術	ime	名詞
じかいしょうきゅう	耳介小丘	mac	名詞
じかいせっかいかじょうひしゅ	耳介石灰化上皮腫	ime	名詞
じかいせっそう	耳介切創	ime	名詞
じかいぜんぶ	耳介前部	mac	名詞
じかいぜんぶしゅちょう	耳介前部腫脹	ime	名詞
じかいそうしょう	耳介創傷	ime	名詞
じかいそくとうしんけい	耳介側頭神経	mac	名詞
じかいそくとうしんけいぶろっく	耳介側頭神経ブロック	ime	名詞
じかいたいじょうへるぺす	耳介帯状ヘルペス	ime	名詞
じかいだぼくしょう	耳介打撲傷	ime	名詞
じかいちゅうししょう	耳介虫刺傷	ime	名詞
じかいていい	耳介低位	both	名詞
じかいなんこつまくえん	耳介軟骨膜炎	both	名詞
じかいのうしゅ	耳介嚢腫	ime	名詞
じかいのうよう	耳介膿瘍	ime	名詞
じかいひかけっしゅ	耳介皮下血腫	ime	名詞
じかいひかしゅっけつ	耳介皮下出血	ime	名詞
じかいぶしゅよう	耳介部腫瘍	ime	名詞
じかいぶしゅりゅう	耳介部腫瘤	ime	名詞
じかいぶだい	耳介部第	ime	名詞
じかいぶだい1どねっしょう	耳介部第1度熱傷	ime	名詞
じかいぶだい2どねっしょう	耳介部第2度熱傷	ime	名詞
じかいぶだい3どねっしょう	耳介部第3度熱傷	ime	名詞
じかいぶだいいちどねっしょう	耳介部第1度熱傷	ime	名詞
じかいぶだいさんどねっしょう	耳介部第3度熱傷	ime	名詞
じかいぶだいにどねっしょう	耳介部第2度熱傷	ime	名詞
じかいぶひふえん	耳介部皮膚炎	ime	名詞
じかいほうかしきえん	耳介蜂窩織炎	ime	名詞
じかいほうそうえん	耳介蜂巣炎	ime	名詞
じかいぼはんさいぼうぼはん	耳介母斑細胞母斑	ime	名詞
じかいぼーえんびょう	耳介ボーエン病	ime	名詞
じかいみみしゅういしっしん	耳介耳周囲湿疹	ime	名詞
じかいめるけるさいぼうがん	耳介メルケル細胞癌	ime	名詞
じかいれっそう	耳介裂創	ime	名詞
じかいろう	耳介瘻	ime	名詞
じかいろうこう	耳介瘻孔	ime	名詞
じかういるす	ジカウイルス	ime	名詞
じかかんさせい	自家感作性	mac	名詞
じかかんさせいひふえん	自家感作性皮膚炎	both	名詞
じかかんせん	自家感染	mac	名詞
じかく	痔核	ime	名詞
じかくかんとん	痔核嵌頓	ime	名詞
じかくかんとんせいふくほう	痔核嵌頓整復法	ime	名詞
じかくしゅじゅつ	痔核手術	ime	名詞
じかくしゅじゅつごきょうさくかくち	痔核手術後狭窄拡張手術	ime	名詞
じかくだっこう	痔核脱肛	ime	名詞
じかくてきしかくしょうがい	自覚的視覚障害	ime	名詞
じかくてきじめい	自覚的耳鳴	both	名詞
じかけっせい	自家血清	ime	名詞
じかさいけつゆけつ	自家採血輸血	ime	名詞
じかしゅよう	耳下腫瘍	ime	名詞
じかせい	自家性	ime	名詞
じかせいぞう	自家製造	ime	名詞
じかせん	耳下腺	ime	名詞
じかせんあくせいしゅよう	耳下腺悪性腫瘍	ime	名詞
じかせんあくせいしゅようしゅじゅつ	耳下腺悪性腫瘍手術	ime	名詞
じかせんあくせいしんせいぶつ	耳下腺悪性新生物	ime	名詞
じかせんいしゅく	耳下腺萎縮	ime	名詞
じかせんいぶつ	耳下腺異物	ime	名詞
じかせんえん	耳下腺炎	ime	名詞
じかせんえんせいこうがんえん	耳下腺炎性睾丸炎	ime	名詞
じかせんえんせいせいそうえん	耳下腺炎性精巣炎	ime	名詞
じかせんかん	耳下腺管	mac	名詞
じかせんかんえん	耳下腺管炎	ime	名詞
じかせんがん	耳下腺癌	ime	名詞
じかせんけっかんしゅ	耳下腺血管腫	ime	名詞
じかせんこんごうしゅよう	耳下腺混合腫瘍	ime	名詞
じかせんしゅちょう	耳下腺腫脹	both	名詞
じかせんしゅよう	耳下腺腫瘍	ime	名詞
じかせんしゅようてきしゅつじゅつ	耳下腺腫瘍摘出術	ime	名詞
じかせんしゅりゅう	耳下腺腫瘤	ime	名詞
じかせんたけいせんしゅ	耳下腺多形腺腫	ime	名詞
じかせんだせきしょう	耳下腺唾石症	ime	名詞
じかせんにゅうとう	耳下腺乳頭	mac	名詞
じかせんのうほう	耳下腺嚢胞	ime	名詞
じかせんのうよう	耳下腺膿瘍	ime	名詞
じかせんひだい	耳下腺肥大	ime	名詞
じかせんぶだぼく	耳下腺部打撲	ime	名詞
じかせんりょうせいしゅよう	耳下腺良性腫瘍	ime	名詞
じかせんろう	耳下腺瘻	ime	名詞
じかちゅうどく	自家中毒	ime	名詞
じかてきこうのうまくがいのうようせっ	耳科的硬脳膜外膿瘍切開術	ime	名詞
じかばいようひょうひ	自家培養表皮	mac	名詞
じかぶつう	耳下部痛	ime	名詞
じかぶにくしゅ	耳下部肉腫	ime	名詞
じかまっしょうけつかんさいぼういしょくご	自家末梢血幹細胞移植後	ime	名詞
じかゆうかい	自家融解	mac	名詞
じかゆうりふくごうそしきいしょくじ	自家遊離複合組織移植術（顕微鏡下血管柄付き）	ime	名詞
じかようえき	耳科用液	ime	名詞
じかん	時間	mac	名詞
じかん	耳管	both	名詞
じかんあくせいしゅよう	耳管悪性腫瘍	ime	名詞
じかんあっぱく	耳管圧迫	ime	名詞
じかんいぞんせいやくぶつ	時間依存性薬物	mac	名詞
じかんいんとうきん	耳管咽頭筋	mac	名詞
じかんいんとうこう	耳管咽頭口	mac	名詞
じかんいんとうひだ	耳管咽頭ヒダ	mac	名詞
じかんえん	耳管炎	ime	名詞
じかんかいこうぶ	耳管開口部	mac	名詞
じかんかいほう	耳管開放	ime	名詞
じかんかいほうしょう	耳管開放症	ime	名詞
じかんかたる	耳管カタル	ime	名詞
じかんがん	耳管癌	ime	名詞
じかんきのう	耳管機能	ime	名詞
じかんきのうけんさ	耳管機能検査	mac	名詞
じかんきのうていか	耳管機能低下	ime	名詞
じかんきのうふぜん	耳管機能不全	ime	名詞
じかんきょうさく	耳管狭窄	ime	名詞
じかんきょうさくしょう	耳管狭窄症	both	名詞
じかんきょうさくびにーるかんそうにゅ	耳管狭窄ビニール管挿入	ime	名詞
じかんけっかく	耳管結核	ime	名詞
じかんけっそん	耳管欠損	ime	名詞
じかんこうがいひだ	耳管口蓋ヒダ	mac	名詞
じかんこしつえん	耳管鼓室炎	ime	名詞
じかんしょち	耳管処置	ime	名詞
じかんせんしんけいそう	耳下腺神経叢	mac	名詞
じかんつうき	耳管通気	mac	名詞
じかんてきかじゅう	時間的加重	mac	名詞
じかんない	耳管内	ime	名詞
じかんないちゅーぶそうにゅうじゅつ	耳管内チューブ挿入術	ime	名詞
じかんないやくえきふんむ	耳管内薬液噴霧	ime	名詞
じかんなんこつ	耳管軟骨	mac	名詞
じかんぶじーほう	耳管ブジー法	ime	名詞
じかんへいそくしょう	耳管閉塞症	ime	名詞
じかんへんとう	耳管扁桃	mac	名詞
じかんりゅうき	耳管隆起	mac	名詞
じがいしき	自我意識	mac	名詞
じがいわてきせい	自我異和的性	ime	名詞
じがいわてきせいのほうこうづけ	自我異和的性の方向づけ	ime	名詞
じがしょうがい	自我障害	mac	名詞
じがためりょうほう	地固め療法	mac	名詞
じがどういつせい	自我同一性	mac	名詞
じきおーじお	自記オージオ	both	名詞
じきおーじおぐらむ	自記オージオグラム	mac	名詞
じきおーじおめとりー	自記オージオメトリー	both	名詞
じきしき	自記式	mac	名詞
じきによるぼうこうとうしげきほう	磁気による膀胱等刺激法	ime	名詞
じきゅうせいりゅうきせいこうはん	持久性隆起性紅斑	ime	名詞
じきょう	耳鏡	mac	名詞
じきょうけんさ	耳鏡検査	mac	名詞
じきょうけんさほう	耳鏡検査法	mac	名詞
じきりおんしろっぷ	ジキリオンシロップ	ime	名詞
じぎたりすちゅうどく	ジギタリス中毒	ime	名詞
じぎときしん	ジギトキシン	mac	名詞
じぎらのげん	ジギラノゲン	mac	名詞
じくこっかく	軸骨格	mac	名詞
じくごせい	軸後性	mac	名詞
じくさく	軸索	mac	名詞
じくさくしゅういのうえん	軸索周囲脳炎	ime	名詞
じくさくしゅうまつ	軸索終末	mac	名詞
じくさくはんしゃ	軸索反射	mac	名詞
じくさくまったん	軸索末端	mac	名詞
じくせいえんし	軸性遠視	mac	名詞
じくせいきんし	軸性近視	both	名詞
じくせいししんけいえん	軸性視神経炎	ime	名詞
じくぜんせい	軸前性	mac	名詞
じくつい	軸椎	both	名詞
じくついおうとっきこっせつ	軸椎横突起骨折	ime	名詞
じくついかいほうこっせつ	軸椎開放骨折	ime	名詞
じくついこっせつ	軸椎骨折	ime	名詞
じくついしとっきこうほうぎしゅよう	軸椎歯突起後方偽腫瘍	ime	名詞
じくついせきさくしゅ	軸椎脊索腫	ime	名詞
じくついついきゅうこっせつ	軸椎椎弓骨折	ime	名詞
じくついついたいこっせつ	軸椎椎体骨折	ime	名詞
じくついはれつこっせつ	軸椎破裂骨折	ime	名詞
じくねんてん	軸捻転	mac	名詞
じくねんてんへるにあ	軸捻転ヘルニア	ime	名詞
じくろすたーてんがんえき	ジクロスター点眼液	ime	名詞
じくろすたーぴーえふてんがんえき	ジクロスターPF点眼液	ime	名詞
じくろふぇなく	ジクロフェナク	ime	名詞
じくろふぇなくNAてんがんえき	ジクロフェナクNa点眼液	ime	名詞
じくろふぇなくえぬえーてーぷ	ジクロフェナクNaテープ	ime	名詞
じくろふぇなくえぬえーろーしょん	ジクロフェナクNaローション	ime	名詞
じくろふぇなくなとりうむ	ジクロフェナクナトリウム	ime	名詞
じくろふぇなくなとりうむざざい	ジクロフェナクナトリウム坐剤	ime	名詞
じくろふぇなっくてんがんえき	ジクロフェナック点眼液	ime	名詞
じくろろ	ジクロロ	mac	名詞
じくろろぷろぱん	ジクロロプロパン	mac	名詞
じくろろめたん	ジクロロメタン	mac	名詞
じくろろめたんちゅうどく	ジクロロメタン中毒	ime	名詞
じくろーどてんがんえき	ジクロード点眼液	ime	名詞
じぐわっと	ジグワット	mac	名詞
じけいこつばん	児型骨盤	ime	名詞
じけいこつばんによるぶんべんていし	児型骨盤による分娩停止	ime	名詞
じけっかく	耳結核	ime	名詞
じげんせい	自原性	mac	名詞
じげんせいよくせい	自原性抑制	mac	名詞
じこあいせいぱーそなりてぃしょうがい	自己愛性パーソナリティ障害	mac	名詞
じこうかい	耳甲介	mac	名詞
じこうかしょう	耳硬化症	both	名詞
じこうがいししょうこうぐん	耳・口蓋・指症候群	ime	名詞
じこうし	自絞死	mac	名詞
じこうしょう	耳垢症	ime	名詞
じこうしょう	自咬症	mac	名詞
じこうせん	耳垢栓	ime	名詞
じこうせん	耳垢腺	mac	名詞
じこうせんそく	耳垢栓塞	both	名詞
じこうせんそくしょう	耳垢栓塞症	ime	名詞
じこうせんそくじょきょ	耳垢栓塞除去	ime	名詞
じこうそくせん	耳垢塞栓	mac	名詞
じこうぶ	耳後部	ime	名詞
じこうぶたんどく	耳後部丹毒	ime	名詞
じこかんよう	自己寛容	mac	名詞
じこくひょうてきこうどう	時刻表的行動	mac	名詞
じこけつ	自己血	mac	名詞
じこけつちょけつ	自己血貯血	both	名詞
じこけつぱっち	自己血パッチ	ime	名詞
じこけつゆけつ	自己血輸血	ime	名詞
じこけつゆけつにともなう	自己血輸血に伴う	ime	名詞
じここうたい	自己抗体	mac	名詞
じこしせんきょうふ	自己視線恐怖	ime	名詞
じこしゅうきょうふ	自己臭恐怖	ime	名詞
じこせっけっきゅうかんさしょうこうぐん	自己赤血球感作症候群	ime	名詞
じこだたい	自己堕胎	mac	名詞
じこちゅう	自己注	mac	名詞
じこちゅうしゃ	自己注射	both	名詞
じこちょうせい	自己調整	mac	名詞
じこちょうせいのう	自己調整能	mac	名詞
じこっぴ	ジコッピ	ime	名詞
じことひじこ	自己と非自己	mac	名詞
じことれらんす	自己トレランス	mac	名詞
じこどんしょくくうほうせいみおぱちー	自己貪食空胞性ミオパチー	ime	名詞
じこふくせいのう	自己複製能	mac	名詞
じこぶんぴ	自己分泌	mac	名詞
じこめんえき	自己免疫	mac	名詞
じこめんえきかんれんけっきゅうどんしょくしょうこうぐん	自己免疫関連血球貪食症候群	ime	名詞
じこめんえきしっかん	自己免疫疾患	mac	名詞
じこめんえきせい	自己免疫性	both	名詞
じこめんえきせいかんえん	自己免疫性肝炎	both	名詞
じこめんえきせいかんこうへん	自己免疫性肝硬変	ime	名詞
じこめんえきせいこうじょうせんえん	自己免疫性甲状腺炎	ime	名詞
じこめんえきせいこうちゅうきゅうげんしょうしょう	自己免疫性好中球減少症	ime	名詞
じこめんえきせいしゅっけつびょうXIII	自己免疫性出血病XIII	ime	名詞
じこめんえきせいしんまくえん	自己免疫性心膜炎	ime	名詞
じこめんえきせいじんましん	自己免疫性じんま疹	ime	名詞
じこめんえきせいすいえん	自己免疫性膵炎	both	名詞
じこめんえきせいたせんせいないぶんぴふぜんしょう	自己免疫性多腺性内分泌不全症	ime	名詞
じこめんえきせいたんかんえん	自己免疫性胆管炎	ime	名詞
じこめんえきせいのうしょう	自己免疫性脳症	ime	名詞
じこめんえきせいふくじんえん	自己免疫性副腎炎	ime	名詞
じこめんえきせいようけつせいひんけつ	自己免疫性溶血性貧血	both	名詞
じこゆうかい	自己融解	mac	名詞
じこゆうかいでぶりどまん	自己融解デブリドマン	mac	名詞
じこゆうはつせい	自己誘発性	mac	名詞
じこゆうはつせいおうと	自己誘発性嘔吐	mac	名詞
じこようけつ	自己溶血	ime	名詞
じごきしん	ジゴキシン	mac	名詞
じごしんえりきしる	ジゴシンエリキシル	both	名詞
じごしんさん	ジゴシン散	ime	名詞
じごろうこうへいさじゅつ	耳後瘻孔閉鎖術	ime	名詞
じさいくろみんすいさんかあるみにうむはいごうざい	ジサイクロミン・水酸化アルミニウム配合剤	ime	名詞
じさつ	自殺	ime	名詞
じさつきと	自殺企図	mac	名詞
じさつけいこう	自殺傾向	ime	名詞
じさつこういしょう	自殺後遺症	ime	名詞
