ざい	坐位	mac	名詞
ぜんがくぶだい3どねっしょう	前額部第3度熱傷	ime	名詞
ぜんがくぶだいいちどねっしょう	前額部第1度熱傷	ime	名詞
ぜんがくぶだいさんどねっしょう	前額部第3度熱傷	ime	名詞
ぜんがくぶだいにどねっしょう	前額部第2度熱傷	ime	名詞
ぜんがくぶだぼくざしょう	前額部打撲挫傷	ime	名詞
ぜんがくぶだぼくしょう	前額部打撲傷	ime	名詞
ぜんがくぶちゅうししょう	前額部虫刺傷	ime	名詞
ぜんがくぶちゅうししょう	前額部虫刺症	ime	名詞
ぜんがくぶのうよう	前額部膿瘍	ime	名詞
ぜんがくぶひかけっしゅ	前額部皮下血腫	ime	名詞
ぜんがくぶひかしゅっけつ	前額部皮下出血	ime	名詞
ぜんがくぶひふがん	前額部皮膚癌	ime	名詞
ぜんがくぶひふけっそんそう	前額部皮膚欠損創	ime	名詞
ぜんがくぶへんぺいぼはん	前額部扁平母斑	ime	名詞
ぜんがくぶぼはん	前額部母斑	ime	名詞
ぜんがくぶぼはんさいぼうぼはん	前額部母斑細胞母斑	ime	名詞
ぜんがくぶぼーえんびょう	前額部ボーエン病	ime	名詞
ぜんがくぶめるけるさいぼうがん	前額部メルケル細胞癌	ime	名詞
ぜんがくぶゆうきょくさいぼうがん	前額部有棘細胞癌	ime	名詞
ぜんがくぶれっそう	前額部裂創	ime	名詞
ぜんがくめん	前額面	mac	名詞
ぜんがんきゅうえん	全眼球炎	both	名詞
ぜんがんじょうたい	前癌状態	mac	名詞
ぜんがんびょうへん	前癌病変	mac	名詞
ぜんがんぶ	前眼部	both	名詞
ぜんがんぶのせんてんきけい	前眼部の先天奇形	ime	名詞
ぜんがんぼう	前眼房	mac	名詞
ぜんき	前期	ime	名詞
ぜんきはすい	前期破水	both	名詞
ぜんきはすいてんちりょうによるぶんべんせんえん	前期破水・治療による分娩遷延	ime	名詞
ぜんきはすいによるしんせいじのしょうがい	前期破水による新生児の障害	ime	名詞
ぜんきはすいによるたいじのしょうがい	前期破水による胎児の障害	ime	名詞
ぜんきはすいによるようすいかしょうしょう	前期破水による羊水過少症	ime	名詞
ぜんきゃく	前脚	mac	名詞
ぜんきゅう	前弓	mac	名詞
ぜんきゅうしぶ	前臼歯部	ime	名詞
ぜんきゅうせい	全球性	mac	名詞
ぜんきょうぶ	前胸部	both	名詞
ぜんきょうぶあくせいこくしょくしゅ	前胸部悪性黒色腫	ime	名詞
ぜんきょうぶあっぱくかん	前胸部圧迫感	mac	名詞
ぜんきょうぶいわかん	前胸部異和感	ime	名詞
ぜんきょうぶきていさいぼうがん	前胸部基底細胞癌	ime	名詞
ぜんきょうぶきんきんまくえん	前胸部筋筋膜炎	ime	名詞
ぜんきょうぶきんにくつう	前胸部筋肉痛	ime	名詞
ぜんきょうぶけっかんしゅ	前胸部血管腫	ime	名詞
ぜんきょうぶさっかしょう	前胸部擦過傷	ime	名詞
ぜんきょうぶさっかそう	前胸部擦過創	ime	名詞
ぜんきょうぶざしょう	前胸部挫傷	ime	名詞
ぜんきょうぶざそう	前胸部挫創	ime	名詞
ぜんきょうぶしゅちょう	前胸部腫脹	ime	名詞
ぜんきょうぶしゅりゅう	前胸部腫瘤	ime	名詞
ぜんきょうぶだい	前胸部第	ime	名詞
ぜんきょうぶだい1どねっしょう	前胸部第1度熱傷	ime	名詞
ぜんきょうぶだい2どねっしょう	前胸部第2度熱傷	ime	名詞
ぜんきょうぶだい3どねっしょう	前胸部第3度熱傷	ime	名詞
ぜんきょうぶだいいちどねっしょう	前胸部第1度熱傷	ime	名詞
ぜんきょうぶだいさんどねっしょう	前胸部第3度熱傷	ime	名詞
ぜんきょうぶだいにどねっしょう	前胸部第2度熱傷	ime	名詞
ぜんきょうぶだぼくしょう	前胸部打撲傷	ime	名詞
ぜんきょうぶつう	前胸部痛	both	名詞
ぜんきょうぶねっしょう	前胸部熱傷	ime	名詞
ぜんきょうぶのうよう	前胸部膿瘍	ime	名詞
ぜんきょうぶひふがん	前胸部皮膚癌	ime	名詞
ぜんきょうぶぼーえんびょう	前胸部ボーエン病	ime	名詞
ぜんきょうぶまさつおん	前胸部摩擦音	ime	名詞
ぜんきょうぶゆうきょくさいぼうがん	前胸部有棘細胞癌	ime	名詞
ぜんきょうぶりんぱかんしゅ	前胸部リンパ管腫	ime	名詞
ぜんきょうへきつう	前胸壁痛	ime	名詞
ぜんきょきん	前鋸筋	mac	名詞
ぜんきょくはくないしょう	前極白内障	ime	名詞
ぜんきょひじんたい	前距腓靱帯	ime	名詞
ぜんきん	前筋	mac	名詞
ぜんく	前区	mac	名詞
ぜんくき	前駆期	mac	名詞
ぜんくきせいしんぶんれつびょう	前駆期精神分裂病	ime	名詞
ぜんくきとうごうしっちょうしょう	前駆期統合失調症	ime	名詞
ぜんくさいぼう	前駆細胞	mac	名詞
ぜんくじんつう	前駆陣痛	mac	名詞
ぜんくつい	前屈位	mac	名詞
ぜんくびょうへん	前駆病変	mac	名詞
ぜんけい	漸傾	mac	名詞
ぜんけいこつきん	前脛骨筋	both	名詞
ぜんけいこつきんそんしょう	前脛骨筋損傷	ime	名詞
ぜんけいこつじょうみゃく	前脛骨静脈	mac	名詞
ぜんけいこつどうみゃく	前脛骨動脈	both	名詞
ぜんけいこつどうみゃくそんしょう	前脛骨動脈損傷	ime	名詞
ぜんけいこつねんえきすいしゅ	前脛骨粘液水腫	both	名詞
ぜんけいじょうみゃく	前頚静脈	mac	名詞
ぜんけいぜんくつ	前傾前屈	mac	名詞
ぜんけいとうちょうぶざそう	前頚頭頂部挫創	ime	名詞
ぜんけいひじんたいそんしょう	前脛腓靱帯損傷	ime	名詞
ぜんけいぶさっかしょう	前頚部擦過傷	ime	名詞
ぜんけいぶさっかそう	前頚部擦過創	ime	名詞
ぜんけいぶざしょう	前頚部挫傷	ime	名詞
ぜんけいぶしんけいつう	前頚部神経痛	ime	名詞
ぜんけいぶひかいぶつ	全頚部皮下異物	ime	名詞
ぜんけっきゅうすうさんてい	全血球数算定	mac	名詞
ぜんけっせつ	前結節	mac	名詞
ぜんけっちょうむしんけいせつしょう	全結腸無神経節症	ime	名詞
ぜんけつ	全血	mac	名詞
ぜんけつぎょうこようかいじかん	全血凝固溶解時間	ime	名詞
ぜんけんぼう	全健忘	mac	名詞
ぜんげつさんてい	前月算定	ime	名詞
ぜんこ	ゼンコ	ime	名詞
ぜんこうくうほう	全口腔法	mac	名詞
ぜんこうけんぼう	前向健忘	mac	名詞
ぜんこうせい	前向性	mac	名詞
ぜんこうせいけんぼう	前向性健忘	ime	名詞
ぜんこうつうどうみゃく	前交通動脈	both	名詞
ぜんこうつうどうみゃくからのくもまくかしゅっけつ	前交通動脈からのくも膜下出血	ime	名詞
ぜんこうつうどうみゃくへいそくしょう	前交通動脈閉塞症	ime	名詞
ぜんこうつうどうみゃくりゅう	前交通動脈瘤	ime	名詞
ぜんこうつうどうみゃくりゅうはれつによるくもまくかしゅ	前交通動脈瘤破裂によるくも膜下出血	ime	名詞
ぜんこうれん	前交連	mac	名詞
ぜんこかんせつしょう	前股関節症	ime	名詞
ぜんこかんせつつう	前股関節痛	ime	名詞
ぜんこっかんしんけい	前骨間神経	mac	名詞
ぜんこっかんじょうみゃく	前骨間静脈	mac	名詞
ぜんこっかんどうみゃく	前骨間動脈	mac	名詞
ぜんこつかんしんけいまひ	前骨間神経麻痺	ime	名詞
ぜんこつがさいぼう	前骨芽細胞	mac	名詞
ぜんこつずいがきゅう	前骨髄芽球	mac	名詞
ぜんこつずいがきゅうせい	前骨髄芽球性	mac	名詞
ぜんこつずいきゅう	前骨髄球	mac	名詞
ぜんこん	前根	mac	名詞
ぜんごけい	前後径	mac	名詞
ぜんごじゅうじじんたいそんしょう	前後十字靱帯損傷	ime	名詞
ぜんごぞう	前後像	mac	名詞
ぜんさく	前索	mac	名詞
ぜんし	全指	ime	名詞
ぜんし	全趾	ime	名詞
ぜんし	前枝	mac	名詞
ぜんしきもう	全色盲	ime	名詞
ぜんしきゅうだつ	全子宮脱	ime	名詞
ぜんしきゅうないはんしょう	全子宮内反症	ime	名詞
ぜんしこつ	全指骨	ime	名詞
ぜんしこつしんけい	前篩骨神経	mac	名詞
ぜんししゅんきせいししゅうえん	前思春期性歯周炎	ime	名詞
ぜんししょうかぶいき	前視床下部域	mac	名詞
ぜんしつかんこう	前室間孔	mac	名詞
ぜんしつご	全失語	ime	名詞
ぜんしつごしょう	全失語症	ime	名詞
ぜんしとこうし	前枝と後枝	mac	名詞
ぜんしぶ	前歯部	ime	名詞
ぜんしぶかいこう	前歯部開咬	ime	名詞
ぜんしぶかいこうしょう	前歯部開咬症	ime	名詞
ぜんしぶこうさこうごう	前歯部交叉咬合	ime	名詞
ぜんしぶはんたいこうごう	前歯部反対咬合	ime	名詞
ぜんしぶろっく	前枝ブロック	ime	名詞
ぜんしゃかくきん	前斜角筋	mac	名詞
ぜんしゃかくきんしょうこうぐん	前斜角筋症候群	ime	名詞
ぜんしゅう	全周	mac	名詞
ぜんしゅうしゅくきぎゃくりゅうせいざつおん	全収縮期逆流性雑音	mac	名詞
ぜんしゅうしゅくきざつおん	全収縮期雑音	ime	名詞
ぜんしゅうせい	全周性	mac	名詞
ぜんしゅうせいきょうさく	全周性狭窄	mac	名詞
ぜんしゅうまつさいきかんし	前終末細気管支	mac	名詞
ぜんしゅどうみゃく	前主動脈	mac	名詞
ぜんしゅはあく	全手把握	mac	名詞
ぜんしょうとっき	前床突起	mac	名詞
ぜんしん	全身	ime	名詞
ぜんしんいわかん	全身違和感	ime	名詞
ぜんしんえりてまとーですのちほう	全身エリテマトーデスの痴呆	ime	名詞
ぜんしんおんねつはっかんしけん	全身温熱発汗試験	ime	名詞
ぜんしんかしょう	全身火傷	ime	名詞
ぜんしんかそう	全身火創	ime	名詞
ぜんしんかんせん	全身感染	mac	名詞
ぜんしんがた	全身型	mac	名詞
ぜんしんがたうぇじなーにくげしゅしょう	全身型ウェジナー肉芽腫症	ime	名詞
ぜんしんがたじゃくねんせいとくはつせいかんせつえん	全身型若年性特発性関節炎	ime	名詞
ぜんしんがたじゅうしょうきんむりょくしょう	全身型重症筋無力症	ime	名詞
ぜんしんくりあらんす	全身クリアランス	mac	名詞
ぜんしんけいこう	前神経孔	mac	名詞
ぜんしんけいれん	全身痙攣	both	名詞
ぜんしんけいれんほっさ	全身痙攣発作	ime	名詞
ぜんしんけっかんていこう	全身血管抵抗	mac	名詞
ぜんしんけつごうそしきえん	全身結合組織炎	ime	名詞
ぜんしんけんたいかん	全身倦怠感	ime	名詞
ぜんしんこむらがえりびょう	全身こむらがえり病	ime	名詞
ぜんしんさっかしょう	全身擦過傷	ime	名詞
ぜんしんさっかそう	全身擦過創	ime	名詞
ぜんしんざしょう	全身挫傷	ime	名詞
ぜんしんしっかん	全身疾患	mac	名詞
ぜんしんしっしん	全身湿疹	ime	名詞
ぜんしんしっせいしっしん	全身湿性湿疹	ime	名詞
ぜんしんしょうしゃ	全身照射	ime	名詞
ぜんしんじょうたい	全身状態	mac	名詞
ぜんしんせい	全身性	ime	名詞
ぜんしんせいあくちのばちるすしょう	全身性アクチノバチルス症	ime	名詞
ぜんしんせいあみろいどーしす	全身性アミロイドーシス	both	名詞
ぜんしんせいあれるぎーせいひふえん	全身性アレルギー性皮膚炎	ime	名詞
ぜんしんせいえいようしょうがいしょう	全身性栄養障害症	ime	名詞
ぜんしんせいえりてまとーです	全身性エリテマトーデス	both	名詞
ぜんしんせいえりてまとーですせいこきゅうきしょうがい	全身性エリテマトーデス性呼吸器障害	ime	名詞
ぜんしんせいえりてまとーですせいしんびょう	全身性エリテマトーデス精神病	ime	名詞
ぜんしんせいえりてまとーですせいしんまくえん	全身性エリテマトーデス性心膜炎	ime	名詞
ぜんしんせいえりてまとーですせいのうどうみゃくえん	全身性エリテマトーデス性脳動脈炎	ime	名詞
ぜんしんせいえりてまとーですせいみおぱちー	全身性エリテマトーデス性ミオパチー	ime	名詞
ぜんしんせいえりてまとーですせきずいえん	全身性エリテマトーデス脊髄炎	ime	名詞
ぜんしんせいえりてまとーですのうえん	全身性エリテマトーデス脳炎	ime	名詞
ぜんしんせいえりてまとーですのうせきずいえん	全身性エリテマトーデス脳脊髄炎	ime	名詞
ぜんしんせいえんしょうはんのうしょうこうぐん	全身性炎症反応症候群	both	名詞
ぜんしんせいかんじだしょう	全身性カンジダ症	ime	名詞
ぜんしんせいきょうひしょう	全身性強皮症	both	名詞
ぜんしんせいきょうひしょうせいこきゅうきしょうがい	全身性強皮症性呼吸器障害	ime	名詞
ぜんしんせいきんいしゅく	全身性筋萎縮	ime	名詞
ぜんしんせいきんいしゅくしょう	全身性筋萎縮症	ime	名詞
ぜんしんせいきんむりょくしょう	全身性筋無力症	ime	名詞
ぜんしんせいこうかしょう	全身性硬化症	both	名詞
ぜんしんせいこうかしょうせいこきゅうきしょうがい	全身性硬化症性呼吸器障害	ime	名詞
ぜんしんせいこうはんせいろうそう	全身性紅斑性狼瘡	ime	名詞
ぜんしんせいしはんびょう	全身性紫斑病	ime	名詞
ぜんしんせいしぼういえいよう	全身性脂肪異栄養	ime	名詞
ぜんしんせいしぼういえいようしょう	全身性脂肪異栄養症	ime	名詞
ぜんしんせいしんこうせいきょうひしょう	全身性進行性強皮症	ime	名詞
ぜんしんせいしんこうせいこうかしょう	全身性進行性硬化症	ime	名詞
ぜんしんせいしんこうせいこうひしょう	全身性進行性硬皮症	ime	名詞
ぜんしんせいしんたいしょうもう	全身性身体消耗	ime	名詞
ぜんしんせいじこめんえきしっかん	全身性自己免疫疾患	ime	名詞
ぜんしんせいたかんしょう	全身性多汗症	ime	名詞
ぜんしんせいだつもうしょう	全身性脱毛症	ime	名詞
ぜんしんせいてんいせいがん	全身性転移性癌	ime	名詞
ぜんしんせいはっかんかたしょう	全身性発汗過多症	ime	名詞
ぜんしんせいひまん	全身性肥満	mac	名詞
ぜんしんせいふしゅ	全身性浮腫	ime	名詞
ぜんしんせいへいそくせいけっせんけっかんえん	全身性閉塞性血栓血管炎	ime	名詞
ぜんしんせいへもふぃるすえじぷちうすかんせんしょう	全身性ヘモフィルスエジプチウス感染症	ime	名詞
ぜんしんせいへんけいせいかんせつしょう	全身性変形性関節症	ime	名詞
ぜんしんせいほっしん	全身性発疹	ime	名詞
ぜんしんせいやとびょう	全身性野兎病	ime	名詞
ぜんしんせいりんぱせつしゅだい	全身性リンパ節腫大	ime	名詞
ぜんしんせいりんぱせつしゅちょう	全身性リンパ節腫脹	ime	名詞
ぜんしんせっしょくせいひふえん	全身接触性皮膚炎	ime	名詞
ぜんしんそうようかん	全身そう痒感	ime	名詞
ぜんしんそうようしょう	全身そう痒症	ime	名詞
ぜんしんぞうき	全身臓器	mac	名詞
ぜんしんだい	全身第	ime	名詞
ぜんしんだい1どねっしょう	全身第1度熱傷	ime	名詞
ぜんしんだい2どねっしょう	全身第2度熱傷	ime	名詞
ぜんしんだい3どねっしょう	全身第3度熱傷	ime	名詞
ぜんしんだいいちどねっしょう	全身第1度熱傷	ime	名詞
ぜんしんだいさんどねっしょう	全身第3度熱傷	ime	名詞
ぜんしんだいにどねっしょう	全身第2度熱傷	ime	名詞
ぜんしんだぼく	全身打撲	ime	名詞
ぜんしんちゅうどくしょう	全身中毒症	ime	名詞
ぜんしんつう	全身痛	ime	名詞
ぜんしんてきげんいんによるはのだつらく	全身的原因による歯の脱落	ime	名詞
ぜんしんてきせいかつはんのう	全身的生活反応	mac	名詞
ぜんしんでんせんせいのうかしん	全身伝染性膿痂疹	ime	名詞
ぜんしんとうよ	全身投与	mac	名詞
ぜんしんねっしょう	全身熱傷	ime	名詞
ぜんしんのうかしんせいしっしん	全身膿痂疹性湿疹	ime	名詞
ぜんしんのしびれかん	全身のしびれ感	ime	名詞
ぜんしんのじんじょうせいかんせん	全身の尋常性乾癬	ime	名詞
ぜんしんはくせん	全身白癬	ime	名詞
ぜんしんひふそうようしょう	全身皮膚そう痒症	ime	名詞
ぜんしんひべん	前進皮弁	mac	名詞
ぜんしんびしょうてんい	全身微小転移	mac	名詞
ぜんしんほっしん	全身発疹	ime	名詞
ぜんしんますい	全身麻酔	mac	名詞
ぜんしんまっしょうしんけいしょう	全身末梢神経症	ime	名詞
ぜんしんもうこうせいこうしょくひこうしん	全身毛孔性紅色粃糠疹	ime	名詞
ぜんしんやくしん	全身薬疹	ime	名詞
ぜんじゅうかく	前縦隔	ime	名詞
ぜんじゅうかくあくせいしゅよう	前縦隔悪性腫瘍	ime	名詞
ぜんじゅうかくしゅよう	前縦隔腫瘍	ime	名詞
ぜんじゅうかくどう	前縦隔洞	ime	名詞
ぜんじゅうかくのあくせいしゅよう	前縦隔の悪性腫瘍	ime	名詞
ぜんじゅうじじんたい	前十字靱帯	both	名詞
ぜんじゅうじじんたいそんしょう	前十字靱帯損傷	both	名詞
ぜんじゅうじじんたいだんれつ	前十字靱帯断裂	ime	名詞
ぜんじゅうじじんたいふちゃくぶはくりこっせつ	前十字靱帯付着部剥離骨折	ime	名詞
ぜんじゅうじんたい	前縦靱帯	mac	名詞
ぜんじゅうじんたいこつかしょう	前縦靱帯骨化症	ime	名詞
ぜんじょうしそうしんけい	前上歯槽神経	mac	名詞
ぜんじょうみゃくますい	全静脈麻酔	mac	名詞
ぜんじん	前腎	mac	名詞
ぜんじんこうかんせつちかんじゅつ	全人工関節置換術	mac	名詞
ぜんじんこうひざかんせつちかんじゅつ	全人工膝関節置換術	mac	名詞
ぜんじんつう	前陣痛	ime	名詞
ぜんじんてき	全人的	mac	名詞
ぜんじんてきくつう	全人的苦痛	mac	名詞
ぜんすうはあくしっかん	全数把握疾患	mac	名詞
ぜんせいかつし	全生活史	mac	名詞
ぜんせいぞん	全生存	mac	名詞
ぜんせいちゅうれつ	前正中裂	mac	名詞
ぜんせいねんき	前青年期	mac	名詞
ぜんせきずい	全脊髄	mac	名詞
ぜんせきずいししょうろ	前脊髄視床路	mac	名詞
ぜんせきずいしょうのうろ	前脊髄小脳路	mac	名詞
ぜんせきずいどうみゃく	前脊髄動脈	mac	名詞
ぜんせきずいどうみゃくあっぱくしょうこうぐん	前脊髄動脈圧迫症候群	ime	名詞
ぜんせきずいどうみゃくけっせんしょう	前脊髄動脈血栓症	ime	名詞
ぜんせきずいどうみゃくしょうこうぐん	前脊髄動脈症候群	both	名詞
ぜんせきついこてい	全脊椎固定	mac	名詞
ぜんせきついますい	全脊椎麻酔	mac	名詞
ぜんせきついれつ	全脊椎裂	ime	名詞
ぜんせつせい	全節性	mac	名詞
ぜんせん	前尖	mac	名詞
ぜんせんこつこう	前仙骨孔	mac	名詞
ぜんせんちょうじんたい	前仙腸靱帯	mac	名詞
ぜんぜんちたいばん	全前置胎盤	ime	名詞
ぜんぜんのうしょう	全前脳症	both	名詞
ぜんぜんのうほうしょう	全前脳胞症	ime	名詞
ぜんそうしょくひ	全層植皮	mac	名詞
ぜんそうちゅうぞう	前装鋳造	ime	名詞
ぜんそうねっしょう	全層熱傷	mac	名詞
ぜんそうほうごう	全層縫合	mac	名詞
ぜんそく	喘息	both	名詞
ぜんそくい	全足位	ime	名詞
ぜんそくじゅうせきじょうたい	喘息重積状態	mac	名詞
ぜんそくせい	喘息性	ime	名詞
ぜんそくせいきかんしえん	喘息性気管支炎	ime	名詞
ぜんそくぶつう	前足部痛	ime	名詞
ぜんそくぶへんけい	前足部変形	ime	名詞
ぜんそくほっさ	喘息発作	mac	名詞
ぜんそくようのこきゅうこんなん	喘息様の呼吸困難	mac	名詞
ぜんぞうしょくせいとうにょうびょうせいもうまくしょう	前増殖性糖尿病性網膜症	ime	名詞
ぜんぞうしょくとうにょうびょうもうまくしょう	前増殖糖尿病網膜症	mac	名詞
ぜんぞうしょくもうまくしょう	前増殖網膜症	mac	名詞
ぜんぞうぜんげん	漸増漸減	mac	名詞
ぜんだいのうどうみゃく	前大脳動脈	both	名詞
ぜんだいのうどうみゃくかいり	前大脳動脈解離	ime	名詞
ぜんだいのうどうみゃくからのくもまくかしゅっけつ	前大脳動脈からのくも膜下出血	ime	名詞
ぜんだいのうどうみゃくきょうさく	前大脳動脈狭窄	ime	名詞
ぜんだいのうどうみゃくけっせんしょう	前大脳動脈血栓症	ime	名詞
ぜんだいのうどうみゃくしょうこうぐん	前大脳動脈症候群	ime	名詞
ぜんだいのうどうみゃくそくせんしょう	前大脳動脈塞栓症	ime	名詞
ぜんだいのうどうみゃくへいそくしょう	前大脳動脈閉塞症	ime	名詞
ぜんだいのうどうみゃくりゅう	前大脳動脈瘤	ime	名詞
ぜんだいのうどうみゃくりゅうはれつによるくもまくかしゅ	前大脳動脈瘤破裂によるくも膜下出血	ime	名詞
ぜんだつらくし	全脱落歯	ime	名詞
ぜんちかくどんま	全知覚鈍麻	ime	名詞
ぜんちけっかん	前置血管	ime	名詞
ぜんちけっかんからのたいじしっけつ	前置血管からの胎児失血	ime	名詞
ぜんちけっかんしんせいじ	前置血管新生児	ime	名詞
ぜんちけっかんたいじ	前置血管胎児	ime	名詞
ぜんちたいばん	前置胎盤	both	名詞
ぜんちつえんがい	前腟円蓋	mac	名詞
ぜんちつだつ	前腟脱	ime	名詞
ぜんちつだつ	前膣脱	ime	名詞
ぜんちゅう	蠕虫	mac	名詞
ぜんちゅうかんせつえん	全肘関節炎	ime	名詞
ぜんちゅうしょう	蠕虫症	ime	名詞
ぜんちゆちゃくたいばん	前置癒着胎盤	mac	名詞
ぜんちょう	前腸	mac	名詞
ぜんてい	前庭	mac	名詞
ぜんていえん	前庭炎	ime	名詞
ぜんていかい	前庭階	mac	名詞
ぜんていがためにえーるびょう	前庭型メニエール病	ime	名詞
ぜんていがんうんどうけい	前庭-眼運動系	mac	名詞
ぜんていがんはんしゃ	前庭眼反射	mac	名詞
ぜんていきのうしょうがい	前庭機能障害	ime	名詞
ぜんていきのうていか	前庭機能低下	ime	名詞
ぜんていきのうていかしょうこうぐん	前庭機能低下症候群	ime	名詞
ぜんていきのうふぜん	前庭機能不全	ime	名詞
ぜんていきゅう	前庭球	mac	名詞
ぜんていけい	前庭系	mac	名詞
ぜんていけいはんしゃ	前庭頚反射	mac	名詞
ぜんていしょうがい	前庭障害	ime	名詞
ぜんていしょうのう	前庭小脳	mac	名詞
ぜんていしんけい	前庭神経	both	名詞
ぜんていしんけいえん	前庭神経炎	both	名詞
ぜんていしんけいかく	前庭神経核	mac	名詞
ぜんていしんけいせつ	前庭神経節	mac	名詞
ぜんていしんけいせつさいぼう	前庭神経節細胞	mac	名詞
ぜんていしんけいや	前庭神経野	mac	名詞
ぜんていじりつしんけいけい	前庭-自律神経系	mac	名詞
ぜんていじりつしんけいはんしゃ	前庭自律神経反射	mac	名詞
ぜんていじんたい	前庭靱帯	mac	名詞
ぜんていすいかんかくだいしょう	前庭水管拡大症	ime	名詞
ぜんていすいかんかくちょうしょう	前庭水管拡張症	mac	名詞
ぜんていせい	前庭性	ime	名詞
ぜんていせいうんどうしっちょう	前庭性運動失調	ime	名詞
ぜんていせいうんどうしっちょうしょう	前庭性運動失調症	ime	名詞
ぜんていせいしっちょうしょう	前庭性失調症	ime	名詞
ぜんていせきずいけい	前庭-脊髄系	mac	名詞
ぜんていせきずいはんしゃ	前庭脊髄反射	mac	名詞
ぜんていせきずいろ	前庭脊髄路	mac	名詞
ぜんていせん	前庭腺	mac	名詞
ぜんていそう	前庭窓	mac	名詞
ぜんていどうがんはんしゃ	前庭動眼反射	mac	名詞
ぜんていはんしゃ	前庭反射	mac	名詞
ぜんていひだ	前庭ヒダ	mac	名詞
ぜんていぶ	前庭部	ime	名詞
ぜんていまく	前庭膜	mac	名詞
ぜんていめいろ	前庭迷路	ime	名詞
ぜんていめいろせい	前庭迷路性	mac	名詞
ぜんていゆうはつきんでんい	前庭誘発筋電位	mac	名詞
ぜんていれつ	前庭裂	mac	名詞
ぜんてき	全摘	mac	名詞
ぜんとうい	前頭位	both	名詞
ぜんとういぶんべん	前頭位分娩	ime	名詞
ぜんとうかく	前頭角	mac	名詞
ぜんとうがいか	前頭蓋窩	mac	名詞
ぜんとうがいかかいほうこっせつ	前頭蓋窩開放骨折	ime	名詞
ぜんとうがいかこっせつ	前頭蓋窩骨折	ime	名詞
ぜんとうがいてい	前頭蓋底	mac	名詞
ぜんとうがいていこっせつ	前頭蓋底骨折	both	名詞
